event_id,date,category,company,product,location,source,url,summary,title,funding_usd,hardware_name
6415e0ff-8d9c-4425-81c1-1e2fd88c0220,"Thu, 18 Ju",RESEARCH_BREAKTHROUGH,ThousandWorlds,,,arXiv cs.LG,https://arxiv.org/abs/2606.18338,"arXiv:2606.18338v1 Announce Type: new 
Abstract: The search for life beyond Earth will depend on detecting faint signatures in the atmospheres of potentially habitable exoplanets. Interpreting those signatures requires understanding the host planet's climate: the same molecule may signal life on ...",ThousandWorlds: A benchmark for climate emulation of potentially habitable exoplanets,,
6791236a-7da8-4e93-9328-31d9a3a9ba9b,"Thu, 18 Ju",MODEL_RELEASE,Modal,,,arXiv cs.LG,https://arxiv.org/abs/2606.18367,"arXiv:2606.18367v1 Announce Type: new 
Abstract: Standard benchmarks evaluate time series foundation models (TSFMs) using aggregate metrics, but these can mask severe failures in critical operating regimes. We introduce regime-stratified evaluation and apply it to three TSFMs on two standard traf...",Do Time Series Foundation Model Benchmarks Hide Regime-Dependent Failures? Evidence from Traffic Speed Forecasting,,
d9309a3c-04fe-45fa-abf5-5490b0523262,"Thu, 18 Ju",OTHER,OpenAI,,OpenAI,OpenAI Blog,https://openai.com/index/diagnose-rare-childhood-diseases,"Researchers used an OpenAI reasoning model to help diagnose rare diseases, identifying 18 new diagnoses in previously unsolved cases.",Using AI to help physicians diagnose rare genetic diseases affecting children,,
c16f2d2d-c554-4ab2-b065-39d7d7568486,"Thu, 18 Ju",OTHER,NVIDIA,,,NVIDIA Blog,https://blogs.nvidia.com/blog/nvidia-ai-marketing-advertising-cannes-lions/,"The digital era gave the advertising and marketing industry speed; the AI era is giving it autonomous operations. For companies building next-generation technologies for advertising and marketing, the question is no longer whether to adopt AI but whether their infrastructure can support it at the...","At Cannes Lions, NVIDIA Partners Reshape Advertising and Marketing With AI",,
e055721a-62df-4b2f-b844-78d887d79b22,"Thu, 18 Ju",OTHER,Sync,,Stream,NVIDIA Blog,https://blogs.nvidia.com/blog/geforce-now-thursday-game-stores/,"Play favorite titles from popular game libraries, keep progress synced and jump back into gaming sessions on virtually any device. That’s the power of GeForce NOW cloud gaming.",Sync and Stream: GeForce NOW Connects to Members’ Game Libraries Across Devices,,
3f7fe892-f530-40f7-a1ee-79a0b555019d,"Thu, 18 Ju",OTHER,NVIDIA,,VivaTech,NVIDIA Blog,https://blogs.nvidia.com/blog/france-advances-europes-ai-future/,"A year ago at NVIDIA GTC Paris at VivaTech, France laid out plans to advance local AI — from new AI factories and national compute capacity to open frontier models and industrial platforms. Now, that AI infrastructure is coming online.",France Advances Europe’s AI Future With NVIDIA Technologies,,
942608b5-768d-4ce8-ae16-f90f300135cb,"Thu, 18 Ju",OTHER,Scale AI,,,OpenAI Blog,https://openai.com/index/chatgpt-enterprise-spend-controls,"OpenAI introduces new spend controls and usage analytics for ChatGPT Enterprise, helping organizations manage costs and scale AI with confidence.",New usage analytics and updated spend controls for enterprises,,
9ce72597-bbf2-489c-830b-1d51c34639c4,"Thu, 18 Ju",MODEL_RELEASE,Intel,GPT-5,,OpenAI Blog,https://openai.com/index/improving-health-intelligence-in-chatgpt,"Learn how GPT-5.5 Instant improves ChatGPT’s health and wellness responses with stronger reasoning, better context, clearer communication, and physician-informed evaluations.",Improving health intelligence in ChatGPT,,
fab18036-e682-4d2b-aeb9-9f5820e7caf1,"Thu, 18 Ju",OTHER,NVIDIA,,,NVIDIA Blog,https://blogs.nvidia.com/blog/ferc-large-load-interconnection/,"In a consequential grid infrastructure decision, the Federal Energy Regulatory Commission (FERC) today issued a major milestone on large-load interconnection impacting how those building AI factories, semiconductor fabrication support systems and advanced manufacturing facilities can connect to t...","How FERC’s Large-Load Interconnection Actions Help Address Grid Stress, Improve Affordability",,
f593fd2b-de4c-495c-9719-1e2c5263faac,"Thu, 18 Ju",OTHER,Amazon,,,AWS ML Blog,https://aws.amazon.com/blogs/machine-learning/monitor-and-debug-generative-ai-inference-with-sagemaker-detailed-metrics-and-insights-dashboard-on-cloudwatch/,"Amazon SageMaker AI provides fully managed real-time inference hosting for machine learning models. You deploy a model to a SageMaker endpoint backed by one or more compute instances, and SageMaker handles provisioning and scaling.",Monitor and debug generative AI inference with SageMaker detailed metrics and Insights dashboard on CloudWatch,,
63c402b2-6242-477d-afeb-68dd43c7d136,"Thu, 18 Ju",SERVICE_UPDATE,Amazon,,,AWS ML Blog,https://aws.amazon.com/blogs/machine-learning/amazon-bedrock-agentcore-harness-is-now-generally-available-go-from-idea-to-production-grade-agent-in-minutes/,"Today, Amazon Bedrock AgentCore harness is generally available. Two API calls (CreateHarness to define an agent, and InvokeHarness to run it), and you have an agent running in seconds.",Amazon Bedrock AgentCore harness is now generally available: Go from idea to production-grade agent in minutes,,
594c7f8d-a69e-4e17-924b-6ada98db13f0,"Thu, 13 Fe",DATACENTER_EXPANSION,,,,TechCrunch AI,https://techcrunch.com/2025/02/13/data-center-tweaks-could-unlock-76-gw-of-new-power-capacity-in-the-u-s/,A new study argues that data centers could be ideal demand-response participants because they have the potential to be flexible.,Data center tweaks could unlock 76 GW of new power capacity in the US,,
1370751d-61f3-4323-8823-c2fb491400c7,"Thu, 11 Ju",OTHER,OpenAI,,,OpenAI Blog,https://openai.com/index/supporting-eu-trustworthy-ai-ecosystem,"OpenAI supports the EU Code of Practice on AI content transparency, advancing provenance standards and tools to help people understand AI-generated content.",Supporting Europe’s work in ensuring a trustworthy AI ecosystem,,
38faae00-8983-4f3b-a59a-ffadb349597f,"Thu, 11 Ju",OTHER,OpenAI,,,OpenAI Blog,https://openai.com/index/bbva,"Learn how BBVA scaled ChatGPT Enterprise to 100,000 employees and partnered with OpenAI to accelerate AI-powered banking transformation worldwide.",BBVA puts AI at the core of banking with OpenAI,,
5ea2d826-cc78-40b2-abc5-9a03a73265ed,"Thu, 11 Ju",OTHER,,,,OpenAI Blog,https://openai.com/index/using-codex-to-simulate-black-holes,"Discover how astrophysicist Chi-kwan Chan uses Codex to build black hole simulations, helping scientists study extreme physics and test Einstein’s theory of general relativity.",How an astrophysicist uses Codex to help simulate black holes,,
39b55b64-b5d1-4123-97e6-879eb3df98b6,"Thu, 11 Ju",OTHER,OpenAI,,,OpenAI Blog,https://openai.com/index/openai-to-acquire-ona,"OpenAI plans to acquire Ona to expand Codex with secure, persistent cloud environments, enabling long-running AI agents across enterprise workflows.",OpenAI to acquire Ona,,
bdbde379-c520-4a51-bbca-c5221d3aae4b,"Thu, 11 Ju",OTHER,,,,NVIDIA Blog,https://blogs.nvidia.com/blog/geforce-now-thursday-summer-sale-2026/,"The GeForce NOW summer sale kicked off today with limited-time savings of up to $70 off a 12-month membership, making now the perfect time to upgrade to get the best of the cloud and see just how far Ultimate gaming can go. PC gamers are driven by one thing: the love of the game.",Save Big and Play Bigger: GeForce NOW Summer Sale Brings Major Membership Savings,,
00621951-2af7-4ed3-bba0-11f586c0d0a1,"Thu, 11 Ju",OTHER,Amazon,,,AWS ML Blog,https://aws.amazon.com/blogs/machine-learning/extract-data-with-on-demand-and-batch-pipelines-dynamically/,This post demonstrates an intelligent document processing pipeline that consists of both on-demand inference and batch inference options on Amazon Bedrock to enable the flexibility on the document processing time and cost.,Extract Data with On-demand and Batch Pipelines Dynamically,,
6976d98b-eafc-4861-8302-f125c8842a1c,"Thu, 11 Ju",MODEL_RELEASE,Amazon,Claude,,AWS ML Blog,https://aws.amazon.com/blogs/machine-learning/evaluate-ai-agents-systematically-with-agent-evalkit/,"Agent-EvalKit is an open-source toolkit (Apache 2.0) that makes this evaluation infrastructure available by integrating with AI coding assistants, including Claude Code, Kiro CLI, and Kilo Code. This post walks through how Agent-EvalKit works across its six evaluation phases, using a travel resea...",Evaluate AI agents systematically with Agent-EvalKit,,
a79a8637-a38a-49c8-9d57-156e97c24703,"Thu, 11 Ju",OTHER,Amazon,,,AWS ML Blog,https://aws.amazon.com/blogs/machine-learning/spot-trends-faster-sort-smarter-unlocking-sparklines-and-custom-sort-in-amazon-quick/,"Today, we’re excited to announce two new capabilities that make Quick Sight dashboards even more expressive and business-aligned: sparklines and custom sort for controls. In this post, we walk through both features, what they are, when to use them, and how to configure them, with real-world scena...","Spot trends faster, sort smarter: Unlocking Sparklines and Custom Sort in Amazon Quick",,
b03b07ee-8342-4322-9bbd-b2cd26a43f3d,"Thu, 11 Ju",OTHER,Amazon,,,AWS ML Blog,https://aws.amazon.com/blogs/machine-learning/optimize-blueprint-extraction-accuracy-in-amazon-bedrock-data-automation/,"Blueprint instruction optimization is a BDA feature that automatically refines your extraction instructions to address this challenge directly. You provide three to ten example documents with expected values, and BDA refines your blueprint instructions to improve accuracy in minutes, not weeks.",Optimize blueprint extraction accuracy in Amazon Bedrock Data Automation,,
b5a80bd1-b397-405a-b8f6-943910cf01be,"Thu, 11 Ju",OTHER,,,,AWS ML Blog,https://aws.amazon.com/blogs/machine-learning/how-frontier-teams-are-reinventing-ai-native-development/,Frontier teams are not just using AI to code faster. They’re redesigning how software gets built.,How frontier teams are reinventing AI-native development,,
efebdd6e-967b-412a-84b2-bd4990369019,"Thu, 11 Ju",OTHER,Microsoft,,,Azure AI Blog,https://azure.microsoft.com/en-us/blog/3-things-leaders-need-to-know-from-microsoft-build-2026/,"<p>At Microsoft Build 2026, AI moved from experimentation to execution—shifting from isolated tools to connected systems grounded in business data. Organizations that win will embed AI across workflows, scale it effectively, and translate it into measurable outcomes like faster growth, lower cost...",3 things leaders need to know from Microsoft Build 2026,,
3bbe092e-9a9e-49a5-8a76-262074a56502,"Thu, 04 Ju",OTHER,,,,OpenAI Blog,https://openai.com/index/endava-frontiers,"Learn how Endava is using AI agents, ChatGPT Enterprise, and Codex to accelerate software delivery, automate workflows, and build an AI-native culture across the enterprise.",How Endava is redesigning software delivery around AI agents,,
e51ff649-326b-43c6-8625-4889fa559ee2,"Thu, 04 Ju",OTHER,,,,OpenAI Blog,https://openai.com/index/chatgpt-memory-dreaming,"ChatGPT introduces a new memory system to better remember preferences, keeping context fresh and relevant across conversations.",Dreaming: Better memory for a more helpful ChatGPT,,
303234d5-4b0e-43aa-9884-576447b11591,"Thu, 04 Ju",OTHER,Intel,,,OpenAI Blog,https://openai.com/index/biodefense-in-the-intelligence-age,An action plan for AI-powered biological resilience,Biodefense in the Intelligence Age,,
425be50e-c3f6-459f-af68-ca7351eccff0,"Thu, 04 Ju",OTHER,,,,NVIDIA Blog,https://blogs.nvidia.com/blog/geforce-now-thursday-june-2026-games-list/,"June’s forecast with GeForce NOW: 100% chance of gaming. GeForce NOW is lining up new adventures for the month, from big-name blockbusters to quirky indies ready for the spotlight.",Forecast: Fun Ahead — 18 Games Join in June to Stream on GeForce NOW,,
8a3109c6-cf57-4e57-b6f8-1aac1d5ad170,"Sun, 30 Ma",OTHER,,,,TechCrunch AI,https://techcrunch.com/2025/03/30/data-centers-love-solar-heres-a-comprehensive-guide-to-deals-over-100-megawatts/,New and expanded data centers are expected to double the sector’s power demand by 2029 as tech companies rush to capitalize on AI.,Data centers love solar: Here’s a comprehensive guide to deals over 100 megawatts,,
30d10f04-e557-45a6-af2d-c1f81dcf800a,"Sun, 21 Ju",OTHER,OpenAI,,OpenAI,OpenAI Blog,https://openai.com/index/samsung-electronics-chatgpt-codex-deployment,"Samsung Electronics deploys ChatGPT Enterprise and Codex to employees worldwide, marking one of OpenAI’s largest enterprise AI rollouts.",Samsung Electronics brings ChatGPT and Codex to employees,,
94bc80ca-4574-4a9f-95af-31a186871665,"Sun, 17 Ma",OTHER,Google,,,Google DeepMind,https://deepmind.google/blog/simulate-real-world-places-with-project-genie-and-street-view/,We’re expanding access to Google AI Ultra subscribers globally and introducing a new capability powered by Street View.,Simulate real-world places with Project Genie and Street View,,
7bd69dd5-1778-4f88-a3d6-b8ccd4e2ffb6,"Sun, 17 Ma",MODEL_RELEASE,,Gemini,,Google DeepMind,https://deepmind.google/blog/introducing-gemini-omni/,Introducing Gemini Omni,Introducing Gemini Omni,,
22e0bbe9-107b-480e-9793-5b37a508b2f9,"Sun, 17 Ma",OTHER,Google,,,Google DeepMind,https://deepmind.google/blog/introducing-google-antigravity-2-0/,Introducing Google Antigravity 2.0,Introducing Google Antigravity 2.0,,
87aaf9ed-e9ac-4194-b432-2a970f8bfb1b,"Sun, 17 Ma",MODEL_RELEASE,,Gemini,,Google DeepMind,https://deepmind.google/blog/gemini-for-science-ai-experiments-and-tools-for-a-new-era-of-discovery/,A collection of science tools and experiments to expand the scale and precision of scientific exploration.,Gemini for Science: AI experiments and tools for a new era of discovery,,
06d63556-3907-4489-a0fe-d58d92305230,"Sun, 17 Ma",OTHER,,,,Google DeepMind,https://deepmind.google/blog/making-it-easier-to-understand-how-content-was-created-and-edited/,We're expanding our tools to help you understand how content was created and edited across the web.,Making it easier to understand how content was created and edited,,
96305be7-4d86-41ba-852b-19cc1bf84f3a,"Sun, 14 Ju",OTHER,OpenAI,,,OpenAI Blog,https://openai.com/index/introducing-openai-partner-network,"OpenAI launches the Partner Network, investing $150M to help global partners accelerate enterprise AI adoption, deployment, and transformation.",Introducing the OpenAI Partner Network,,
3f9257c8-c9f0-47a6-93b8-2ec725c55a52,"Sun, 07 Ju",OTHER,NVIDIA,,,NVIDIA Blog,https://blogs.nvidia.com/blog/nvidia-and-doosan-group-physical-ai/,"NVIDIA and Doosan Group are expanding their collaboration to advance new opportunities across physical AI, robotics and AI factory infrastructure, spanning Doosan Robotics, Doosan Bobcat, Doosan Enerbility and Doosan Corporation Electro-Materials BG. The collaboration will bring together NVIDIA’s...",NVIDIA and Doosan Group Collaborate to Advance Physical AI and AI Factory Infrastructure,,
4ed0264f-a348-4368-9679-d3bc059c0df1,"Sun, 07 Ju",OTHER,NVIDIA,,,NVIDIA Blog,https://blogs.nvidia.com/blog/krafton-nc-t1-korea-gaming-pc-bang-rtx-spark/,"At GTC Taipei at COMPUTEX last week, NVIDIA unveiled RTX Spark, the superchip that reinvents Windows PCs for the era of personal AI agents. On the heels of this announcement, NVIDIA founder and CEO Jensen Huang headed to South Korea, where he introduced RTX Spark to the nation’s passionate gaming...","NVIDIA, KRAFTON, NC and Reigning ‘League of Legends’ Champions T1 Celebrate RTX Spark at Korea’s PC Bangs",,
1254e51b-b33a-4752-ab76-cb1d80968df3,"Sat, 16 Ma",OTHER,Google DeepMind,,,Google DeepMind,https://deepmind.google/blog/strengthening-singapores-ai-future-a-new-national-partnership/,"Google DeepMind and Singapore partner to apply frontier AI to address complex challenges across health, education, and sustainability and more.",Strengthening Singapore’s AI Future: A New National Partnership,,
50053e1c-8b3f-4eae-bc01-989de39a3205,"Sat, 16 Ma",OTHER,,,,Google DeepMind,https://deepmind.google/blog/finding-the-molecular-switches-behind-new-infectious-diseases/,Clare Bryant uses Co-Scientist to identify genetic triggers in emerging infectious diseases.,Finding the molecular switches behind new infectious diseases,,
da87f105-45f8-4727-881e-a6cfa174d2b7,"Sat, 16 Ma",OTHER,,,,Google DeepMind,https://deepmind.google/blog/opening-new-paths-in-aging-research/,Calico Life Sciences uses Co-Scientist to connect scattered findings and generate new leads in aging research.,Opening new paths in aging research,,
bd8f588c-0453-41dc-8fb0-dbefd6cc8927,"Sat, 16 Ma",OTHER,,,,Google DeepMind,https://deepmind.google/blog/accelerating-discovery-of-liver-disease-mechanisms/,Filippo Menolascina uses Co-Scientist to identify new liver disease treatments and explain why existing drugs only help certain patients.,Accelerating discovery of liver disease mechanisms,,
9651b044-173c-4ece-942d-9732bc2c4ea1,"Sat, 16 Ma",OTHER,,,,Google DeepMind,https://deepmind.google/blog/uniting-biological-toolkits-for-a-new-approach-to-als/,Co-Scientist unites Boston Children’s Hospital and MIT’s labs to explore new RNA-based treatments for ALS.,Uniting biological toolkits for a new approach to ALS,,
08c64f44-68dc-47fa-93ef-751fffca90a7,"Sat, 16 Ma",OTHER,,,,Google DeepMind,https://deepmind.google/blog/uncovering-repurposed-medicines-to-fight-liver-fibrosis/,Stanford geneticist uses Co-Scientist to help find new treatments for chronic liver disease and liver fibrosis.,Uncovering repurposed medicines to fight liver fibrosis,,
47a2a1ae-aeda-484a-9247-fc634e3d1589,"Sat, 16 Ma",OTHER,,,,Google DeepMind,https://deepmind.google/blog/how-weathernext-helped-the-national-hurricane-center-better-predict-hurricane-melissas-historic-landfall-in-jamaica/,Learn how our WeatherNext AI model help forecasters give communities unprecedented time to prepare ahead of  the historic Hurricane Melissa.,How WeatherNext helped the National Hurricane Center better predict Hurricane Melissa’s historic landfall in Jamaica,,
3237d0f0-ab8d-484e-8948-965434d86269,"Mon, 27 Ap",DATACENTER_EXPANSION,,,,TechCrunch AI,https://techcrunch.com/2026/04/27/data-center-demand-drives-66-surge-in-natural-gas-power-plant-costs/,Natural gas power plant costs have nearly doubled in two years and take 23% longer to build as data center electricity demand skyrockets.,Data center demand drives 66% surge in natural gas power plant costs,,
b12739c6-5b2f-4665-9f24-80333daff710,"Mon, 22 Ju",OTHER,OpenAI,,OpenAI,OpenAI Blog,https://openai.com/index/patch-the-planet,"OpenAI introduces Patch the Planet, a Daybreak initiative helping open-source maintainers find, validate, and fix vulnerabilities with AI and expert review.",Patch the Planet: a Daybreak initiative to support open source maintainers,,
a495359a-aca7-4823-90dd-e1b5f963ff93,"Mon, 22 Ju",MODEL_RELEASE,OpenAI,GPT-5,OpenAI,OpenAI Blog,https://openai.com/index/daybreak-securing-the-world,"OpenAI introduces new Daybreak tools, including Codex Security and GPT-5.5-Cyber, to help organizations find, validate, and patch vulnerabilities at scale.",Daybreak: Tools for securing every organization in the world,,
5b0868ed-6f28-4811-bbb9-1c141c298073,"Mon, 22 Ju",OTHER,NVIDIA,,Germany,NVIDIA Blog,https://blogs.nvidia.com/blog/jupiter-exascale-supercomputing-science/,"JUPITER, Europe’s first exascale supercomputer at Germany’s Forschungszentrum Jülich, runs on NVIDIA Grace Hopper Superchips and NVIDIA Quantum-X800 InfiniBand networking — and it’s had a busy year. As the international supercomputing community gathers at ISC in Hamburg this week, four projects r...","At ISC, JUPITER Shows What Exascale Science Looks Like",,
c3703ea4-2d11-48be-96fc-d2f22fbb8035,"Mon, 22 Ju",OTHER,NVIDIA,,U.S.,NVIDIA Blog,https://blogs.nvidia.com/blog/nairr-scientific-research-ai-infrastructure/,"For the past two years, the U.S. National Science Foundation’s National Artificial Intelligence Research Resource (NAIRR) pilot program has driven innovative research across the U.S.","NAIRR Science Program Reshapes Scientific Research, Powered by NVIDIA AI Infrastructure",,
099af788-99b2-4029-a83b-fb3050018f53,"Mon, 22 Ju",OTHER,NVIDIA,,Hamburg,NVIDIA Blog,https://blogs.nvidia.com/blog/ai-for-science-software-cuda/,"At the ISC conference running in Hamburg this week, NVIDIA is introducing new software that speeds AI for science, from chemistry and materials discovery to the search for dark matter. The NVIDIA DAQIRI library and new NVIDIA ALCHEMI NIM microservices — as well as the NVIDIA cuPhoton reference co...","From Materials Simulation to Experimental Astronomy, New NVIDIA AI Software Unlocks Scientific Discoveries",,
54e2493c-45e3-433b-8cad-2b3cdc8d1477,"Mon, 22 Ju",OTHER,NVIDIA,,,NVIDIA Blog,https://blogs.nvidia.com/blog/nvidia-vera-cpu-los-alamos-national-laboratory/,"Mission, Vision and Veritas — new Los Alamos National Laboratory (LANL) supercomputers to be built with HPE and NVIDIA — are tapping NVIDIA Vera CPUs to accelerate scientific discovery, unlocking agentic AI for science. The supercomputers will use the HPE Cray Supercomputing GX5000 architecture w...",NVIDIA Vera CPU Opens the Way for Agentic Scientific AI at Los Alamos National Laboratory,,
651cdb47-908b-4392-bbd4-fe01d87b071a,"Mon, 22 Ju",OTHER,NVIDIA,,,NVIDIA Blog,https://blogs.nvidia.com/blog/eco-wave-power-ai-digital-twins/,The next era of AI will not be defined by compute alone. Its growth will be determined by energy.,Eco Wave Power Turns Waves Into Watts With NVIDIA AI Infrastructure and Digital Twins,,
f96adfb2-dadb-4edf-b575-6a630a6f6506,"Mon, 22 Ju",RESEARCH_BREAKTHROUGH,NVIDIA,,C Breakthrough to Cool AI’s,NVIDIA Blog,https://blogs.nvidia.com/blog/liquid-cooling-ai-factories/,"Hot tubs sit at about 38 to 40 degrees Celsius, warm enough that most people can only soak for about 15 minutes. NVIDIA’s newest AI servers can run their cooling liquid even hotter — up to 45 degrees Celsius, or 113 degrees Fahrenheit.",Hotter Than a Hot Tub: The 45°C Breakthrough to Cool AI’s Biggest Machines,,
46309169-42d6-4a71-9db0-86b0397f6255,"Mon, 22 Ju",RESEARCH_BREAKTHROUGH,Amazon,,,AWS ML Blog,https://aws.amazon.com/blogs/machine-learning/embed-the-world-multimodal-ai-for-searchable-aerial-imagery-at-scale/,"In this post, we walk through the problem space, our architecture on Amazon Bedrock and Amazon OpenSearch Serverless, the evaluation methodology we built on OpenStreetMap ground truth, four experiments that compared embedding models, fusion strategies, captioning, and search methods, and the prac...",Embed the world: Multimodal AI for searchable aerial imagery at scale,,
a786838b-6f97-4f8f-acc3-39df85c35864,"Mon, 22 Ju",GPU_RELEASE,Amazon,,,AWS ML Blog,https://aws.amazon.com/blogs/machine-learning/running-comfyui-workflows-on-amazon-sagemaker-ai-processing-jobs/,"In this post, we walk you through how to deploy ComfyUI workflows on Amazon SageMaker AI processing jobs to generate hundreds of high-quality images in a single batch. You learn how to set up the infrastructure using AWS Cloud Development Kit (AWS CDK), configure GPU-accelerated processing, and a...",Running ComfyUI workflows on Amazon SageMaker AI processing jobs,,
e8e0fd43-3a47-4bca-9f13-7b909d8b29ac,"Mon, 22 Ju",OTHER,,,,OpenAI Blog,https://openai.com/index/codex-maxxing-long-running-work,"Learn how Jason Liu uses Codex to preserve context, manage complex projects, and help work continue beyond a single prompt.",Codex-maxxing for long-running work,,
d20ae442-11e0-4fb8-904d-fdbcad05640c,"Mon, 22 Ju",OTHER,Amazon,,,AWS ML Blog,https://aws.amazon.com/blogs/machine-learning/building-pay-per-intelligence-for-ai-agents-how-ampersend-uses-amazon-bedrock-agentcore-payments/,"In this post, you will learn how Ampersend built a pay-per-intelligence routing layer on top of Amazon Bedrock AgentCore Payments. AI agents autonomously route tasks to the most effective model, pay per request, and operate within spending budgets.",Building pay-per-intelligence for AI agents: How Ampersend uses Amazon Bedrock AgentCore Payments,,
060991ed-9f94-4f8f-8269-f9bb397a8073,"Mon, 19 Ja",OUTAGE,Anthropic,Claude 4,,VentureBeat AI,https://venturebeat.com/infrastructure/claude-code-costs-up-to-usd200-a-month-goose-does-the-same-thing-for-free,"<p>The artificial intelligence coding revolution comes with a catch: it&#x27;s expensive.</p><p><a href=""https://claude.com/product/claude-code"">Claude Code</a>, Anthropic&#x27;s terminal-based AI agent that can write, debug, and deploy code autonomously, has captured the imagination of software ...",Claude Code costs up to $200 a month. Goose does the same thing for free.,,
9e804016-1786-4a31-834b-3108693d1c04,"Mon, 18 Ma",OTHER,,,,Google DeepMind,https://deepmind.google/blog/fast-tracking-genetic-leads-to-reverse-cellular-aging/,Biologists use Co-Scientist to find novel factors that successfully rejuvenate human cells.,Fast-tracking genetic leads to reverse cellular aging,,
c9a1e3de-db54-4d6f-ae0f-dad650cceb7a,"Mon, 15 Ju",RESEARCH_BREAKTHROUGH,Meta,,,arXiv cs.AI,https://arxiv.org/abs/2606.13682,"arXiv:2606.13682v1 Announce Type: new 
Abstract: The open shop scheduling problem (OSSP) arises in many industrial and service settings but remains computationally challenging as the number of jobs and machines increases. While exact methods quickly become intractable, classical dispatching rules...",A Deep Reinforcement Learning (DRL)-Based Transformer Method for Solving the Open Shop Scheduling Problem,,
