event_id,date,category,company,product,location,source,url,summary,title,funding_usd,hardware_name
7a9e9a2a-3c53-4249-a52b-e8438d9c78c4,"Wed, 26 Fe",FUNDING_EVENT,,,,TechCrunch AI,https://techcrunch.com/2025/02/25/elevenlabs-is-now-letting-authors-create-and-publish-audiobooks-on-its-own-platform/,"Voice AI company ElevenLabs is now letting authors publish AI-generated audiobooks on its own Reader app, TechCrunch has learned and the company confirmed. The announcement comes days after the company partnered with Spotify for AI-narrated audiobooks.",ElevenLabs now lets authors create and publish audiobooks on its own platform,180000000,
aa01b982-1f1d-498b-bad1-c0c064d4fa2a,"Wed, 24 Ju",GPU_RELEASE,NVIDIA,,,NVIDIA Blog,https://blogs.nvidia.com/blog/nvidia-aws-ai-production-scale/,"Building AI systems at scale is demanding, requiring low-latency inference, fast vector search, strong GPU price-performance and infrastructure that can grow without multiplying operational complexity. NVIDIA’s latest work with Amazon Web Services (AWS) addresses each of those constraints.",NVIDIA and AWS Collaborate to Bring AI to Production at Scale,,
3f4737a7-162a-49b6-9c31-d9ebe8dfbb7c,"Wed, 24 Ju",MODEL_RELEASE,RIFT-Bench: Dynamic Red-teaming,,Scanning,arXiv cs.AI,https://arxiv.org/abs/2606.23927,"arXiv:2606.23927v1 Announce Type: new 
Abstract: Agentic AI systems powered by large language models (LLMs) are rapidly evolving into autonomous decision-making systems, exposing attack vectors beyond those of traditional LLM vulnerabilities. Existing security evaluations are often tied to specif...",RIFT-Bench: Dynamic Red-teaming For Agentic AI Systems,,
2207cc9b-f770-41f5-bb53-1bf41c248d94,"Wed, 24 Ju",RESEARCH_BREAKTHROUGH,CoT,Qwen,,arXiv cs.AI,https://arxiv.org/abs/2606.23938,"arXiv:2606.23938v1 Announce Type: new 
Abstract: Driving VLA models incorporating Chain-of-Thought (CoT) reasoning are attractive because they leverage pretrained VLM representations and expose intermediate decisions in natural language, yet current rationales often lack the step-by-step decision...",Neuro-Symbolic Drive: Rule-Grounded Faithful Reasoning for Driving VLAs,,
1d6ebb3e-9655-4773-b7e0-87720407259d,"Wed, 24 Ju",MODEL_RELEASE,Large Language Model,,Descartes,arXiv cs.AI,https://arxiv.org/abs/2606.23991,"arXiv:2606.23991v1 Announce Type: new 
Abstract: What is an agent? What constitutes agency?",Critique of Agent Model,,
a23cb13c-85f1-44d0-ba4f-00bbec20d0c4,"Wed, 24 Ju",RESEARCH_BREAKTHROUGH,Constraint Manifold,,,arXiv cs.AI,https://arxiv.org/abs/2606.24010,"arXiv:2606.24010v1 Announce Type: new 
Abstract: Multi-agent systems are widely used in safety-critical applications that require coordinated behavior under strict safety constraints. Existing approaches face a fundamental trade-off: learning-based methods achieve strong empirical performance but...",Safe and Generalizable Hierarchical Multi-Agent RL via Constraint Manifold Control,,
c4e138f8-53c3-4836-9603-93ce2bd6ba68,"Wed, 24 Ju",RESEARCH_BREAKTHROUGH,Reinforcement Learning Towards Broadly,,,arXiv cs.AI,https://arxiv.org/abs/2606.24014,"arXiv:2606.24014v1 Announce Type: new 
Abstract: As AI systems are deployed across increasingly diverse and high-stakes settings, model alignment must generalize beyond the tasks and domains seen during training. This is especially important for reinforcement learning (RL), which can introduce un...",Reinforcement Learning Towards Broadly and Persistently Beneficial Models,,
c0cdd30a-c1ee-4d9d-a0a7-775e1b31d589,"Wed, 24 Ju",MODEL_RELEASE,HyVE,Llama,Explain,arXiv cs.AI,https://arxiv.org/abs/2606.24026,"arXiv:2606.24026v1 Announce Type: new 
Abstract: Mechanistic interpretability has made substantial progress in automatically localizing circuits, but explaining what localized components do remains labor-intensive and difficult to standardize. In this work, we study whether language model (LM) ag...",Can Language Model Agents be Helpful Circuit Explainers in Mechanistic Interpretability?,,
1a90199e-3dcd-4f83-99a7-2f0a37a54f95,"Wed, 24 Ju",RESEARCH_BREAKTHROUGH,,,,arXiv cs.AI,https://arxiv.org/abs/2606.24042,"arXiv:2606.24042v1 Announce Type: new 
Abstract: Recommender systems often induce filter bubbles and semantic homogenization by monolithically optimizing for immediate user engagement. Standard single-objective models, including traditional Deep Q-Networks, are ill-equipped to navigate the trade-...",Breaking the Filter Bubble: A Semantic Pareto-DQN Framework for Multi-Objective Recommendation,,
dffa6389-aa2a-4e40-b269-75754ef3670a,"Wed, 24 Ju",RESEARCH_BREAKTHROUGH,Intel,,,arXiv cs.AI,https://arxiv.org/abs/2606.24047,"arXiv:2606.24047v1 Announce Type: new 
Abstract: One of the significant mental health issues affecting female sex workers (FSWs) is mental disorders, especially depression. Exposure to violence, stigma, and economic hardship further increases their psychological risk.",Ensemble Feature Selection and Harris Hawks Optimization for Explainable Mental Health Risk Prediction in Female Sex Workers,,
b9bbba85-0329-402f-b2e3-371b08f1392d,"Wed, 24 Ju",FUNDING_EVENT,Beyond Trajectory Imitation,Qwen,,arXiv cs.AI,https://arxiv.org/abs/2606.24064,"arXiv:2606.24064v1 Announce Type: new 
Abstract: Distilling reasoning capabilities from strong to weak language models typically involves imitating specific solution trajectories, effectively transferring what to answer rather than how to reason. This trajectory-level imitation encourages memoriz...",Beyond Trajectory Imitation: Strategy-Guided Policy Optimization for LLM Reasoning,,
447dbb42-e186-4c2a-9fba-b4fb4e4475aa,"Wed, 24 Ju",RESEARCH_BREAKTHROUGH,Intel,,,arXiv cs.AI,https://arxiv.org/abs/2606.24099,"arXiv:2606.24099v1 Announce Type: new 
Abstract: Algorithms have become central to scientific research in the era of artificial intelligence (AI). Although algorithm mentions in papers are often used to indicate popularity and influence, existing studies usually evaluate individual algorithms in ...",Exploring Academic Influence of Algorithms by Co-occurrence Network Based on Full-text of Academic Papers,,
e9c364b9-26d1-493c-b3d0-22bbf0db807e,"Wed, 24 Ju",MODEL_RELEASE,Modal,GPT-5,,arXiv cs.AI,https://arxiv.org/abs/2606.24112,"arXiv:2606.24112v1 Announce Type: new 
Abstract: Multimodal misinformation detection is increasingly important because viral posts now combine long multilingual narratives, several images, mixed provenance, and subtle text--image framing errors. Existing benchmarks and methods remain poorly match...",ReMMD: Realistic Multilingual Multi-Image Agentic Verification for Multimodal Misinformation Detection,,
a29cdb47-10fd-4791-86f7-960886d7d8ce,"Wed, 24 Ju",MODEL_RELEASE,CoT,,,arXiv cs.AI,https://arxiv.org/abs/2606.24124,"arXiv:2606.24124v1 Announce Type: new 
Abstract: Multi-step reasoning with Chain-of-Thought (CoT) prompting remains fragile: logical errors or hallucinations in early steps silently propagate, producing confident but incorrect conclusions. This paper presents VeryTrace, a zero-shot verification-a...",VeryTrace: Verifying Reasoning Traces through Compilable Formalism and Structured Verification,,
ba5c79cc-8929-414a-b8a7-175ecd26fe53,"Wed, 24 Ju",RESEARCH_BREAKTHROUGH,Modal,,,arXiv cs.AI,https://arxiv.org/abs/2606.24129,"arXiv:2606.24129v1 Announce Type: new 
Abstract: For a wheelchair user, a standard blue line on a map is often a broken promise. While platforms like OpenStreetMap (OSM) successfully capture where a path is, they frequently fail to convey how it physically feels to travel on it.",OmniPath: A Multi-Modal Agentic Framework for Auditing Wheelchair Accessibility,,
16e7aa87-1b17-4c6c-816e-7c633927d839,"Wed, 24 Ju",MODEL_RELEASE,LLM,GPT-4o,,arXiv cs.AI,https://arxiv.org/abs/2606.24145,"arXiv:2606.24145v1 Announce Type: new 
Abstract: Large language models (LLMs) can produce clinically fluent recommendations for type 2 diabetes while failing to satisfy guideline constraints or explicitly justify lifestyle-related glycemic claims. We present T2D-Bench, a reproducible benchmark an...",T2D-Bench: Evidence-Gated Evaluation of LLM Outputs for Type 2 Diabetes Using a Multi-Layer Clinical-Lifestyle Knowledge Graph,,
ab19b22f-266c-4c08-ad21-c9c895940501,"Wed, 24 Ju",RESEARCH_BREAKTHROUGH,The Geometry Behind Diffusion and Flow Matching:,,KL(rho,arXiv cs.AI,https://arxiv.org/abs/2606.24157,"arXiv:2606.24157v1 Announce Type: new 
Abstract: The space $\mathcal{P}_2(\mathbb{R}^d$) of probability measures with finite second moment carries a natural geometry: the quadratic Wasserstein distance W_2 makes it a complete metric space and, following Otto, a (formal) Riemannian manifold whose ...",The Geometry Behind Diffusion and Flow Matching: Gradient Flows and Geodesics in Wasserstein Space,,
27a81772-ddc6-499d-9c1a-452b269b8102,"Wed, 24 Ju",RESEARCH_BREAKTHROUGH,Modal,,,arXiv cs.AI,https://arxiv.org/abs/2606.24160,"arXiv:2606.24160v1 Announce Type: new 
Abstract: Causal inference provides a set of principles and tools that allow one to combine data and knowledge about an environment to reason with questions of counterfactual nature, i.e., what would have happened had reality been different, even when no dat...",An Introduction to Causal Reinforcement Learning,,
1516de81-a1ca-45ce-ad07-25a860c94024,"Wed, 24 Ju",OUTAGE,Shapes Cross-Lingual,,,arXiv cs.AI,https://arxiv.org/abs/2606.24169,"arXiv:2606.24169v1 Announce Type: new 
Abstract: Adapting a streaming speech recognition model to a new language requires choosing between two plausible warm starts: a multilingual (ML) encoder or an English-only (EN) encoder. The common intuition is that the multilingual encoder should help most...","Data Scale, Not Latency, Shapes Cross-Lingual Encoder Transfer in Streaming ASR",,
baa002d7-2864-41dd-b639-e8acd7ce937a,"Wed, 24 Ju",RESEARCH_BREAKTHROUGH,Modal,,,arXiv cs.AI,https://arxiv.org/abs/2606.24196,"arXiv:2606.24196v1 Announce Type: new 
Abstract: Modern AIGC pipelines deliver high-fidelity images and videos but presuppose a well-formed creation instruction, while end users rarely articulate visual details, leaving generators misaligned with user demand. We study personalized content generat...",Navigating User Behavior toward Personalized Multimodal Generation,,
1a1faa5a-7e46-4231-899f-8d3dc5b878f4,"Wed, 24 Ju",RESEARCH_BREAKTHROUGH,AI,,,arXiv cs.AI,https://arxiv.org/abs/2606.24224,"arXiv:2606.24224v1 Announce Type: new 
Abstract: Despite the extensive discussions of human-centric AI (HCAI) in Industry 5.0, its effects on firms' idiosyncratic risks (IR) remains underexplored. This is an imperative issue for firms navigate financial risks during the current technological revo...",Exploring the relationship between human-centric AI and firm idiosyncratic risks,,
e1f067cf-0531-48f9-b937-1387d0ac9eb7,"Wed, 24 Ju",MODEL_RELEASE,Modal,,,arXiv cs.AI,https://arxiv.org/abs/2606.24231,"arXiv:2606.24231v1 Announce Type: new 
Abstract: Multimodal driving planning faces a long-standing tension between two paradigms: scoring-based methods benefit from dense reward supervision but are confined to a fixed action vocabulary, while anchor-based methods generate proposals dynamically ye...",FlowR2A: Learning Reward-to-Action Distribution for Multimodal Driving Planning,,
a1b18463-59d9-4e4e-ae81-55f895c1498b,"Wed, 24 Ju",RESEARCH_BREAKTHROUGH,NVIDIA,,,arXiv cs.LG,https://arxiv.org/abs/2606.23739,"arXiv:2606.23739v1 Announce Type: new 
Abstract: We present an automated large-scale search pipeline for heterogeneous 4-Expert Mixture-of-Experts (MoE4) architectures within the LEMUR neural network dataset ecosystem. Building on a hand-crafted heterogeneous MoE reference model, we replace manua...",Systematic Exploration of 4-Expert Heterogeneous Mixture-of-Experts via Automated Pipeline Search,,
8822a69b-a6fe-43c3-8f44-54f723647864,"Wed, 24 Ju",OUTAGE,Weight-Space Geometry of Offline Reasoning Training,Qwen,,arXiv cs.LG,https://arxiv.org/abs/2606.23740,"arXiv:2606.23740v1 Announce Type: new 
Abstract: Offline reinforcement-learning losses (RFT, RIFT, DFT, Offline GRPO, DPO) are widely used to distill reasoning from large teachers into smaller students, and are typically compared on downstream accuracy alone. We ask whether they are mechanistical...",Weight-Space Geometry of Offline Reasoning Training,,
4d29f50f-0210-4eef-91a6-ee011e4761f8,"Wed, 24 Ju",RESEARCH_BREAKTHROUGH,Inference,,,arXiv cs.LG,https://arxiv.org/abs/2606.23741,"arXiv:2606.23741v1 Announce Type: new 
Abstract: Causal reasoning, which encompasses the discovery of causal structures and the inference of causal effects, is fundamental to data-driven decision making. In practice, data for reliable causal analysis are often distributed across institutions and ...",A Survey on Federated Causal Discovery and Inference,,
50ba9a39-6707-4bfc-918f-5dccaf8248c0,"Wed, 24 Ju",RESEARCH_BREAKTHROUGH,,,,arXiv cs.LG,https://arxiv.org/abs/2606.23742,"arXiv:2606.23742v1 Announce Type: new 
Abstract: Physical neural networks promise low-power machine learning by computing directly with analogue device physics, but most architectures force nonlinear device responses to act as scalar weights. Inspired by Kolmogorov-Arnold networks, we place train...",Low-power analogue neural networks with trainable nonlinear connections for continuous control,,
96f41a84-39ee-4c29-bb22-9500196202a4,"Wed, 24 Ju",FUNDING_EVENT,Chemical-Informed Gaussian Processes for Reaction Network Discovery,,,arXiv cs.LG,https://arxiv.org/abs/2606.23757,"arXiv:2606.23757v1 Announce Type: new 
Abstract: Extracting interpretable governing equations from sparse, noisy chemical time-series data remains difficult because discrete reaction topology and continuous kinetic parameters are tightly coupled. We present PC-MCMC-CIGP, a reproducible gray-box w...",Synergizing Physically Constrained MCMC and Chemical-Informed Gaussian Processes for Reaction Network Discovery,,
cf24496d-f716-4352-8f99-57534dac4b24,"Wed, 24 Ju",RESEARCH_BREAKTHROUGH,Meta,,,arXiv cs.LG,https://arxiv.org/abs/2606.23758,"arXiv:2606.23758v1 Announce Type: new 
Abstract: Domain generalization learns from multiple source domains to generalize to unseen target domains. However, it often neglects the realistic case of label mismatch between source and target.",Exploring Dualistic Meta-Learning to Enhance Domain Generalization in Open Set Scenarios,,
d39ffc85-48da-48c3-8001-ce041938e8cb,"Wed, 24 Ju",RESEARCH_BREAKTHROUGH,Parameter-Free Compression Baseline,,Tuebingen,arXiv cs.LG,https://arxiv.org/abs/2606.23767,"arXiv:2606.23767v1 Announce Type: new 
Abstract: Headline accuracies on the Tuebingen cause-effect pairs are routinely compared across papers even though each is measured under its authors' own protocol -- different pair subsets, weightings, model-selection, and decision rates. We argue this is t...","One Ruler: A Same-Hands Re-Evaluation of Bivariate Causal Direction on Tuebingen, with a Parameter-Free Compression Baseline",,
8f4bc558-8534-4463-9aee-5f51bae8ac41,"Wed, 24 Ju",MODEL_RELEASE,Transformer,,,arXiv cs.LG,https://arxiv.org/abs/2606.23830,"arXiv:2606.23830v1 Announce Type: new 
Abstract: Molecular surfaces encode the geometric and physicochemical patterns that determine antibody-antigen recognition, central to epitope prediction. However, existing methods rely on sequences or backbone structures and struggle to capture discontinuou...",Deciphering Fingerprints of 3D Molecular Surfaces for Accurate Epitope Prediction,,
0914723d-f0c6-4e77-b6de-2bc5b4fce8c0,"Wed, 24 Ju",RESEARCH_BREAKTHROUGH,Reconstructing GRACE Terrestrial Water Storage,,,arXiv cs.LG,https://arxiv.org/abs/2606.23833,"arXiv:2606.23833v1 Announce Type: new 
Abstract: Terrestrial water storage (TWS) integrates snow, soil moisture, surface water, and groundwater and is a key indicator of how climate variability and human activity reshape the global water cycle. The GRACE and GRACE-FO satellite missions provide th...",Reconstructing GRACE Terrestrial Water Storage with Spatio-Temporal Graph Neural Networks: An Application to South America,,
8017cfa8-885a-4c58-9fa9-d8d7d70261c8,"Wed, 24 Ju",RESEARCH_BREAKTHROUGH,Fisher,,,arXiv cs.LG,https://arxiv.org/abs/2606.23838,"arXiv:2606.23838v1 Announce Type: new 
Abstract: When two or more parameters or labels produce similar data, they are degenerate, or hard to distinguish. Degeneracies render both label prediction and inverse problems difficult, since both machine learning algorithms and probabilistic samplers rel...",The Degeneracy Distillery,,
b6a94bd6-61da-43ae-9a00-780806441df7,"Wed, 24 Ju",GPU_RELEASE,Intel,,,arXiv cs.LG,https://arxiv.org/abs/2606.23851,"arXiv:2606.23851v1 Announce Type: new 
Abstract: This work investigates the implementation of artificial intelligence and machine learning (AI/ML) for real-time monitoring in laser powder bed fusion (LPBF) additive manufacturing. We developed a binary image classification framework for distinguis...",Machine Learning Modeling for Real-Time Melt Pool Monitoring in Laser Powder Bed Fusion Additive Manufacturing: A Hybrid Approach,,
0b430862-7333-4066-82f7-c49ca4b8a06a,"Wed, 24 Ju",RESEARCH_BREAKTHROUGH,a Structure-Aware Molecular Engine,,,arXiv cs.LG,https://arxiv.org/abs/2606.23856,"arXiv:2606.23856v1 Announce Type: new 
Abstract: Generative molecular models for drug design are a promising direction with much active research. In the next phase of computational drug design, such models will need to understand small molecule structure and protein-ligand interactions, and they ...",Sesame: Structure-Aware Molecular Generation via Spatial Density-Map Conditioning,,
6118f20d-5bf0-4e21-bae6-fe95eb80151b,"Wed, 24 Ju",RESEARCH_BREAKTHROUGH,Are Safety Guarantees,,,arXiv cs.LG,https://arxiv.org/abs/2606.23858,"arXiv:2606.23858v1 Announce Type: new 
Abstract: A primary challenge in AI safety is the existence of adversarial examples -- slightly distorted inputs that cause a neural network (NN) to misclassify. To mitigate this problem, recent research focuses on the computation of robustness certification...",Are Safety Guarantees in Neural Networks Safe? How to Compute Trustworthy Robustness Certifications,,
89fcb980-a570-47f9-be3b-53918056f881,"Wed, 24 Ju",RESEARCH_BREAKTHROUGH,the Normalized Maximum Likelihood,,\mathcal{O}(k^3,arXiv cs.LG,https://arxiv.org/abs/2606.23867,"arXiv:2606.23867v1 Announce Type: new 
Abstract: The exact computation of the Normalized Maximum Likelihood (NML) codelength for regular non-smooth estimators (e.g., Lasso) has been historically limited by the cubic scaling walls of manifold-constrained projection and volume integration. At each ...",Exact Schur-Sylvester Dimensionality Reductions for Non-Smooth Stochastic Complexity and Manifold Sampling,,
e8bd7f47-ddce-425e-baa8-b3650f10f44b,"Wed, 24 Ju",RESEARCH_BREAKTHROUGH,Federated Survival Analysis,,,arXiv cs.LG,https://arxiv.org/abs/2606.23871,"arXiv:2606.23871v1 Announce Type: new 
Abstract: Survival analysis is central to clinical decision-making, yet reliable time-to-event models require large, diverse cohorts that are rarely available at a single institution, while privacy regulations restrict the centralization of patient data. Fed...",Federated Survival Analysis in Healthcare: A Multi-Model Evaluation on Cross-Institutional Heterogeneous Breast Cancer Data,,
6c20a0a3-7287-4103-bc23-869204ccfa4e,"Wed, 24 Ju",RESEARCH_BREAKTHROUGH,MGI,,,arXiv cs.LG,https://arxiv.org/abs/2606.23872,"arXiv:2606.23872v1 Announce Type: new 
Abstract: As generative models increasingly produce samples that are indistinguishable from human-created content, it becomes difficult to determine whether a given data point was part of a model's natural training set or was generated by the model itself, e...",MGI: Member vs Generated Inference,,
430ac8cc-bc81-42c3-a9e8-3f636d735bdb,"Wed, 24 Ju",RESEARCH_BREAKTHROUGH,Modal,,,arXiv cs.LG,https://arxiv.org/abs/2606.23880,"arXiv:2606.23880v1 Announce Type: new 
Abstract: From climate teleconnections to gene regulation, modern time-series datasets encompass tens or hundreds of interacting variables, making causal discovery increasingly challenging. Constraint-based methods offer statistical rigor but their nonlinear...",GRACE: Gated Refinement for Accurate Causal Edge Discovery in High-Dimensional Time Series,,
b1a6ecbc-7bcf-40d6-b19c-140054a5a97e,"Wed, 24 Ju",FUNDING_EVENT,ARIA,,,arXiv cs.LG,https://arxiv.org/abs/2606.23898,"arXiv:2606.23898v1 Announce Type: new 
Abstract: Distilling conditional diffusion models aims to transfer the behavior of a large teacher to a smaller student while preserving alignment across conditioning inputs. Unlike recognition tasks, knowledge distillation in conditional diffusion often str...",ARIA: Adaptive Region-Based Importance Allocation for Conditional Diffusion Distillation,,
2e69e3ed-94ef-4516-a63f-046e1d30a144,"Wed, 24 Ju",MODEL_RELEASE,AI,,Catala,arXiv cs.LG,https://arxiv.org/abs/2606.23913,"arXiv:2606.23913v1 Announce Type: new 
Abstract: This article develops an architecture that creates a formally verifiable reward signal to train legal AI, adapting the LLM proposes, verifier disposes paradigm from mathematical AI to the distinctive demands of law. We present an architecture compr...",Closing the Loop: Formally Verified Law as a Reward Signal for Self-Improving Legal AI,,
8b7a57e5-bf2e-42b6-8e42-30fda9a1868a,"Wed, 24 Ju",RESEARCH_BREAKTHROUGH,Catastrophic Compositional Generation: Why Vanilla Diffusion Models Fail to Extrapolate,,,arXiv cs.LG,https://arxiv.org/abs/2606.23920,"arXiv:2606.23920v1 Announce Type: new 
Abstract: The task of compositional generation involves using a conditional generative model, trained only on a subset of the possible conditions, to produce samples from compositionally-defined target distributions such as a geometric combination of the sou...",Catastrophic Compositional Generation: Why Vanilla Diffusion Models Fail to Extrapolate,,
bf005733-75d3-4b0d-a9c0-9fe0c9861928,"Wed, 24 Ju",GPU_RELEASE,OpenAI,,OpenAI,OpenAI Blog,https://openai.com/index/openai-broadcom-jalapeno-inference-chip,"OpenAI and Broadcom introduce Jalapeño, a custom AI chip built for LLM inference to improve performance, efficiency, and scale across AI systems.",OpenAI and Broadcom unveil LLM-optimized inference chip,,
cb15bb01-31cd-46c6-aad0-8b40f331128a,"Wed, 24 Ju",MODEL_RELEASE,,Gemini,Gemini,Google DeepMind,https://deepmind.google/blog/introducing-computer-use-in-gemini-3-5-flash/,Introducing computer use in Gemini 3.5 Flash,Introducing computer use in Gemini 3.5 Flash,,
29538d0b-1926-4918-a8d2-10723249f521,"Wed, 24 Ju",OTHER,AWS,,,AWS ML Blog,https://aws.amazon.com/blogs/machine-learning/huntington-bank-redacting-sensitive-data-from-400m-documents-with-aws/,"In this post, we walk through how Huntington built a scalable AWS solution to detect and redact Personally Identifiable Information (PII) and Payment Card Industry (PCI) data from over 400 million documents, reducing processing time from years to just a few months while achieving 95%+ redaction a...",Huntington Bank: Redacting sensitive data from 400M+ documents with AWS,,
454dc9ee-f444-4501-9e44-f9bc620986af,"Wed, 24 Ju",OTHER,Amazon,,,AWS ML Blog,https://aws.amazon.com/blogs/machine-learning/build-a-healthcare-appointment-agent-with-amazon-nova-2-sonic/,"In this post, you will learn how to build a voice agent that handles appointment reminder conversations using Amazon Nova 2 Sonic and Amazon Bedrock AgentCore. The agent authenticates patients by voice, manages appointments (confirm, cancel, or reschedule), collects pre-visit health information, ...",Build a healthcare appointment agent with Amazon Nova 2 Sonic,,
c1a38920-8bae-416a-9cf4-a3b74f0a26d8,"Wed, 24 Ju",OTHER,Snowflake,,Snowflake,AWS ML Blog,https://aws.amazon.com/blogs/machine-learning/ai-powered-bi-with-snowflake-and-amazon-quick/,"In this post, you will learn how to build an end-to-end integration between Snowflake semantic views and Amazon Quick. The sample data is user review data for a media company.",AI-powered BI with Snowflake and Amazon Quick,,
946a24fb-16e5-455c-8df9-35958c41ae78,"Wed, 24 Ju",OTHER,Amazon,,,AWS ML Blog,https://aws.amazon.com/blogs/machine-learning/how-loka-built-a-natural-low-latency-voice-agent-with-amazon-nova-2-sonic/,"In this post, we demonstrate the architecture and approach Loka used to solve a common frustration: robotic, slow voice assistants that cause customers to hang up, damaging brand reputation and driving up support costs.","How Loka Built a Natural, Low-Latency Voice Agent with Amazon Nova 2 Sonic",,
d28dc06d-23a1-4100-93b7-826f50e8eff3,"Wed, 20 Au",POLICY_REGULATION,Meta,,,TechCrunch AI,https://techcrunch.com/2025/08/20/harvard-dropouts-to-launch-always-on-ai-smart-glasses-that-listen-and-record-every-conversation/,"After developing a facial-recognition app for Meta’s Ray-Ban glasses and doxing random people, two former Harvard students are now launching a startup that makes smart glasses with an always-on microphone.",Harvard dropouts to launch ‘always on’ AI smart glasses that listen and record every conversation,,
68b224d2-211c-413a-9c67-9421e2735246,"Wed, 20 Au",DATACENTER_EXPANSION,Meta,,,TechCrunch AI,https://techcrunch.com/2025/08/20/meta-to-add-100-mw-of-solar-power-from-u-s-gear/,The social media company is adding another tranche of solar to power a new AI data center in South Carolina.,Meta to add 100MW of solar power from US gear,,
