event_id,date,category,company,product,location,source,url,summary,title,funding_usd,hardware_name
a40514ae-5101-4e10-b627-f6b448dfdb9f,2026-06-26,OTHER,Responsibl,,,The New Republic,https://newrepublic.com/post/212393/what-going-big-housing-bill-exactly,"Bores, a former Palantir employee himself, might seem like an oddly small-fish target for one of the countrys richest, most powerful industries. His troubles with the PACs started with the Responsibl… [+1428 chars]","What’s Going on With the Big Housing Bill, Exactly?",,
317b9ed8-afbd-4d99-b158-b63552f801d6,2026-06-26,FUNDING_EVENT,Framework Ventures,,San Francisco,Cointelegraph,https://cointelegraph.com/news/framework-ventures-raise-400-million-push-beyond-crypto-ai,"Framework Ventures, a venture capital company that backs crypto platforms, has closed its fourth fund while expanding its investment strategy beyond blockchain. The San Francisco-based investor has … [+2212 chars]",Framework Ventures raises $400M to invest beyond crypto: Report,400000000,
ed1b6057-298e-4a2f-9699-348a888c0d5c,2026-06-26,OTHER,HHS,,,Techtarget.com,https://www.techtarget.com/searchhealthit/news/366645125/HHS-aims-to-strengthen-TEFCA-through-greater-oversight-QHIN-reviews,"HHS' Office of the National Coordinator for Health Information Technology announced new steps to strengthen the TEFCA federal health data-sharing network, including plans to conduct additional review… [+3292 chars]","HHS aims to strengthen TEFCA through greater oversight, QHIN reviews",,
7419778e-f8c6-4e07-953f-a1120930a92b,2026-06-26,OTHER,,,,Biztoc.com,https://biztoc.com/x/5eaf9a2caf832679,Listen to the audio version of this article (generated by AI).There is a short list of technologies that governments have decided are too important to lose.Nuclear. Semiconductors.,The Bearish AI Headline That’s Actually the Most Bullish Signal of the Year,,
d5e5fa4f-46e4-4608-a7a5-30c5065ddbec,2026-06-26,FUNDING_EVENT,OpenAI,,OpenAI,Biztoc.com,https://biztoc.com/x/a60bdfe09badea0f,"Live Nasdaq Composite: OpenAI IPO Delay Fears Send Markets Out on Sour NoteQuick Read- OpenAI's potential IPO delay rattled chip stocks, dragging the Nasdaq Composite down 5.2% for the week and raisi… [+137 chars]",Live Nasdaq Composite: OpenAI IPO Delay Fears Send Markets Out on Sour Note,,
56b43135-294f-4eac-aea5-b312a331910f,2026-06-26,FUNDING_EVENT,OpenAI,,UK,Biztoc.com,https://biztoc.com/x/29644ed291dfc341,"Wall Street falls at the open as AI jitters resume amid OpenAI IPO delayJune 26 (Reuters) - The British publics expectations for future inflation continued to recede in June, according to a survey fr… [+146 chars]","UK public’s inflation expectations continue to ease, Citi/YouGov survey shows",,
9a283a4a-dbc0-4bd3-a0f8-21f17591006c,2026-06-26,FUNDING_EVENT,OpenAI,,Germany,Biztoc.com,https://biztoc.com/x/65a13cf07169e5ff,"Wall Street falls at the open as AI jitters resume amid OpenAI IPO delayBy Maria Martinez and Holger HansenBERLIN, June 26 (Reuters) - Germanys 2027 draft budget has been finalized, German newspaper … [+141 chars]","Germany’s 2027 draft budget is finalized, Handelsblatt reports",,
ec9292da-3173-460d-b709-a23a66a01553,2026-06-26,OTHER,OpenAI,,OpenAI,Biztoc.com,https://biztoc.com/x/a85d0769f9e59df4,OpenAI's Dave Dugan explains how ChatGPT is building a new ad categoryBusiness Insider Senior Correspondent Lara O'Reilly interviews OpenAI Head of Global Ads Solutions Dave Dugan at the 73rd Cannes … [+153 chars],OpenAI's Dave Dugan explains how ChatGPT is building a new ad category,,
f9c79d77-ffd5-4dcb-b5e2-35aa41acc763,2026-06-26,OTHER,Super Micro Computer Set,,Blackwe,24/7 Wall St.,https://247wallst.com/investing/2026/06/26/stock-price-prediction-super-micro-computer-set-for-10-climb-after-repricing/,"Quick Read
<ul><li>SMCI sits 32% lower over twelve months, yet our $34.92 BUY target sees 10% upside as AI server demand stays intact. </li><li>CEO Charles Liang flagged over $13 billion in Blackwe… [+3749 chars]",Stock Price Prediction: Super Micro Computer Set for 10% Climb After Repricing,,
055d91b0-318e-4315-999b-0d04c4514084,2026-06-26,GPU_RELEASE,Apple,,,Tom's Hardware UK,https://www.tomshardware.com/tech-industry/apple-will-skip-its-high-end-m6-mac-chips-and-fast-track-an-ai-focused-m7-generation-for-2027,"Apple will release a base M6 chip for entry-level Macs this year but skip the Pro and Max versions of that generation, jumping instead to an accelerated M7 family built around on-device AI, according… [+2885 chars]","Apple will skip its high-end M6 Mac chips and fast-track an AI-focused M7 generation for 2027, report claims — may release a base M6 chip for entry-level Macs this year",,
267e3a81-b3d6-4beb-913a-d5f928fd8ab5,2026-06-26,MODEL_RELEASE,Perplexity,Claude,Anthropic,Rondoflow.app,https://rondoflow.app/,Is RondoFlow free? Yes.,Show HN: Orchestrate Claude Code agents on a canvas,,
5afaf051-2fd0-480a-b963-2ac9799f0a16,2026-06-25,OTHER,Ford,,,The Verge AI,https://www.theverge.com/transportation/956316/ford-quality-jd-power-ranking-ai-automated-mistakes,"To celebrate its new status as No. 1 in JD Power's initial quality ranking among mainstream automakers, Ford is opening up about the challenges it has faced in recent years, especially around its reliance on automated systems in production and design.",Ford had to hire back former engineers to fix mistakes made by its automated systems,,
0a0da467-1cb4-4a7d-a7aa-915fb56822c0,2026-06-25,OTHER,Meta,,,The Verge AI,https://www.theverge.com/tech/956668/meta-facebook-creator-studio-ai-app-relaunch,"Meta is bringing back the Facebook Creator Studio page manager, now ""reimagined"" as a standalone AI companion app. The new app aims to make it easier for creators to connect with their audiences and show them ""exactly how to grow on Facebook,"" according to Meta's announcement.",Facebook’s Creator Studio has been revived as an AI companion app,,
b9913144-8bdb-49e9-ab9f-b3c59210f620,2026-06-25,MODEL_RELEASE,OpenAI,GPT-5,OpenAI,The Verge AI,https://www.theverge.com/ai-artificial-intelligence/957372/openai-will-delay-gpt-5-6-after-trump-administration-request,"The Trump administration, apprehensive of potential security issues, has reportedly asked OpenAI to stagger the release of its next big-ticket model, GPT-5.6. The Information reported that OpenAI CEO Sam Altman told employees Wednesday in a company Q&#38;A that it would release GPT-5.6 in limited...",OpenAI will delay GPT-5.6 after Trump administration request,,
caa1c588-1c31-4688-a6e4-e6bad705cc48,2026-06-25,OTHER,Peter Egwuatu &,,,Vanguard,https://www.vanguardngr.com/2026/06/family-businesses-in-africa-sustain-growth-despite-uncertainty-pwc/,"By Peter Egwuatu &amp; Providence Ayanfeoluwa
Family businesses across Africa are recording strong growth and demonstrating resilience despite economic uncertainty, regulatory reforms and geopolitic… [+2343 chars]",Family businesses in Africa sustain growth despite uncertainty — PwC,,
7169c985-800e-46f1-ab1c-c12f064b4ec2,2026-06-25,OTHER,Meta,,,Crypto Briefing,https://cryptobriefing.com/copper-rises-ai-rally-dollar-weakness/,"The metal powering AI data centers has jumped over 60% in a year, and tokenized copper is bringing the rally to crypto markets Copper futures have broken above $6.60 per pound, setting fresh record h… [+2410 chars]",Copper surges past $6.60 as weaker dollar and AI infrastructure demand fuel record rally,,
a24011cc-f3f8-4582-b324-db9abb0ee176,2026-06-25,OTHER,NVIDIA,,,Softpedia.com,https://drivers.softpedia.com/get/GRAPHICS-BOARD/NVIDIA/Inventec-NVIDIA-RTX-1000-Ada-Laptop-Graphics-Driver-32-0-15-9186-for-Windows-10-version-1903-64-bit.shtml,"The package provides the installation files for Inventec NVIDIA RTX 1000 Ada Generation Laptop Graphics Driver version 32.0.15.9186.If the driver is already installed on your system, updating (overwr… [+2183 chars]",Inventec NVIDIA RTX 1000 Ada Laptop Graphics Driver 32.0.15.9186 for Windows 10 version 1903 64-bit,,
9ecf92e3-2b40-466b-8ce2-408ed5f6dc83,2026-06-25,OTHER,,,,The Times of India,https://economictimes.indiatimes.com/news/new-updates/future-is-atoms-not-bits-sridhar-vembu-reveals-where-zoho-is-betting-its-rd-dollars/articleshow/131982552.cms,"Zoho founder Sridhar Vembu has revealed that the company is investing heavily in research and development-led manufacturing, echoing the belief that the future of innovation lies not only in software… [+2105 chars]","‘Future is atoms, not bits’: Sridhar Vembu reveals where Zoho is betting its R&D dollars",,
662305d4-789f-402a-a82e-2700278ad4e4,2026-06-25,OTHER,,,,Pypi.org,https://pypi.org/project/nemotron-graphic-elements-v1/1.0.1.dev20260625044241/,"A required part of this site couldnt load. This may be due to a browser
 extension, network issues, or browser settings.",nemotron-graphic-elements-v1 1.0.1.dev20260625044241,,
add912cb-8b8d-4bba-a3e7-1bf8468739cf,2026-06-25,OTHER,,,,Onefootball.com,https://onefootball.com/en/news/13-teams-already-through-to-the-2026-world-cup-round-of-32-43054631,"With another matchday completed, it has been confirmed that 13 teams have already secured their place in the knockout stage. All three hosts have lived up to expectations, while powerhouses like Arg… [+283 chars]", 13 teams already through to the 2026 World Cup round of 32,,
67331407-b047-4836-931d-04895bd4ab6c,2026-06-25,GPU_RELEASE,Intel,,,Biztoc.com,https://biztoc.com/x/fceb57ddb69ab4f5,"It seems like everyone has an opinion on which artificial intelligence (AI) company will win the next decade. Most of those opinions center on the classic, sexy names: the chip designers, the cloud p… [+146 chars]","Got $5,000? 2 Stocks to Own for Physical AI",,
3bb72418-b764-43a3-bfa9-4f43fa71545e,2026-06-25,OTHER,Anthropic,,,Biztoc.com,https://biztoc.com/x/88f6450fc2b3446b,"Anthropic sent a letter to the U.S. Senate Committee on Banking, Housing, and Urban Affairs accusing the Chinese tech company Alibaba of ""brazenly"" and ""illicitly"" attempting to extract its artificia… [+149 chars]",Anthropic accuses Alibaba of campaign to 'brazenly' and 'illicitly' extract AI capabilities,,
dde7213e-88ec-4abf-8609-b72a74700f1b,2026-06-25,OTHER,NVIDIA,,,Softpedia.com,https://drivers.softpedia.com/get/GRAPHICS-BOARD/NVIDIA/Inventec-NVIDIA-RTX-1000-Ada-Laptop-Graphics-Driver-32-0-15-9186-for-Windows-10-64-bit.shtml,"The package provides the installation files for Inventec NVIDIA RTX 1000 Ada Generation Laptop Graphics Driver version 32.0.15.9186.If the driver is already installed on your system, updating (overwr… [+2183 chars]",Inventec NVIDIA RTX 1000 Ada Laptop Graphics Driver 32.0.15.9186 for Windows 10 64-bit,,
81cf806d-3f3a-4211-b8ef-ff5d7bcde625,2026-06-25,OTHER,NVIDIA,,,Livedoor.com,https://news.livedoor.com/article/detail/31652807/,"NVIDIAAINVIDIA OmniverseEco Wave Power
Eco Wave Power Turns Waves Into Watts With NVIDIA AI Infrastructure and Digital Twins | NVIDIA Blog
https://blogs.nvidia.com/blog/eco-wave-power-ai-digital-tw… [+600 chars]",NVIDIAのAIインフラを使って「海の波」を電力に変換する技術をEco Wave Powerが開発中,,
0cadb3e7-3dd6-4920-b012-0c434d8cb01f,2026-06-25,MODEL_RELEASE,Anthropic,Claude,,Livedoor.com,https://news.livedoor.com/article/detail/31652806/,"ClaudeAIAnthropicAlibabaAIQwen lab
Anthropic says Alibaba illicitly extracted Claude AI model capabilities | Reuters
https://www.reuters.com/world/china/anthropic-says-alibaba-illicitly-extracted-c… [+618 chars]",AnthropicがAlibabaを「蒸留攻撃」で非難、Claudeに2880万回以上のアクセスか,,
acc46bdf-2267-4874-8f26-86720e407b80,2026-06-25,OTHER,Intel,,,Theregister.com,https://www.theregister.com/security/2026/06/25/nation-state-actors-cracked-critical-australian-infrastructure-to-cripple-it-at-a-time-of-their-choosing/5261877,"Australias Security and Intelligence Organisation (ASIO) has established dedicated teams to counter nation-state attacks on critical infrastructure, the orgs director general Mike Burgess revealed ye… [+4866 chars]",Nation-state actors cracked critical Australian infrastructure to ‘cripple it at a time of their choosing’,,
00a6642d-3c91-433c-8796-489eab47a6e1,2026-06-25,OTHER,MWC,,Shanghai,ComputerWeekly.com,https://www.computerweekly.com/news/366645082/MWC-2026-Shanghai-Huawei-bets-on-token-economy-as-telecoms-seeks-new-AI-revenues,"For decades, mobile operators have built their business around a relatively simple proposition: connecting people, devices and enterprises. Every new generation of mobile technology, from 3G to 4G an… [+10674 chars]",MWC 2026 Shanghai: Huawei bets on token economy as telecoms seeks new AI revenues,,
db40a8a8-97e8-4aa1-9211-8f6ec8bfa5ae,2026-06-25,OTHER,,,US,BusinessLine,https://www.thehindubusinessline.com/news/meity-secretary-krishnan-meets-senior-us-official-helberg-discuss-technology-ties/article71144585.ece,"India and the US discussed avenues for cooperation in building diversified and trusted supply chains ahead of the two-day Pax Silica Summit set to begin here on Thursday. S Krishnan, Secretary, Mini… [+1594 chars]","Meity Secretary Krishnan meets senior US official Helberg, discuss technology ties",,
f50c3bc8-34f7-41c8-964d-6c09d1a09966,2026-06-25,OTHER,Meta,,,Crypto Briefing,https://cryptobriefing.com/meta-ai-content-moderation-replaces-human-reviews/,"The social media giant is betting big on AI to police its platforms, but watchdogs warn the shift carries real risks Meta is making its largest push yet to automate the messy, expensive business of k… [+2313 chars]","Meta accelerates AI content moderation, replacing 50% of human reviews",,
5f2c6ebb-dbc9-4c10-bdd9-d33bc89ef74c,2026-06-25,OTHER,Amazon,,Kindle,Goodereader,https://goodereader.com/blog/electronic-readers/kobo-xteink-viwoods-and-other-e-readers-on-sale-for-prime-day,"Portrait of pretty student or businesswoman in smart casual using digital tablet
Amazon is having a huge Prime Day sale on Kindle e-readers and Scribe e-notebooks, which we have already documented. … [+3249 chars]","Kobo, Xteink, Viwoods, and other e-readers on sale for Prime Day",,
c71d0755-b976-4c6b-ad12-54272f0eaaad,2026-06-25,OTHER,CFP,,,W3.org,https://lists.w3.org/Archives/Public/semantic-web/2026Jun/0027.html,"&gt; [Apologies for cross-posting]
&gt; ==========================================================================
&gt; 3rd CALL FOR PAPERS - SIMBig 2026 - LASAI 
&gt; ============================… [+3553 chars]","CFP: SIMBig 2026, 13th Edition | LASAI: AI School | Peru",,
1c4e88cc-6d98-454c-8c3b-0ad2d32c10d4,2026-06-25,MODEL_RELEASE,Anthropic,Claude,U.S.,Nikkei.com,https://asia.nikkei.com/business/technology/artificial-intelligence/anthropic-accuses-alibaba-of-largest-known-distillation-attack-on-claude,"HONG KONG -- U.S. AI giant Anthropic has accused Chinese e-commerce conglomerate Alibaba Group of ""brazenly"" and ""illicitly"" distilling its model Claude, in what it said was ""the largest known distil… [+70 chars]",Anthropic accuses Alibaba of 'largest known distillation attack' on Claude,,
c82fa91c-26a4-4f35-9f64-3de8e0cde7fa,2026-06-25,OTHER,Research and Clinical Studies Centre,,Patras,Naftemporiki.gr,https://www.naftemporiki.gr/english/2128962/vianex-invests-12-5-million-euros-in-new-research-and-clinical-studies-centre/,The new Research and Clinical Studies Centre of Vianex was inaugurated in the presence of the leadership of the Health Ministry and the Development Ministry in the industrial area of Patras. Continu… [+1565 chars],Vianex invests 12.5 million euros in new Research and Clinical Studies Centre,,
ab3e1bf6-503e-459d-8f10-af8a3b07e610,2026-06-25,GPU_RELEASE,Intel,,U.S.,BusinessLine,https://www.thehindubusinessline.com/markets/nifty-reclaims-24000-as-crude-slide-and-chip-rally-lift-markets/article71144759.ece,"Markets opened higher on Thursday morning, riding a wave of positive global cues after strong earnings from U.S. chipmaker Micron Technology eased fears over artificial intelligence spending, while a… [+3818 chars]","Nifty reclaims 24,000 as crude slide and chip rally lift markets",,
3d64fb1e-06e9-437f-9da7-3f6abdc569e3,2026-06-25,OTHER,,,Bosnia,Onefootball.com,https://onefootball.com/en/news/fc-breakfast-yamal-shows-off-his-brother-messi-marked-his-birthday-43054586,"At the start of the tournament, three players have broken into the pantheon of the youngest scorers in World Cup history: Kerim Alajbegovi (Bosnia), thanks to his goal last night against Qatar, Ibrah… [+852 chars]","☕️FC Breakfast: Yamal shows off his brother, Messi marked his birthday",,
1bb69216-08bc-47f5-a458-12b33c89a017,2026-06-25,OTHER,Intel,,,Biztoc.com,https://biztoc.com/x/5e972fd7537f48ee,AI Is Changing How Clients Work With Advisors. Mostly for the BetterArtificial intelligence tools are helping clients become better consumers of financial advice.,AI Is Changing How Clients Work With Advisors. Mostly for the Better,,
3bb5983b-97b4-4920-b17f-cae5abdd3272,2026-06-25,OTHER,Anthropic,,OpenAI,Biztoc.com,https://biztoc.com/x/922c2cd1538353f3,Google Gains Spot on Dow Jones While Losing Street Cred in AIGoogle shares have been hammered recently as two top artificial intelligence researchers spurned the company to join OpenAI and Anthropic.… [+150 chars],Google Gains Spot on Dow Jones While Losing Street Cred in AI,,
90d4e785-2edf-4434-9b32-0d6119f9e1d7,2026-06-25,OTHER,Meghalaya,,,Syllad.com,https://www.syllad.com/meghalayas-ai-breast-cancer-screening-initiative-bags-skoch-award/,"Syllad | The Rising MeghalayaJune 25, 2026
The Health and Family Welfare Department of Meghalaya has received the prestigious SKOCH Award 2026 for its innovative initiative, Transforming Breast Canc… [+1382 chars]",Meghalaya’s AI breast cancer screening initiative bags SKOCH Award,,
7b76cace-85e1-40ed-8200-ed92333788c7,2026-06-25,OTHER,NVIDIA,,,Softpedia.com,https://drivers.softpedia.com/get/GRAPHICS-BOARD/NVIDIA/Inventec-NVIDIA-GeForce-RTX-4090-Laptop-Graphics-Driver-32-0-15-9186-for-Windows-11-version-25H2.shtml,"The package provides the installation files for Inventec NVIDIA GeForce RTX 4090 Laptop Graphics Driver version 32.0.15.9186.If the driver is already installed on your system, updating (overwrite-ins… [+2176 chars]",Inventec NVIDIA GeForce RTX 4090 Laptop Graphics Driver 32.0.15.9186 for Windows 11 version 25H2,,
bf8f7229-df21-4403-9590-f70b82c96f2c,2026-06-25,OTHER,Intel,,,Foreign Policy,http://foreignpolicy.com/2026/06/25/ai-industrial-revolution-manufacturing-toolkit/,"The space-cum-artificial intelligence company SpaceX just went public at an eye-watering valuationthe largest in historymaking its founder, Elon Musk, the worlds first trillionaire. In the same stret… [+11925 chars]",This Industrial Revolution Is Not Like the Last One,,
0102c60d-9f03-4b96-bcbd-8e5f29eb3f79,2026-06-25,OTHER,Media Briefing,,,Digiday,http://digiday.com/media/media-briefing-inside-publishers-real-cannes-agenda-ai-money-vs-agentic-hype/,"This week’s Media Briefing looks at the real conversations publishers are having in Cannes how much of the AI and agentic media buzz will turn into actual money, and what it all means for who pays fo… [+12300 chars]",Media Briefing: Inside publishers’ real Cannes agenda – AI money vs agentic hype,,
98971e1f-aef2-4ad6-9f52-dc8463938d0f,2026-06-25,OTHER,Google,,,Digiday,http://digiday.com/marketing/googles-world-cup-brand-counterattack-highlights-shifting-search-behavior/,Googles World Cup brand campaign isnt just another marketing bet on live sports biggest carnival. Its also a tell.The tech giant is currently running a brand campaign throughout the tournament featur… [+4206 chars],Google’s World Cup brand counterattack highlights shifting search behavior,,
9d170415-74f5-4e06-ba95-2c74533e7a59,2026-06-25,OTHER,the Fan Fests,,Mexico,Onefootball.com,https://onefootball.com/en/news/party-in-mexico-how-el-tri-fans-celebrate-in-the-streets-43054569,"After wrapping up a perfect group stage and securing first place in their group, Mexican fans have taken to the streets to celebrate the World Cup victory. From the Fan Fests to the Angel of Indepen… [+240 chars]",​​ Party in Mexico! How El Tri fans celebrate in the streets,,
118e7dcb-6e75-4787-b2f6-81f3b1f1e5b4,2026-06-25,OTHER,PM Modi,,New Delhi,The Times of India,https://economictimes.indiatimes.com/news/economy/infrastructure/pm-modi-reviews-four-major-projects-worth-rs-30000-crore-calls-for-timely-completion-under-pm-gati-shakti-framework/articleshow/131981838.cms,"New Delhi: Prime Minister Narendra Modi chaired the 52nd PRAGATI meeting, during which infrastructure works worth over Rs. 30,000 crore were reviewed.In a post on X, he said that ongoing development … [+3102 chars]","PM Modi reviews four major projects worth Rs 30,000 crore, calls for timely completion under PM Gati Shakti framework",,
f1d7a20b-69ae-4e82-b93d-8c646bce1478,2026-06-25,OTHER,Intel,,,Mit.edu,https://news.mit.edu/2026/improving-ai-agent-speed-and-energy-efficiency-0625,"Agentic workflows are artificial intelligence-powered software systems that chain together multiple models and external tools to tackle complicated tasks, like analyzing a video and answering questio… [+6582 chars]",Improving the speed and energy-efficiency of AI agents,,
36e638d1-9c50-45b0-9139-245ee6b176a3,2026-06-25,MODEL_RELEASE,Anthropic,Claude,U.S.,BusinessLine,https://www.thehindubusinessline.com/info-tech/anthropic-says-alibaba-illicitly-extracted-claude-ai-model-capabilities/article71144572.ece,"U.S. AI company Anthropic accused
Alibaba, the Chinese technology and e-commerce giant,
of illicitly extracting its Claude AI model capabilities in what
it said was the largest known attack of its… [+2747 chars]",Anthropic says Alibaba illicitly extracted Claude AI model capabilities,,
fd23566a-240d-4ec8-b192-e2f9ee469bdc,2026-06-25,OTHER,the Lebanese Armed Forces,,Netherlands,Israelnationalnews.com,https://www.israelnationalnews.com/news/429167,The Netherlands is expanding its military assistance to the Lebanese Armed Forces (LAF) in a strategic bid to fortify Beiruts control over southern Lebanon and suppress the influence of Tehran's terr… [+2044 chars],Netherlands ramps up Lebanese military support to neutralize Hezbollah,,
e6a7e153-e4f3-459f-a182-395d45d6e42f,2026-06-25,OTHER,,,,Pypi.org,https://pypi.org/project/alltoken/0.2.29/,"A required part of this site couldnt load. This may be due to a browser
 extension, network issues, or browser settings.",alltoken 0.2.29,,
39b1dce3-7863-4a5b-8dcd-21e661a0a7fe,2026-06-25,MODEL_RELEASE,AI,,,Github.com,https://github.com/surajkumar811/swarm-test,"Find where your multi-agent AI system breaks before production does. Static reliability testing for CrewAI, LangGraph, AutoGen, and custom agent systems.",Show HN: Find where multi-agent AI systems break before production,,
fc6cde95-911a-4498-be41-3477ccc01773,2026-06-25,OTHER,,,,Pypi.org,https://pypi.org/project/cc-transcript/7.0.1/,"A required part of this site couldnt load. This may be due to a browser
 extension, network issues, or browser settings.",cc-transcript 7.0.1,,
727fbffa-5a31-4f2c-84b2-80e639f7383c,2026-06-25,FUNDING_EVENT,quantum,,China,The Times of India,https://economictimes.indiatimes.com/markets/us-stocks/news/global-market-chinas-future-industries-investment-boom-sparks-valuation-bubble-concerns/articleshow/131981792.cms,"China's push to become a global leader in cutting-edge technologies is triggering a surge in venture capital investments, with startups in sectors such as commercial space, quantum computing, nuclear… [+4009 chars]",Global Market: China's 'future industries' investment boom sparks valuation bubble concerns,,
754fece6-4d61-4823-be73-aafd3c557348,2026-06-25,OTHER,NVIDIA,,,Softpedia.com,https://drivers.softpedia.com/get/GRAPHICS-BOARD/NVIDIA/Inventec-NVIDIA-GeForce-RTX-4090-Laptop-Graphics-Driver-32-0-15-9186-for-Windows-11.shtml,"The package provides the installation files for Inventec NVIDIA GeForce RTX 4090 Laptop Graphics Driver version 32.0.15.9186.If the driver is already installed on your system, updating (overwrite-ins… [+2176 chars]",Inventec NVIDIA GeForce RTX 4090 Laptop Graphics Driver 32.0.15.9186 for Windows 11,,
f2489dcd-a3c7-4632-bdc4-8d0c85f2d2c5,2026-06-25,OTHER,NVIDIA,,,Crypto Briefing,https://cryptobriefing.com/nvidia-genentech-ai-drug-discovery-bio2026/,"Kimberly Powell and Genentech CEO Ashley Magargee outlined why secure, scalable AI infrastructure is the backbone of the next generation of biomedical breakthroughs The biotech industry’s biggest ann… [+1354 chars]",Nvidia and Genentech make the case for AI-driven drug discovery at BIO2026,,
7ee3bdc7-bc64-4c23-888e-6f6cf52970cf,2026-06-25,OTHER,,,,Pypi.org,https://pypi.org/project/tollgateai/0.6.0/,"A required part of this site couldnt load. This may be due to a browser
 extension, network issues, or browser settings.",tollgateai 0.6.0,,
80805c55-3fee-4bb5-9971-5b583b8a3705,2026-06-25,OTHER,,,,Pypi.org,https://pypi.org/project/alltoken/0.2.28/,"A required part of this site couldnt load. This may be due to a browser
 extension, network issues, or browser settings.",alltoken 0.2.28,,
9f862dbe-798d-48a5-ab4a-eba486dd4fd0,2026-06-25,OTHER,,,,Pypi.org,https://pypi.org/project/doc-firewall/0.5.0/,"A required part of this site couldnt load. This may be due to a browser
 extension, network issues, or browser settings.",doc-firewall 0.5.0,,
