event_id,date,category,company,product,location,source,url,summary,title,funding_usd,hardware_name
a2e615ad-d50f-4e90-aa31-f24d7a1dce6b,2026-06-18,OTHER,Microsoft,,,InfoQ.com,https://www.infoq.com/news/2026/06/microsoft-scout-openclaw-build/,"Microsoft recently introduced at Build 2026 Microsoft Scout, an always-on agent. Scout belongs to a new category of agents Microsoft called Autopilots: always-on agents that work autonomously on a us… [+4234 chars]","Microsoft Scout, New Enterprise Autopilot Built on OpenClaw, Announced at Build 2026",,
b839c117-5aad-4def-94e2-7d29ee20693b,2026-06-18,OTHER,,,,Pypi.org,https://pypi.org/project/abstract-hugpy-dev/0.1.38/,"A required part of this site couldnt load. This may be due to a browser
 extension, network issues, or browser settings.",abstract-hugpy-dev 0.1.38,,
367dc787-a527-416c-a29f-ca2329254b09,2026-06-18,OTHER,,,,Pypi.org,https://pypi.org/project/tau-by-clarity/0.55.12/,"A required part of this site couldnt load. This may be due to a browser
 extension, network issues, or browser settings.",tau-by-clarity 0.55.12,,
d8a730f3-aed0-4ae9-a238-6e2d78a813fa,2026-06-18,OTHER,hanary-mcp,,,Pypi.org,https://pypi.org/project/hanary-mcp/0.22.3/,"A required part of this site couldnt load. This may be due to a browser
 extension, network issues, or browser settings.",hanary-mcp 0.22.3,,
b82a59c2-1dc4-4bd6-aba3-0cd6d36d8cd5,2026-06-18,OTHER,OneFootball,,,Onefootball.com,https://onefootball.com/en/news/2026-world-cup-overnight-round-up-43024203,"Every morning, OneFootball will bring you a full recap of the night at the World Cup. Lets get into the summary of another eventful night!"," 2026 World Cup, overnight round-up",,
e30a4fff-a0de-4878-8811-05b858a53256,2026-06-18,OTHER,AI,,Las Vegas,SiliconANGLE News,https://siliconangle.com/2026/06/18/architecting-ai-five-things-antonio-neri-told-enterprise-hpe-discover/,"Hewlett Packard Enterprise Co. Chief Executive Antonio Neri opened the company’s annual user conference, Discover, this week in Las Vegas with a manifesto for the AI era.",Architecting for AI: Five things Antonio Neri told the enterprise at HPE Discover,,
d5d2af02-b6a1-4d98-8654-f17cbcf84c68,2026-06-18,MODEL_RELEASE,OpenAI,Gemini,Gemini,The Times of India,https://economictimes.indiatimes.com/news/new-updates/noam-shazeer-hired-by-google-for-2-7-billion-in-2024-leaves-the-tech-giant-in-less-than-18-months-to-join-sam-altmans-open-ai/articleshow/131818353.cms,"Noam Shazeer, vice president of engineering at Google and co-lead of its Gemini artificial intelligence models, announced on Wednesday that he is leaving the company to join OpenAI.In a post on X, Sh… [+2447 chars]",Noam Shazeer hired by Google for $2.7 billion in 2024 leaves the tech giant in less than 18 months to join Sam Altman's Open AI,,
5ce94f39-57f3-4761-910e-8a7f20680de9,2026-06-18,OTHER,,,,Digital Journal,https://www.digitaljournal.com/article/robots-pour-cocktails-and-run-marathons-but-still-cant-multitask/,"They can mix cocktails, run marathons and fold laundry. But humanoid robots are still a long way from doing lots of different jobs on command, whatever the marketing says.","Robots pour cocktails and run marathons, but still can’t multitask",,
40338e31-92ed-448a-81d1-3b9c73473762,2026-06-18,OTHER,,,,R-bloggers.com,https://www.r-bloggers.com/2026/06/2026-rousseeuw-prize-for-statistics-awarded-to-r-core-team-for-transforming-statistics-computing-worldwide/,"[This article was first published on R-posts.com, and kindly contributed to R-bloggers]. (You can report issue about the content on this page here)
Want to share your content on R-bloggers?",2026 Rousseeuw Prize for Statistics Awarded to R Core Team for Transforming Statistics Computing Worldwide,,
f4127ff0-aeb1-4bbe-b8d3-d864da114840,2026-06-18,OTHER,,,,Pypi.org,https://pypi.org/project/bog-agents-cli/0.9.8/,"A required part of this site couldnt load. This may be due to a browser
 extension, network issues, or browser settings.",bog-agents-cli 0.9.8,,
52103c74-3160-4af4-b16c-ef63a7208cad,2026-06-18,OTHER,Penny,,,R-bloggers.com,https://www.r-bloggers.com/2026/06/rstudio-ai-that-doesnt-cost-a-penny-llmcoder-vs-posit-ai-assistant/,"[This article was first published on R-posts.com, and kindly contributed to R-bloggers]. (You can report issue about the content on this page here)
Want to share your content on R-bloggers?",RStudio AI That Doesn’t Cost a Penny: llmcoder vs. Posit AI Assistant,,
5b076136-0cc8-40f2-9053-6ccc963f925d,2026-06-18,OTHER,,,,Pypi.org,https://pypi.org/project/bog-agents/0.9.8/,"A required part of this site couldnt load. This may be due to a browser
 extension, network issues, or browser settings.",bog-agents 0.9.8,,
21635663-4327-4580-8a16-ca06c6ebb5ed,2026-06-18,POLICY_REGULATION,Intel,,,Insurance Journal,https://www.insurancejournal.com/news/national/2026/06/18/874239.htm,"Six months after President Donald Trump warned states not to regulate artificial intelligence, they are increasingly doing just that. Congress has stalled on producing federal regulation of artifici… [+6891 chars]",Some States Are Forging Ahead With AI Regulations,,
d332ada9-1bdd-42f8-9cea-3e0587ae767f,2026-06-18,OTHER,Trump Rejects Accountability,,US,Common Dreams,https://www.commondreams.org/news/trump-minab-school,President Donald Trump on Wednesday joined a long line of US leaders to brush off atrocities committed by American troops when he dodged questions about responsibility for the February cruise missile… [+6049 chars],'Mistakes Are Made': Trump Rejects Accountability for US Massacre at Iran Girls' School,,
cc5dbbba-3872-4ccb-b7c5-a503d78c97cf,2026-06-18,OTHER,,,,Pypi.org,https://pypi.org/project/nodecanon/0.1.1/,"A required part of this site couldnt load. This may be due to a browser
 extension, network issues, or browser settings.",nodecanon 0.1.1,,
86ff8f06-89be-4add-8a8b-0c0052282034,2026-06-18,OTHER,Intel,,,C-sharpcorner.com,https://www.c-sharpcorner.com/article/designing-enterprise-ai-service-catalogs-for-large-organizations/,"Introduction
As Artificial Intelligence adoption accelerates across enterprises, organizations are rapidly building AI-powered applications, intelligent assistants, automation solutions, document pr… [+9098 chars]",Designing Enterprise AI Service Catalogs for Large Organizations,,
d03271aa-07e7-43f5-91b5-f5d808bc853d,2026-06-18,OTHER,AI,,pleural mesothelioma,News-Medical.Net,https://www.news-medical.net/news/20260617/AI-accurately-measures-mesothelioma-tumors-for-better-treatment-decisions.aspx,Physicians and researchers at the Netherlands Cancer Institute have developed an AI model that outperforms physicians at evaluating treatment response in pleural mesothelioma. Being far more accurate… [+4137 chars],AI accurately measures mesothelioma tumors for better treatment decisions,,
1944eeac-3338-441e-be94-04a12c3bcd35,2026-06-18,OTHER,Intel,,,C-sharpcorner.com,https://www.c-sharpcorner.com/article/building-self-service-ai-platforms-for-internal-development-teams/,"Introduction
As Artificial Intelligence becomes a standard part of software development, many organizations face a new challenge: enabling development teams to use AI effectively without creating bo… [+8999 chars]",Building Self-Service AI Platforms for Internal Development Teams,,
539d28b9-8a0d-4f5e-97b2-9cfef12882ad,2026-06-18,OTHER,AI,,,Help Net Security,https://www.helpnetsecurity.com/2026/06/18/research-ai-coding-agent-oversight/,"Inside the labs building frontier AI, a growing share of the coding gets done by the AI itself. These agents write, edit, and run software with light human oversight between steps, and they reach int… [+4542 chars]",What happens to oversight when AI agents write a lab’s own code,,
11a6a2d8-722c-4911-a4c9-2908390d96b5,2026-06-18,OTHER,Google,,,Search Engine Journal,https://www.searchenginejournal.com/google-fix-b2b-marketing-expertcallers-spa/573278/,This post was sponsored by Expert Callers. The opinions expressed in this article are the sponsor’s own.,"Less Traffic, Better Leads: Is Google Fixing B2B Marketing?",,
943772f1-358a-41cb-9a82-6a9d400616d3,2026-06-18,OTHER,Intel,,,C-sharpcorner.com,https://www.c-sharpcorner.com/article/designing-ai-ready-multi-tenant-architectures-in-asp-net-core/,"Introduction
As organizations increasingly integrate Artificial Intelligence into their products and services, the demand for scalable multi-tenant AI platforms continues to grow. SaaS providers, en… [+8453 chars]",Designing AI-Ready Multi-Tenant Architectures in ASP.NET Core,,
65c8c42d-f41f-43b0-8936-148a97f2d77b,2026-06-18,OTHER,Central Bank Surging,,US,The Irish Times,https://www.irishtimes.com/business/2026/06/18/energy-price-shock-to-squeeze-irish-wage-growth-this-year-says-central-bank/,"Surging energy prices from the US-Israeli war with Iran will lead to a spike in costs for Irish households, which will all but wipe out any wage increases this year, the Central Bank has said, even i… [+3073 chars]","Energy price shock to squeeze Irish wage growth this year, says Central Bank",,
94172f83-7b7a-4634-8973-201c2e209d80,2026-06-18,OTHER,Charities,,,The Irish Times,https://www.irishtimes.com/crime-law/2026/06/18/plan-to-advise-charities-overseas-how-to-avoid-inadvertently-financing-terrorists/,Charities operating in higher-risk regions are set to receive guidance on how they can avoid inadvertently financing terrorists as part of a new Government plan to fight financial crime. The 30-poin… [+2959 chars],Plan to advise charities overseas how to avoid inadvertently financing terrorists,,
2ac42003-80fd-49d6-9ad3-e78205ccfca1,2026-06-18,OTHER,AI-Powered API Discovery,,,C-sharpcorner.com,https://www.c-sharpcorner.com/article/ai-powered-api-discovery-and-cataloging-in-enterprise-applications/,"Introduction
Modern enterprises rely heavily on APIs to connect applications, integrate services, enable automation, and support digital transformation initiatives. As organizations grow, the number… [+8931 chars]",AI-Powered API Discovery and Cataloging in Enterprise Applications,,
fa0aa932-d143-4e0a-b463-4040c38f42b5,2026-06-18,OTHER,the Three Lions,,England,Onefootball.com,https://onefootball.com/en/news/world-cup-highlights-england-croatia-in-top-game-ghana-sweat-43024125,"England and Croatia delivered what was probably the best match of the World Cup so far late on Wednesday evening. Thanks in no small part to an outstanding Harry Kane, the Three Lions ultimately triu… [+376 chars]"," World Cup highlights: England, Croatia in top game, Ghana sweat",,
4b9ef4f2-d033-4743-9011-48d255e8b5dc,2026-06-18,OTHER,AI-Driven Knowledge Base Maintenance: Keeping Enterprise Content Fresh Introduction,,,C-sharpcorner.com,https://www.c-sharpcorner.com/article/ai-driven-knowledge-base-maintenance-keeping-enterprise-content-fresh/,"Introduction
Knowledge bases are at the heart of modern enterprises. Organizations rely on documentation, policies, procedures, technical guides, support articles, and operational manuals to share i… [+8709 chars]",AI-Driven Knowledge Base Maintenance: Keeping Enterprise Content Fresh,,
05404837-70f1-435c-8fc1-24ae0370740d,2026-06-18,OTHER,,,,C-sharpcorner.com,https://www.c-sharpcorner.com/article/building-ai-powered-onboarding-assistants-for-engineering-teams/,"Introduction
One of the biggest challenges facing engineering organizations is onboarding new developers efficiently. Modern software systems are complex, often consisting of multiple repositories, … [+9264 chars]",Building AI-Powered Onboarding Assistants for Engineering Teams,,
41f7016a-a92e-4e53-83fb-560fac0d8562,2026-06-18,OTHER,"Implementing AI-Powered Data Classification Systems Using .NET Introduction
Organizations",,,C-sharpcorner.com,https://www.c-sharpcorner.com/article/implementing-ai-powered-data-classification-systems-using-net/,"Introduction
Organizations generate and process massive volumes of data every day. Customer records, financial reports, contracts, emails, support tickets, healthcare documents, and internal communi… [+8745 chars]",Implementing AI-Powered Data Classification Systems Using .NET,,
34b08779-ba00-483a-9f8c-d320281318c8,2026-06-18,OTHER,AI,,,C-sharpcorner.com,https://www.c-sharpcorner.com/article/prompt-caching-vs-semantic-caching-performance-optimization-strategies-for-ente/,"Introduction
As enterprise AI adoption grows, organizations are increasingly focused on optimizing the performance, scalability, and cost of their AI systems. Large Language Models (LLMs) deliver po… [+8392 chars]",Prompt Caching vs Semantic Caching: Performance Optimization Strategies for Enterprise AI Applications,,
be0e986b-a270-46be-ac9b-66fe4c9c56f2,2026-06-18,OTHER,The Mexican National Team,,South Africa,Onefootball.com,https://onefootball.com/en/news/we-can-face-any-rival-the-best-of-aguirres-press-conference-43024122,"The Mexican National Team faces its second Group A match at the 2026 World Cup. After beating South Africa 2-0 in its opener, El Tri will take on South Korea this Thursday, June 18, at Guadalajara St… [+1275 chars]",️ We can face any rival: the best of Aguirre's press conference,,
f25ae47d-9839-465c-b98f-3ecb8f10b68f,2026-06-18,OTHER,,,,Pypi.org,https://pypi.org/project/tend/0.1.6/,"A required part of this site couldnt load. This may be due to a browser
 extension, network issues, or browser settings.",tend 0.1.6,,
f66320c6-e917-429f-bee8-13f2d94782a3,2026-06-18,OTHER,"Context Compression Techniques for Enterprise AI Applications Introduction
One",,,C-sharpcorner.com,https://www.c-sharpcorner.com/article/context-compression-techniques-for-enterprise-ai-applications/,"Introduction
One of the biggest challenges when building enterprise AI applications is managing context efficiently. Large Language Models (LLMs) rely on context to understand user requests, generat… [+8777 chars]",Context Compression Techniques for Enterprise AI Applications,,
0dca7f55-a8d2-4fc4-8d0a-acd1134f5541,2026-06-18,OTHER,,,,Pypi.org,https://pypi.org/project/autorubric/1.5.1/,"A required part of this site couldnt load. This may be due to a browser
 extension, network issues, or browser settings.",autorubric 1.5.1,,
8cb0b0c1-e0c5-46d8-9b96-2fb5018f63c9,2026-06-18,OTHER,Intel,,,C-sharpcorner.com,https://www.c-sharpcorner.com/article/ai-reliability-engineering-preventing-hallucinations-in-production-systems/,"Introduction
As organizations move Artificial Intelligence from experimentation to production, reliability has become one of the most important concerns for development teams. While Large Language M… [+8185 chars]",AI Reliability Engineering: Preventing Hallucinations in Production Systems,,
cb8e0f82-365b-4a12-aae8-b9b38adcbc8e,2026-06-18,OTHER,Build AI-Powered Requirements Analysis Systems,,,C-sharpcorner.com,https://www.c-sharpcorner.com/article/how-to-build-ai-powered-requirements-analysis-systems-with-net/,"Introduction
One of the most common reasons software projects face delays, budget overruns, or quality issues is poorly defined requirements. Business requirements often arrive in the form of emails… [+8557 chars]",How to Build AI-Powered Requirements Analysis Systems with .NET,,
58f885c4-53b5-4d7b-8689-400b64792c34,2026-06-18,OTHER,"Core Introduction
Data",,,C-sharpcorner.com,https://www.c-sharpcorner.com/article/building-ai-powered-data-validation-pipelines-in-asp-net-core/,"Introduction
Data is the foundation of every modern application. Whether data originates from web forms, APIs, databases, IoT devices, or third-party integrations, ensuring its accuracy and consiste… [+7653 chars]",Building AI-Powered Data Validation Pipelines in ASP.NET Core,,
bbb3daa1-d802-4fea-8b47-fc8bf90a3ff7,2026-06-18,OTHER,,,,Pypi.org,https://pypi.org/project/open-data-products/0.2.5/,"A required part of this site couldnt load. This may be due to a browser
 extension, network issues, or browser settings.",open-data-products 0.2.5,,
7fb3c8a5-b81e-499e-ab80-cfc41ee6c653,2026-06-18,OTHER,Zee Entertainment’s,,India,The Times of India,https://economictimes.indiatimes.com/markets/stocks/news/will-zee-entertainments-fifa-world-cup-deal-turn-the-needle-for-its-3-3-crore-shareholders/articleshow/131817713.cms,"It was perhaps the first time in India that, until the final stretch, the country did not have an official broadcasting partner for what is arguably the world's biggest sporting event: the FIFA World… [+7125 chars]",Will Zee Entertainment’s FIFA World Cup deal turn the needle for its 3.3 crore shareholders?,,
f7c5a848-989a-4b98-b517-1f8b7c134f7a,2026-06-18,MODEL_RELEASE,Together AI,Claude,,Slashdot.org,https://slashdot.org/firehose.pl?op=view&amp;id=183955952,"Top Ten Things Overheard At The ANSI C Draft Committee Meetings:
 (5) All right, who's the wiseguy who stuck this trigraph stuff in
 here?",Anthropic Is Bringing Together AI Design and Coding in Claude - CNET,,
844aa49e-85a9-4ea0-8102-939b66c9ffef,2026-06-18,OTHER,,,,Pypi.org,https://pypi.org/project/tau-by-clarity/0.55.11/,"A required part of this site couldnt load. This may be due to a browser
 extension, network issues, or browser settings.",tau-by-clarity 0.55.11,,
48d93b8a-ba4a-41be-93d2-91e27bed4048,2026-06-18,OTHER,NVIDIA,,,Biztoc.com,https://biztoc.com/x/a5aa54f41480a7e6,"On Wednesday, Nvidia Corp (NASDAQ:NVDA) supplier SK Hynix began shipping samples of its latest high-bandwidth memory, or HBM, chips to major customers.SK Hynix Unveils Advanced HBM4E Memory For AI Wo… [+145 chars]",Nvidia Supplier SK Hynix Ships Next-Generation HBM Memory Samples To Major Customers,,
9ad38b3b-dd85-4eb8-913a-a01a6f2765a0,2026-06-18,OTHER,Anthropic,,Hong Kong,Biztoc.com,https://biztoc.com/x/ac8da963d36a00f7,"JPMorgan Chase has prevented the use of Anthropic's artificial intelligence (AI) models by its staff in Hong Kong, the Financial Times reported on Thursday, citing three people familiar with the situ… [+69 chars]",JPMorgan said to block Anthropic use for Hong Kong staff,,
0df89281-8003-49e1-83d7-cea7cc050b17,2026-06-18,FUNDING_EVENT,Intel,,,ComputerWeekly.com,https://www.computerweekly.com/news/366644823/UAEs-push-towards-agentic-AI-raises-stakes-for-governance-and-accountability,"The UAEs ambition to become a global leader in artificial intelligence (AI) is entering a new phase as government agencies move beyond AI experimentation towards large-scale deployment of autonomous,… [+6638 chars]",UAE’s push towards agentic AI raises stakes for governance and accountability,,
5b6ebd8a-08f0-455c-8998-6a894a459586,2026-06-18,OTHER,Anthropic,,US,Crypto Briefing,https://cryptobriefing.com/enisa-anthropic-us-ai-export-controls/,The EU's cybersecurity agency is sitting down with Anthropic just days after the US forced the company to suspend access to its most advanced AI models for foreign nationals The European Union Agency… [+2502 chars],ENISA meets Anthropic amid US export controls on AI models,,
491b5b6b-a1ff-46c8-879d-cbd923b3cb95,2026-06-18,OTHER,FC,,Norway,Onefootball.com,https://onefootball.com/en/news/fc-breakfast-giroud-shock-in-norway-da-fonseca-43024111,"After being stripped of the title of the all-time top scorer for Les Bleus, Olivier Giroud sent a little message to Kylian Mbappé via LOSC's Twitter account. Nice!",☕️ FC breakfast: Giroud  shock in Norway  Da Fonseca ,,
4bfc5fef-4266-42d5-8a08-1d721b17787d,2026-06-18,OTHER,,,Portugal,Onefootball.com,https://onefootball.com/en/news/cr7-horror-numbers-is-he-still-an-asset-for-portugal-43024109,"Cristiano Ronaldo wasnt obliged to answer Messi, or at least he didnt have to do it with a hat-trick: pulling it off would have been even more epochal than what we saw in Argentina-Algeria. But from… [+2155 chars]"," CR7: horror numbers, is he still an asset for Portugal? ",,
609d5d67-22cd-47c8-ba89-55f8fa89e36c,2026-06-18,OTHER,,,,Pypi.org,https://pypi.org/project/lmcache/0.4.8rc4/,"A required part of this site couldnt load. This may be due to a browser
 extension, network issues, or browser settings.",lmcache 0.4.8rc4,,
2c47e721-6fa0-4122-9599-7e37f5b0b500,2026-06-18,OTHER,Trump,,,The Times of India,https://economictimes.indiatimes.com/tech/technology/federal-regulators-back-trumps-plan-to-speed-power-to-energy-hungry-ai-data-centers/articleshow/131835285.cms,Federal regulators on Thursday agreed to let large energy users connect more quickly to the nation's inefficient and electric transmission system to accommodate surging demand from power-hungry artif… [+4435 chars],Federal regulators back Trump's plan to speed power to energy-hungry AI data centers,,
bfff210a-0fa2-4de4-8af2-56f4932207a3,2026-06-18,OTHER,Intel,,US,Cult of Mac,https://www.cultofmac.com/news/trump-says-apple-and-intel-will-build-chips-in-us,"A return to a new form of ""Intel Inside"" looks likely. Photo: Intel
President Donald J.",Trump says Apple and Intel will build chips together in US,,
ef1a3b4a-dfe9-4f95-b600-2d33af5c45d4,2026-06-18,OTHER,Microsoft,,China,Biztoc.com,https://biztoc.com/x/f80d86f17642d927,"Microsoft Corp (NASDAQ:MSFT) is expanding its artificial intelligence business in China, with ByteDance expected to spend more than $1 billion annually on the company's AI and cloud services, accordi… [+150 chars]","Microsoft expands AI business in China, with ByteDance emerging as top customer",,
f8d2ccab-c3e2-4713-8f78-4dca429a1bc7,2026-06-18,OTHER,Huawei,,,Khabarhub.com,https://english.khabarhub.com/2026/18/554520/,"KATHMANDU:  A delegation led by president of the Asia Pacific Region of Chinese company, Huawei, Terry He, paid a courtesy call on Minister for Information and Communications, Dr Bikram Timilsina, on… [+1872 chars]",Huawei regional president Terry calls on Minister Dr Timilsina,,
88c8b209-0e2e-4251-a9dd-1666651e8093,2026-06-18,POLICY_REGULATION,Intel,,Pennsylvania,The Daily Caller,https://dailycaller.com/2026/06/18/pennsylvania-approves-bill-to-force-companies-disclose-ai-ads/,"The Pennsylvania House of Representatives approved a bill Wednesday that would mandate companies disclose all artificial intelligence-generated content used to sell consumer goods. The legislation, … [+2933 chars]",Pennsylvania Approves Bill To Force Companies To Disclose AI In Ads,,
c414fd67-69e8-44fa-8816-820d5a444f98,2026-06-18,MODEL_RELEASE,AI Coding,,San Francisco,GlobeNewswire,https://www.globenewswire.com/news-release/2026/06/18/3314381/0/en/0G-Private-Computer-Launches-GLM-5-2-for-Private-Verifiable-AI-Coding.html,"San Francisco, CA, June 18, 2026 (GLOBE NEWSWIRE) -- 0G Labs, the blockchain for AI agents, today announced that GLM-5.2, the newly open-sourced large language model from Z.ai, is now live on 0G Priv… [+2719 chars]","0G Private Computer Launches GLM-5.2 for Private, Verifiable AI Coding",,
9e71c1a8-91d5-4934-b6ef-1f9f6b5b0b06,2026-06-18,OTHER,The Philosophical Consequences Of Simulations Back,,,Hedgehogreview.com,https://hedgehogreview.com/issues/humanism-in-a-posthumanist-age/articles/the-consolations-of-simulation,"Back a few years ago, when I was teaching a large survey course on moral reasoning, I happened to mention the simulation hypothesis. Immediately, to my surprise, my otherwise sleepy students clocked … [+35044 chars]",The Philosophical Consequences Of Simulations,,
b2c1538b-d9c3-46ef-9dc7-770513db30d6,2026-06-18,OTHER,"Commvault Systems, Inc.",,,GlobeNewswire,https://www.globenewswire.com/news-release/2026/06/18/3314378/0/en/Important-Notice-to-Long-Term-Shareholders-of-Commvault-Systems-Inc-NASDAQ-CVLT-LKQ-Corporation-NASDAQ-LKQ-Phreesia-Inc-NYSE-PHR-and-Power-Solutions-International-Inc-NASDAQ-PSIX-G.html,"PHILADELPHIA, June 18, 2026 (GLOBE NEWSWIRE) -- 
COMMVAULT SYSTEMS, INC. (NASDAQ: CVLT)
:
WHAT IS HAPPENING?","Important Notice to Long-Term Shareholders of Commvault Systems, Inc. (NASDAQ: CVLT); LKQ Corporation (NASDAQ: LKQ); Phreesia, Inc. (NYSE: PHR); and Power Solutions International, Inc. (NASDAQ: PSIX): Grabar Law Office is Investigating Claims on Your Behalf",,
08326633-3ba2-4f0b-aec8-2ac8e618b95d,2026-06-18,OTHER,NVIDIA,,,Biztoc.com,https://biztoc.com/x/9b643339ea92cab0,The post Michael Burry Called the 2008 Crash. Now Hes Shorting Nvidia to Buy This Boring Healthcare Stock.,Michael Burry Called the 2008 Crash. Now He’s Shorting Nvidia to Buy This Boring Healthcare Stock,,
415017fb-f28e-4bd6-8a60-bdbe0858da48,2026-06-18,OTHER,,,Hilperton,Blogger.com,https://www.blogger.com/browser-not-supported/?ref=/comment/fullpage/post/26204193/2157779072043637790,"I wondered if the FREE AI tools could provide me with information about a young boy's life in  Hilperton, Wiltshire in 1835. My 2nd great-grandfather, James Richman (1821-1912) was age 14 in 1835.","Ask AI: ""Describe the Life Of James Richman in 1835 At Age 14 in Hilperton, Wiltshire""",,
a873acac-c952-4b11-a50c-bb1b526a0ac3,2026-06-18,OTHER,CLI,Claude,,Github.com,https://github.com/sathish316/pi-omniagent-extensions/,All four files do the same job: they let Pi (the host coding agent) drive another coding agent's CLI as if it were just another model in Pi's /model picker. It uses ACP (https://agentclientprotocol.c… [+2036 chars],"Show HN: Pi Extension to Maximize AI Credits Across Cursor, Codex, ClaudeCode",,
e763b474-4865-4355-bfa8-45a2a7a2ed9e,2026-06-18,OTHER,AI,,,TechRadar,https://www.techradar.com/ai-platforms-assistants/chatgpt/i-asked-chatgpt-to-turn-me-into-a-1990s-action-figure-and-it-remembered-things-id-forgotten,Recently I asked ChatGPT to turn a childhood photo of me into a 1990s action figure. The surprising part wasn't the image itself.,I asked ChatGPT to turn me into a 1990s action figure — and it remembered things I'd forgotten,,
