event_id,date,category,company,product,location,source,url,summary,title,funding_usd
723df269-0652-4658-86aa-584c7318a663,2026-07-10,FUNDING_EVENT,OpenAI,,OpenAI,Biztoc.com,https://biztoc.com/x/097b09d804e419fe,Simo joined OpenAI in 2025 to oversee applications and products. She previously led Facebook and led Instacart through its IPO.,OpenAI top executive Fidji Simo steps down to focus on chronic illness recovery,
81c4dca2-7539-4279-b886-d7cd3b11ff16,2026-07-10,FUNDING_EVENT,IKS Health Completes Acquisition,,Dallas,BusinessLine,https://www.thehindubusinessline.com/brandhub/pr-release/iks-health-completes-acquisition-of-trubridge/article71205573.ece,"Dallas, TX, United States &amp; Mumbai, Maharashtra, India Business Wire India
IKS Health, a global leader in care enablement solutions across the patient journey, today announced the successful com… [+5802 chars]",IKS Health Completes Acquisition of TruBridge,
450f838d-eec5-45f8-9ba2-014b78cd4564,2026-07-09,FUNDING_EVENT,AI,,AI,Theregister.com,https://www.theregister.com/ai-and-ml/2026/07/09/singaporean-sovereign-wealth-fund-temasek-thinks-ai-has-a-future/5268953,"Singapores sovereign wealth fund Temasek, one of the worlds largest investment houses, intends to massively increase its investment in AI over the next five years both for its own use and across its … [+2213 chars]",Singaporean sovereign wealth fund Temasek thinks AI has a future,
2016b0e6-f3ae-47cf-9ca3-b485d6dacb20,2026-07-09,FUNDING_EVENT,AI,,AI,Theregister.com,https://www.theregister.com/ai-and-ml/2026/07/09/singaporean-sovereign-wealth-fund-temasek-thinks-ai-is-going-to-pay-off/5268953,"Singapores sovereign wealth fund Temasek, one of the worlds largest investment houses, intends to massively increase its investment in AI over the next five years both for its own use and across its … [+2213 chars]",Singaporean sovereign wealth fund Temasek thinks AI is going to pay off,
046a6c5c-8744-4056-b282-5282ac998a2c,2026-07-09,FUNDING_EVENT,PM Modi,,India,The Times of India,https://economictimes.indiatimes.com/news/economy/finance/pm-modi-invites-australian-businesses-to-invest-in-india-seeks-early-conclusion-of-ceca/articleshow/132276600.cms,Melbourne: Prime Minister Narendra Modi on Thursday pitched India as a long-term investment destination for Australian businesses and called for the early conclusion of the proposed bilateral Compreh… [+3971 chars],"PM Modi invites Australian businesses to invest in India, seeks early conclusion of CECA",
d8e38c20-fcce-44fc-90b5-186867892890,2026-07-09,FUNDING_EVENT,Intel,,US,SiliconANGLE News,https://siliconangle.com/2026/07/09/pitchbook-us-venture-funding-hits-412-7b-first-half-ai-deals-dominate/,"U.S. venture capital deal value hit $412.7 billion in the first half of 2026, nearly 30% more than investors put to work in all of last year — and a small cluster of giant artificial intelligence rou… [+5376 chars]",PitchBook: US venture funding hits $412.7B in first half as AI deals dominate,412700000000
2cda9160-f2b7-43ef-92ae-3c0af33f6f7d,2026-07-09,FUNDING_EVENT,Meta,,Alberta,The Times of India,https://economictimes.indiatimes.com/tech/technology/meta-to-build-c13-billion-alberta-data-center-its-first-in-canada/articleshow/132276591.cms,"Tech giant Meta announced Wednesday it will build a massive data center in central Alberta, the company's first in Canada, as it rapidly builds out computing capacity to support the global AI boom.Th… [+3516 chars]","Meta to build C$13 billion Alberta data center, its first in Canada",13000000000
0790fba2-88f0-481e-b503-6d0db4896291,2026-07-09,FUNDING_EVENT,Temasek International CIO,,US,Crypto Briefing,https://cryptobriefing.com/temasek-cio-warns-us-capex-market-risks/,Asia's largest state investor hit a record S$518 billion portfolio while flagging AI-driven capex as a growing threat to market stability When one of Asia’s most powerful sovereign wealth funds start… [+2093 chars],Temasek International CIO warns of market risks from US capital spending surge,518000000000
1776922a-6e4b-472c-a9e2-53a76a924f8c,2026-07-09,FUNDING_EVENT,OpenAI,GPT-5,OpenAI,Crypto Briefing,https://cryptobriefing.com/openai-changes-ai-models-trump-administration/,Sam Altman's company staggered the GPT-5.6 release after a new executive order established a 30-day review window for frontier AI models. OpenAI adjusted its release strategy for the GPT-5.6 series a… [+2749 chars],OpenAI made changes to AI models after talks with Trump administration,
5fa84f75-a245-4935-8d88-e0bc4c4bbbf6,2026-07-09,FUNDING_EVENT,Fundamentum,,India,BusinessLine,https://www.thehindubusinessline.com/companies/fundamentum-launches-2200-crore-third-fund-bets-on-ai-and-indias-series-b-opportunity/article71203056.ece,"Series B-focused venture capital firm Fundamentum has launched its third fund with a target corpus of 2,200 crore, including a 400-crore greenshoe option, as it looks to back Indias next generation o… [+3051 chars]","Fundamentum launches ₹2,200-crore third fund, bets on AI and India’s Series B opportunity",
50a4cb38-eabd-4557-b9cf-edfe150f85cd,2026-07-09,FUNDING_EVENT,Hynix,,US,Crypto Briefing,https://cryptobriefing.com/sk-hynix-28b-adr-offering-demand/,"Around 1,000 institutions piled into the ADR offering, with cornerstone investors alone committing up to $7B When a company raises $28 billion and investors still want more, that tells you something.… [+1963 chars]",SK Hynix’s $28B US share sale sees demand exceed seven times available shares,28000000000
1b15beed-26c8-4c2e-96cc-e3c87b26d5ba,2026-07-09,FUNDING_EVENT,Anthropic,,OpenAI,Biztoc.com,https://biztoc.com/x/2022370da6d95d36,"Weve talked before about the hot IPO summer, but with SpaceX just launched to public markets and Anthropic and (maybe) OpenAI soon to come, it can be easy to miss the sheer scale of whats happening.W… [+144 chars]","Anthropic, OpenAI, and SpaceX are bigger than the last 25 years of tech exits",
2a59dd74-c20c-48f5-bad5-156f25b1e0f3,2026-07-09,FUNDING_EVENT,Anthropic,,OpenAI,TechCrunch,https://techcrunch.com/2026/07/09/anthropic-openai-and-spacex-are-bigger-than-the-last-25-years-of-tech-exits/,"We’ve talked before about the hot IPO summer, but with SpaceX just launched to public markets and Anthropic and (maybe) OpenAI soon to come, it can be easy to miss the sheer scale of what’s happening… [+2192 chars]","Anthropic, OpenAI, and SpaceX are bigger than the last 25 years of tech exits | TechCrunch",
d9b3e44e-2345-4324-8378-49da398a7280,2026-07-08,FUNDING_EVENT,Vista Equity Partners,,Criteo,AdExchanger,http://www.adexchanger.com/daily-news-roundup/wednesday-08072026/,"Criteo In Play-O
Two private investment firms, Vista Equity Partners and Quinti Capital, have submitted a bid to acquire Criteo, Reuters reports. Criteo hasn’t reacted to the report publicly, nor h… [+3982 chars]","Bidders For Criteo; Who Needs Search Traffic, Anyway?",
321f74a5-ab75-474e-a4bf-d1fe509f0320,2026-07-08,FUNDING_EVENT,Echelon-Rockefeller Foundation,,America,PRNewswire,https://www.prnewswire.com/news-releases/as-ebola-surges-3-in-4-americans-back-restoring-us-aid-to-fight-it-per-new-echelon-rockefeller-foundation-poll-302820065.html,"<ul><li>Conducted ahead of America's 250th anniversary, the survey finds nine in ten Americans (90%) across the political spectrum support funding programs to prevent disease outbreaks abroad, the hi… [+14698 chars]","As Ebola Surges, 3 in 4 Americans Back Restoring U.S. Aid to Fight It, per New Echelon-Rockefeller Foundation Poll",
c74fe0c8-211e-43c7-b858-949b8b8327ba,2026-07-08,FUNDING_EVENT,Echelon-Rockefeller Foundation,,America,PRNewswire,https://www.prnewswire.com/news-releases/as-ebola-surges-3-in-4-americans-back-restoring-us-aid-to-fight-it-per-new-echelon-rockefeller-foundation-poll-302820085.html,"<ul><li>Conducted ahead of America's 250th anniversary, the survey finds nine in ten Americans (90%) across the political spectrum support funding programs to prevent disease outbreaks abroad, the hi… [+14533 chars]","As Ebola Surges, 3 in 4 Americans Back Restoring U.S. Aid to Fight It, per New Echelon-Rockefeller Foundation Poll",
166a8fb9-ffb1-4ab0-8081-89ce0627f0da,2026-07-08,FUNDING_EVENT,Nasdaq-100,,US,The Times of India,https://economictimes.indiatimes.com/markets/us-stocks/news/us-stock-market-starship-ai-ambitions-fuel-bullish-wall-street-outlook-on-newly-listed-spacex/articleshow/132253161.cms,"SpaceX is poised to receive billions of dollars in passive investment flows after its rapid inclusion in the Nasdaq-100 index, while Wall Street brokerages have initiated coverage of the aerospace an… [+3904 chars]","US Stock Market: Starship, AI ambitions fuel bullish Wall Street outlook on newly listed SpaceX",
d530daa8-4b71-4668-bc39-110accb84879,2026-07-08,FUNDING_EVENT,SemiAnalysis,,,24/7 Wall St.,https://247wallst.com/investing/2026/07/08/wall-street-thinks-ai-is-slowing-wall-street-is-wrong/,"Quick Read
<ul><li>SemiAnalysis projects $11.1 trillion in cumulative AI infrastructure spending through 2029, with annual investment topping $2 trillion by 2028 and still accelerating. </li><li>AI… [+6114 chars]",Wall Street Thinks AI Is Slowing. Wall Street Is Wrong,
38f70a10-8046-42a1-aae0-13e2a3bfe7c9,2026-07-08,FUNDING_EVENT,EPS,,,24/7 Wall St.,https://247wallst.com/investing/2026/07/08/this-undervalued-40-billion-company-is-ready-to-soar/,"Quick Read
<ul><li>Celestica raised 2026 revenue guidance to $19B and EPS to $10.15, while shares trade 19% below April's $413 filing price. </li><li>CLS surged 117% over the past year versus SPY's… [+4903 chars]",This Undervalued $40 Billion Company Is Ready To Soar,40000000000
3c14e738-87cd-4832-a084-e0ca7c0bd7ba,2026-07-08,FUNDING_EVENT,IBM,,,Ibtimes.com.au,https://www.ibtimes.com.au/ibm-shares-dip-ai-investment-concerns-market-volatility-1872043,"Shares of International Business Machines Corp. fell more than 1.6 percent Tuesday, closing at $301.10 as broader technology sector pressures and profit-taking weighed on the stock amid ongoing debat… [+6331 chars]",IBM Shares Decline 1.64 Percent as Tech Sector Faces AI Valuation Concerns and Market Rotation,
c0e73732-8769-4cd9-befa-87912212ebd0,2026-07-08,FUNDING_EVENT,NVIDIA,,,Biztoc.com,https://biztoc.com/x/bd2abbb2e2878d2a,"This article first appeared on GuruFocus.Nvidia (NVDA, Financials), the semiconductor company best known for AI chips, graphics processors and data-center hardware, is starting to look cheaper after … [+149 chars]",Nvidia Valuation Falls to Pre-AI Boom Low,
28b145ae-a248-4ad2-af12-df97bd475f16,2026-07-07,FUNDING_EVENT,,,,Digitimes,https://www.digitimes.com/news/a20260707PR202/electronics-acquisition-materials-supplier-manufacturing.html,"Keep me signed in
Some subscribers prefer to save their log-in information so they do not have to enter their User ID and Password each time they visit the site. To activate this function, check the… [+288 chars]",Solstice Advanced Materials to buy Element Solutions in US$14.5 billion deal,14500000000
79126b42-cfaf-4929-8f34-a827744ed36f,2026-07-07,FUNDING_EVENT,Google,,,Prtimes.jp,https://prtimes.jp/main/html/rd/p/000000127.000041941.html,"The article in English follows the Japanese version. By Josh Jung
Z Venture CapitalZVCAB180CAB180AirbridgeAIAirflux 
 AB180AIAirbridgeARR
Airbridge
 AirbridgeGoogleMetaTikTok
SaaS AB18021
AI A… [+5585 chars]",AB180への投資 / Investing in AB180,
bf0c1836-3787-475d-99ce-f55fc20730af,2026-07-07,FUNDING_EVENT,Anthropic,,,Digitimes,https://www.digitimes.com/news/a20260707VL206/infrastructure-anthropic-revenue-startup-expansion.html,"Keep me signed in
Some subscribers prefer to save their log-in information so they do not have to enter their User ID and Password each time they visit the site. To activate this function, check the… [+288 chars]",TeraWulf signs 20-year Anthropic AI infrastructure lease worth US$19B,19000000000
ea9049e0-4229-479a-968a-36778d895c2e,2026-07-07,FUNDING_EVENT,UN,,,Khabarhub.com,https://english.khabarhub.com/2026/07/557412/,"GENEVA: Global foreign direct investment (FDI) increased in 2025 after two consecutive years of decline, but the recovery remains narrow, fragile and uneven, according to a new report by the United N… [+2406 chars]",UN says foreign investment rebounds but recovery remains uneven,
ede7e7ea-576d-406a-8e99-e18e6cfa21e4,2026-07-07,FUNDING_EVENT,OpenAI,,OpenAI,Biztoc.com,https://biztoc.com/x/7c05438c296ed8b0,"was essentially hyped up as the IPO to end all IPOs. With OpenAI pushing its public debut back to 2027 and uncertainty swirling around how sustainable AI spending will be, it may very well be.Just 25… [+145 chars]","SpaceX Stock May Suddenly Seem Boring, But Don’t Miss This Chance to Make a Low-Risk, High-Reward Option Trade",
d8621949-c963-4513-9500-8cdd0d742ae0,2026-07-06,FUNDING_EVENT,Intel,,S. Korea's,Biztoc.com,https://biztoc.com/x/5671cbcbce5ae91f,South Korean President Lee Jae-myung called for the rapid execution of the new semiconductor and artificial intelligence (AI) investment projects.More to come...... This story appeared on breakingth… [+30 chars],"S. Korea's Lee urges fast-track for chip, AI projects",
0a78114a-208f-4853-a663-5e773d0f1d79,2026-07-06,FUNDING_EVENT,American Express,,,Yahoo Entertainment,https://finance.yahoo.com/markets/stocks/articles/american-express-axp-analysis-role-152237601.html,"Bretton Capital Management, an investment management company, released the ""Bretton Fund"" first-quarter 2026 investor letter. A copy of the letter can be downloaded here.",American Express (AXP): An Analysis of The Role of AI and Payment Systems,
e8ee5ff1-aba2-4eb2-a440-3965d2f92d3d,2026-07-06,FUNDING_EVENT,TSM,,,Yahoo Entertainment,https://finance.yahoo.com/markets/stocks/articles/exceptional-momentum-powers-taiwan-semiconductor-151708380.html,"RiverPark Advisors, an investment advisory firm and sponsor of the RiverPark family of mutual funds, released its ""RiverPark Large Growth Fund"" Q1 2026 investor letter. A copy of the letter can be do… [+4878 chars]",Exceptional Momentum Powers Taiwan Semiconductor Manufacturing’s (TSM) Rally,
84cd88ab-8dc1-4142-8b91-c5ba7543f91a,2026-07-06,FUNDING_EVENT,Microsoft,,,TechRadar,https://www.techradar.com/pro/microsoft-is-spending-usd2-5bn-on-deploying-ai-engineers-to-its-customers,"<ul><li>Microsoft Frontier Company to embed 6,000 engineers and specialists into customer organizations</li><li>Backed by $2.5 billion in Microsoft funding, it will help customers transform with cust… [+2524 chars]",Microsoft is spending $2.5bn on deploying AI engineers to its customers,2500000000
f2ed168d-62f3-4908-8ade-6772c9e51e8a,2026-07-04,FUNDING_EVENT,NVIDIA,,,24/7 Wall St.,https://247wallst.com/investing/2026/07/04/every-time-this-stock-dips-i-buy-more/,"Quick Read
<ul><li>NVIDIA (NVDA) grew Q1 revenue 85% to $81.6B and guided Q2 to $91B, beating estimates for the fourth consecutive quarter. </li><li>NVIDIA raised its dividend 25x, authorized $80B … [+3589 chars]","Every Time This Stock Dips, I Buy More",81600000000
6be79322-2377-44f6-bae9-1583003adf55,2026-07-04,FUNDING_EVENT,Marvell Technology,,,Yahoo Entertainment,https://finance.yahoo.com/technology/ai/articles/cantor-fitzgerald-raises-pt-marvell-141121931.html,"Marvell Technology, Inc. (NASDAQ:MRVL) is one of the Best AI and Technology Stocks to Buy Now.On June 29, Cantor Fitzgerald analyst C.J.",Cantor Fitzgerald Raises PT on Marvell Technology (MRVL) Stock,
68349047-e145-4c45-9be8-cc4ec099928b,2026-07-04,FUNDING_EVENT,the Small Business Capital Gap This Independence Day,,,GlobeNewswire,https://www.globenewswire.com/news-release/2026/07/04/3322023/0/en/Dream-Exchange-Calls-for-Venture-Exchanges-to-Help-Close-the-Small-Business-Capital-Gap.html,"This Independence Day, Dream Exchange founder and CEO Joe Cecala says record numbers of new American businesses need a public market built to help them grow. The company supports legislation similar … [+8120 chars]",Dream Exchange Calls for Venture Exchanges to Help Close the Small Business Capital Gap,
3574ca7b-619c-4c62-bfd5-4b2f6136259d,2026-07-04,FUNDING_EVENT,AI,,Modi,The Next Web,https://thenextweb.com/news/macron-modi-ai-infrastructure-personal-diplomacy/,"TL;DR
Macron and Modi are personally courting tech CEOs to secure AI infrastructure investment. Macron texted SoftBanks Son to land a 75 billion data centre deal, and Modi secured $48 billion from A… [+3995 chars]",Macron and Modi are winning the AI infrastructure race with text messages and personal meetings,48000000000
588a3162-9bd8-4554-ae25-75055aa03c66,2026-07-03,FUNDING_EVENT,IPO,,Kuaishou,Crypto Briefing,https://cryptobriefing.com/kuaishou-kling-ai-3b-funding-hong-kong/,"Chinese short-video giant is spinning off its AI video-generation unit with backing from General Atlantic and Tencent at an $18 billion valuation Kuaishou Technology, the Chinese short-video platform… [+1995 chars]","Kuaishou files for $3B Kling AI funding round in Hong Kong, eyes IPO within 12 months",3000000000
3a194f2a-53ca-4105-b89e-f2d182a91bcf,2026-07-03,FUNDING_EVENT,IPO,,,Biztoc.com,https://biztoc.com/x/5799fb94d5b2b05f,"SpaceX (NASDAQ: SPCX) went public on June 12 at $135 per share, raising $75 billion in the largest initial public offering (IPO) in history. Three weeks later, the rocket, satellite-internet, and art… [+143 chars]",SpaceX Might Be the Most Valuable Money-Losing Company in Market History. Should Investors Care?,75000000000
01c13eac-da03-4835-9e88-05c6d4f5e87b,2026-07-03,FUNDING_EVENT,SoftBank,,U.S.,Biztoc.com,https://biztoc.com/x/6642330d6f1553d1,"The mobile carrier operator and group company will set up the new venture this month, aiming to supply data center capacity at a scale of 10 gigawatts by around 2030. This story appeared on japantim… [+29 chars]",SoftBank plans to rent AI compute in U.S. at 10-gigawatt scale,
1a43c800-361e-4cac-9f36-6b7107353a68,2026-07-03,FUNDING_EVENT,Dividend King,,,24/7 Wall St.,https://247wallst.com/investing/2026/07/03/this-65-year-dividend-streak-nearly-broke-here-is-why-it-keeps-rising/,"Quick Read
<ul><li>CINF raised its quarterly dividend 8% to $0.94, extending its Dividend King streak to 65 consecutive years of increases. </li><li>After a $90 million net loss in Q1 2025 from Cal… [+6053 chars]",This 65-Year Dividend Streak Nearly Broke. Here Is Why It Keeps Rising,90000000
8bb66c3a-3560-4a56-8259-40fb92fd85a6,2026-07-02,FUNDING_EVENT,Wedbush,,Wedbush,Business Insider,https://www.businessinsider.com/dan-ives-wedbush-tech-calls-outfits-nvidia-microsoft-2026-7#article,"Dan Ives is leaving Wedbush as managing director and senior equity research analyst for his own venture.NASDAQ: ORBS)
<ul><li>Dan Ives is leaving Wedbush to launch a merchant bank focusing on the te… [+3352 chars]",The Dan Ives era at Wedbush is over. These are some of the calls — and colorful fits — people will remember.,
816611e1-fddc-44ff-9b7a-769245d2ce12,2026-07-02,FUNDING_EVENT,LinqAlpha,,,Crypto Briefing,https://cryptobriefing.com/linqalpha-series-a-funding-round/,The AI-focused fintech company is close to closing a significant capital raise as investor appetite for AI-driven financial tools continues to grow. LinqAlpha is approaching the close of a $22M Serie… [+1383 chars],LinqAlpha nears $22M in Series A funding round,22000000
aabb51bd-f149-4865-81c1-d3ab4693a301,2026-07-02,FUNDING_EVENT,AI,,Venice,Cointelegraph,https://cointelegraph.com/news/venice-ai-becomes-a-unicorn-as-ai-privacy-concerns-grow,"The Erik Voorhees-founded Venice AI has achieved unicorn status after raising $65 million in Series A funding at a $1 billion valuation. Led by Dragonfly and with backing from Coinbase Ventures, F-… [+3315 chars]",Venice AI becomes a unicorn as AI privacy concerns grow,65000000
3778129c-cacb-4e05-a514-fd9ad40d3e7c,2026-07-02,FUNDING_EVENT,Predictive Analytics,,,GlobeNewswire,https://www.globenewswire.com/news-release/2026/07/02/3321410/28124/en/Predictive-Analytics-and-AI-Tools-Propel-Revolution-in-Talent-Acquisition-Industry.html,"Dublin, July 02, 2026 (GLOBE NEWSWIRE) -- The ""AI in Talent Acquisition Market Report 2026"" has been added to ResearchAndMarkets.com's offering. The AI in talent acquisition market is witnessing a r… [+25032 chars]",Predictive Analytics and AI Tools Propel Revolution in Talent Acquisition Industry,
f1bb7980-6495-4fd8-8abd-5d7d44b2704e,2026-07-02,FUNDING_EVENT,Apple,,,Fortune,https://fortune.com/2026/07/02/trump-stopped-talking-warner-bros-comcast-portfolio-kept-trading/,"Of the seven Fortune 500 companies in President Trumps disclosed investment portfolio that also turn up somewhere in his public statements this year, five drew a clear 2026 comment from him: Apple, N… [+3763 chars]","Trump stopped talking about these media stocks, but his portfolio didn’t stop trading them",
effe5a7b-61e9-4a98-b1cd-e76f4521a761,2026-07-02,FUNDING_EVENT,Apple,,,Yahoo Entertainment,https://finance.yahoo.com/media-advertising/articles/trump-stopped-talking-media-stocks-142428079.html,"Of the seven Fortune 500 companies in President Trump's disclosed investment portfolio that also turn up somewhere in his public statements this year, five drew a clear 2026 comment from him: Apple, … [+3858 chars]","Trump stopped talking about these media stocks, but his portfolio didn’t stop trading them",
21983340-6c0f-4d6d-ae8a-a6a2b9615b0e,2026-07-02,FUNDING_EVENT,,,the United States,Fortune,https://fortune.com/2026/07/02/us-manufacturing-resilience-2-trillion-investment-mckinsey/,Intensifying technological competition and geopolitical risks have resurfaced a decades-old question with renewed urgency: Should the United States rebuild its industrial base?The United States impor… [+5002 chars],McKinsey chairs: Building a more resilient industrial base may require $2 trillion in investment,
d04f509f-f15f-4af1-ad44-89b08f1787f0,2026-07-02,FUNDING_EVENT,,,,Biztoc.com,https://biztoc.com/x/817c5ad2becd535e,"Quantum Systems said it had raised $1.2 billion at a valuation of roughly $8 billion, bringing in fresh capital to expand drone production and invest in software for autonomous systems powered by art… [+74 chars]",German Drone Maker Quantum Systems Raises Funding at $8 Billion Valuation,8000000000
e00dbfc6-bc88-402e-8ebe-4a1f2b5cbd4b,2026-07-01,FUNDING_EVENT,Amazon,,,Digitimes,https://www.digitimes.com/news/a20260701VL209/amazon-aws-launch-staff-data.html,"Keep me signed in
Some subscribers prefer to save their log-in information so they do not have to enter their User ID and Password each time they visit the site. To activate this function, check the… [+288 chars]",Amazon's new US$1 billion division aims to embed AI engineers in clients' teams,1000000000
dc6ea9bb-dd9e-4f18-a530-e457b7eeee49,2026-07-01,FUNDING_EVENT,Samsung,,,The Times of India,https://economictimes.indiatimes.com/markets/us-stocks/news/global-market-samsung-sk-hynix-double-down-on-ai-chip-boom-with-massive-investment-push-despite-oversupply-risks/articleshow/132105778.cms,"Samsung Electronics and SK Hynix are embarking on one of the world's largest semiconductor investment drives, committing trillions of won to expand memory chip production as they seek to capitalise o… [+3577 chars]","Global Market: Samsung, SK Hynix double down on AI chip boom with massive investment push despite oversupply risks",
1d9878b4-0c60-48a0-a535-1a874b88a470,2026-07-01,FUNDING_EVENT,IEA,,US,Crypto Briefing,https://cryptobriefing.com/iea-us-coal-gas-power-spending-50b/,America's fossil fuel power investment is surging to multi-decade highs as data centers and AI infrastructure drive unprecedented electricity demand The US is pouring money into fossil fuel power gen… [+1808 chars],IEA forecasts US spending on coal and gas power plants to hit $50B this year,50000000000
9d8dcdef-5835-48aa-8314-33bb51e793ae,2026-07-01,FUNDING_EVENT,BlackRock,,,The Times of India,https://economictimes.indiatimes.com/markets/us-stocks/news/global-market-blackrock-turns-cautious-on-emerging-market-stocks-upgrades-euro-zone-bonds/articleshow/132105718.cms,"The BlackRock Investment Institute (BII) has adopted a more cautious stance on emerging market equities and hard-currency debt in its mid-year investment outlook, while turning more positive on euro … [+1801 chars]","Global Market: BlackRock turns cautious on emerging market stocks, upgrades euro zone bonds",
7f465bf1-d67f-4c98-bd54-f394d134fc65,2026-07-01,FUNDING_EVENT,Walmart,,,AdExchanger,http://www.adexchanger.com/daily-news-roundup/wednesday-01072026/,Get Off My Property! Walmart turned heads with last week’s acquisition of TV ad platform Vibe.co.,Disowned And Unoperated Media; Looting Plunder From Pro Sports,
d642381f-4d33-4b85-add0-64ffbc0204e1,2026-07-01,FUNDING_EVENT,NVIDIA,,,Crypto Briefing,https://cryptobriefing.com/oxmiq-raises-35m-to-develop-gpu-chip-challenging-nvidias-dominance/,"Startup Oxmiq has announced a significant funding achievement, securing $35 million to advance its GPU chip architecture aimed at reducing the operational costs of AI. The company plans to develop a … [+1372 chars]",Oxmiq raises $35M to develop GPU chip challenging Nvidia’s dominance,35000000
548b681c-e7b5-4977-aac3-078fd83dd145,2026-07-01,FUNDING_EVENT,,,Venice,Crypto Briefing,https://cryptobriefing.com/venice-ai-hits-unicorn-status-with-65m-series-a-led-by-paradigm/,"Venice AI has officially reached unicorn status following a successful $65 million Series A funding round led by Paradigm. The company, known for its decentralized and privacy-focused artificial inte… [+1462 chars]",Venice AI hits unicorn status with $65M Series A led by Paradigm,65000000
