event_id,date,category,company,product,location,source,url,summary,title,funding_usd
7a9e9a2a-3c53-4249-a52b-e8438d9c78c4,"Wed, 26 Fe",FUNDING_EVENT,,,,TechCrunch AI,https://techcrunch.com/2025/02/25/elevenlabs-is-now-letting-authors-create-and-publish-audiobooks-on-its-own-platform/,"Voice AI company ElevenLabs is now letting authors publish AI-generated audiobooks on its own Reader app, TechCrunch has learned and the company confirmed. The announcement comes days after the company partnered with Spotify for AI-narrated audiobooks.",ElevenLabs now lets authors create and publish audiobooks on its own platform,180000000
b9bbba85-0329-402f-b2e3-371b08f1392d,"Wed, 24 Ju",FUNDING_EVENT,Beyond Trajectory Imitation,Qwen,,arXiv cs.AI,https://arxiv.org/abs/2606.24064,"arXiv:2606.24064v1 Announce Type: new 
Abstract: Distilling reasoning capabilities from strong to weak language models typically involves imitating specific solution trajectories, effectively transferring what to answer rather than how to reason. This trajectory-level imitation encourages memoriz...",Beyond Trajectory Imitation: Strategy-Guided Policy Optimization for LLM Reasoning,
96f41a84-39ee-4c29-bb22-9500196202a4,"Wed, 24 Ju",FUNDING_EVENT,Chemical-Informed Gaussian Processes for Reaction Network Discovery,,,arXiv cs.LG,https://arxiv.org/abs/2606.23757,"arXiv:2606.23757v1 Announce Type: new 
Abstract: Extracting interpretable governing equations from sparse, noisy chemical time-series data remains difficult because discrete reaction topology and continuous kinetic parameters are tightly coupled. We present PC-MCMC-CIGP, a reproducible gray-box w...",Synergizing Physically Constrained MCMC and Chemical-Informed Gaussian Processes for Reaction Network Discovery,
b1a6ecbc-7bcf-40d6-b19c-140054a5a97e,"Wed, 24 Ju",FUNDING_EVENT,ARIA,,,arXiv cs.LG,https://arxiv.org/abs/2606.23898,"arXiv:2606.23898v1 Announce Type: new 
Abstract: Distilling conditional diffusion models aims to transfer the behavior of a large teacher to a smaller student while preserving alignment across conditioning inputs. Unlike recognition tasks, knowledge distillation in conditional diffusion often str...",ARIA: Adaptive Region-Based Importance Allocation for Conditional Diffusion Distillation,
06257adf-fbf2-49cf-b0bf-41cf92bf86ab,"Wed, 17 Ju",FUNDING_EVENT,Skill-Constrained Model Predictive Control for Resilient Manufacturing Supply Chains,,,arXiv cs.AI,https://arxiv.org/abs/2606.17269,"arXiv:2606.17269v1 Announce Type: new 
Abstract: In skill-constrained production-inventory systems, the qualified human capacity available tomorrow depends on training decisions made today: production requires certified workers, certifications decay unless maintained, and training consumes the sa...",Skill-Constrained Model Predictive Control for Resilient Manufacturing Supply Chains,
f987e244-45ca-4286-8b43-f382c8f84c39,"Wed, 17 Ju",FUNDING_EVENT,ELK,Phi-3,GPT-2,arXiv cs.LG,https://arxiv.org/abs/2606.17229,"arXiv:2606.17229v1 Announce Type: new 
Abstract: A model that lies while knowing the truth is the central case ELK cannot handle with behavioral evaluation alone. We ask whether such deception leaves an internal signature distinguishing it from honest error.",Rift: A Conflict Signature for Deception in Language Models,
b6c48d71-7099-4a0c-8c27-8f24d581fa2c,"Wed, 17 Ju",FUNDING_EVENT,,,,arXiv cs.LG,https://arxiv.org/abs/2606.17331,"arXiv:2606.17331v1 Announce Type: new 
Abstract: Geosteering requires navigating a well trajectory through an unknown geological configuration, while sequentially updating decisions based on indirect measurements acquired during drilling. This work presents an uncertainty-aware geosteering framew...",Decision-Driven Geosteering Under Uncertainty: A Unified Framework for Sequential Decision Optimization,
755168c9-a44b-4777-97f8-d074a6dcb421,"Wed, 15 Ju",FUNDING_EVENT,Anthropic,Claude,,VentureBeat AI,https://venturebeat.com/ai/agentic-orchestration-enterprise-ai-organizations-have-a-deployment-problem-not-a-platform-problem-and-most-are-calling-chatbots-agents,"<p>Across 101 enterprises, agent orchestration is consolidating onto model-provider platforms — Anthropic’s Claude leads by a wide margin — chosen for the gravity of the underlying model and judged on reliable multi-step execution. But the ambition runs well ahead of the reality: most deployed “a...","Agentic orchestration: Enterprise AI organizations have a deployment problem, not a platform problem — and most are calling chatbots agents",
b51d3b33-163f-4002-9ef8-9b4dbb5a1bbb,"Wed, 15 Ju",FUNDING_EVENT,Optimal Adaptive Market Making: A Theoretical Framework,,,arXiv cs.AI,https://arxiv.org/abs/2607.11888,"arXiv:2607.11888v1 Announce Type: new 
Abstract: We develop a rigorous theoretical framework for optimal market making in perpetual futures markets with zero maker fees. We model the market maker's problem as a stochastic optimal control problem on a filtered probability space, where the controls...",Optimal Adaptive Market Making: A Theoretical Framework for High-Yield Liquidity Provision in Perpetual Futures Markets,
7f12d048-e94e-446d-a249-65c6b54f8725,"Wed, 15 Ju",FUNDING_EVENT,LLM,Claude,,arXiv cs.AI,https://arxiv.org/abs/2607.12227,"arXiv:2607.12227v1 Announce Type: new 
Abstract: We revisit the evaluation of automatic harness evolution for LLM agents. Existing harness evolution methods use unit test cases to search for harness configurations and then report final performance on the same public benchmark.",Rethinking the Evaluation of Harness Evolution for Agents,
262aa9a9-f339-48e3-9a0d-345d1df87ea4,"Wed, 10 Ju",FUNDING_EVENT,Google DeepMind,,,Google DeepMind,https://deepmind.google/blog/investing-in-multi-agent-ai-safety-research/,Google DeepMind and partners announce a $10M funding call for multi-agent safety research.,Investing in multi-agent AI safety research,10000000
3fe6a86d-5a26-43fb-99b6-c16508a2a1bf,"Wed, 08 Ju",FUNDING_EVENT,AI,,,arXiv cs.AI,https://arxiv.org/abs/2607.05456,"arXiv:2607.05456v1 Announce Type: new 
Abstract: While recent advances in large language models have enabled end-to-end automated manuscript generation, existing systems suffer from three critical deficiencies: (i) generated claims are not deterministically grounded in verifiable literature, (ii)...",Prompt-to-Paper: Agentic AI System for Bioinformatics,
051d56aa-52f9-4c7c-b611-f108e540d525,"Wed, 08 Ju",FUNDING_EVENT,AI,,,arXiv cs.AI,https://arxiv.org/abs/2607.05571,"arXiv:2607.05571v1 Announce Type: new 
Abstract: Large language models are increasingly explored as AI tutors, yet deploying them in K-12 settings raises concerns around privacy, cost, and reliance on proprietary models. Small language models (SLMs) offer a promising alternative, but selecting th...",CSTutorBench: Benchmarking Small Language Models as Tutors for Block-Based Programming,
6266aab7-bf6e-4917-85d3-7143aeac1046,"Wed, 08 Ju",FUNDING_EVENT,Intel,,,arXiv cs.LG,https://arxiv.org/abs/2607.05436,"arXiv:2607.05436v1 Announce Type: new 
Abstract: The rapid scaling of over-parameterized machine learning architectures, particularly LLMs, raises a profound crisis: do these systems exhibit genuine intelligence, or are they merely sophisticated statistical pattern matchers? Classical flat Euclid...",Statistically Meaningful Geometry and Gauge Symmetry Breaking: A Geometric Foundation for Scientific Discovery and Intelligence Emergence,
69217abd-6c2b-4b86-bb0f-b5b76c66d1f9,"Wed, 07 Ja",FUNDING_EVENT,Hugging Face,DeepSeek,,VentureBeat AI,https://venturebeat.com/technology/nous-researchs-nouscoder-14b-is-an-open-source-coding-model-landing-right-in,"<p><a href=""https://nousresearch.com/"">Nous Research</a>, the open-source artificial intelligence startup backed by crypto venture firm <a href=""https://www.paradigm.xyz/"">Paradigm</a>, released a new competitive programming model on Monday that it says matches or exceeds several larger proprieta...",Nous Research's NousCoder-14B is an open-source coding model landing right in the Claude Code moment,65000000
598e57c2-d93f-4d4f-9834-7aabae72db91,"Wed, 01 Ju",FUNDING_EVENT,Meta,,,arXiv cs.AI,https://arxiv.org/abs/2606.30997,"arXiv:2606.30997v1 Announce Type: new 
Abstract: We present a three-phase deep reinforcement learning system for personalized portfolio management that addresses three limitations shared by all prior financial RL work: 1) ticker lock-in, 2) monolithic objectives , and 3) static user models. Phase...",A Three-Phase Foundation Model for Tax-Aware Personalized Portfolio Management,
14567a98-6dfb-4f2d-bef5-667c9b808907,"Wed, 01 Ju",FUNDING_EVENT,TS,,,arXiv cs.LG,https://arxiv.org/abs/2606.30778,"arXiv:2606.30778v1 Announce Type: new 
Abstract: Mapping a chemical reaction network, the graph of minima and transition states (TS) and the elementary reactions connecting them, is the natural language of chemistry, from catalysis to combustion to the origin of life. Constructing such a reaction...",ReactionAtlas: Ab origine exploration of chemical reaction networks with machine learning,
56beb7d1-fb9f-419a-a990-31e7b88851e3,"Tue, 30 Ju",FUNDING_EVENT,,,,arXiv cs.LG,https://arxiv.org/abs/2606.28525,"arXiv:2606.28525v1 Announce Type: new 
Abstract: Fine-tuning on harmless data can partially undo behaviors acquired earlier in training. Safety can erode under benign post-alignment updates, unlearned capabilities can re-emerge, latent traits can transfer through apparently unrelated supervision,...",A Gravitational Interpretation of Fine-Tuning Reversion,
b5ff7585-2dcc-4666-874c-8b010c862f1e,"Tue, 27 Ma",FUNDING_EVENT,,,,TechCrunch AI,https://techcrunch.com/2025/05/27/gridcare-thinks-more-than-100-gw-of-data-center-capacity-is-hiding-in-the-grid/,Gridcare raised $13.3 million for its data platform that finds underutilized capacity on the electrical grid.,Gridcare thinks more than 100 GW of data center capacity is hiding in the grid,13300000
92f3e961-7c6d-4204-a19f-779ebedb93cc,"Tue, 23 Ju",FUNDING_EVENT,ToT,Llama,,arXiv cs.AI,https://arxiv.org/abs/2606.20599,"arXiv:2606.20599v1 Announce Type: new 
Abstract: Tree of Thought (ToT) search has become a promising direction for improving the reasoning capabilities of large language models, but deploying these methods in practice raises a question that has received little systematic attention: how do differe...",Beyond Fixed Budgets: Characterizing the Inelasticity and Limitations of Tree-of-Thought Reasoning Strategies,
9cfad8c3-b4d7-4c40-8aef-2d828ede7d3e,"Tue, 23 Ju",FUNDING_EVENT,SkillHarness,,,arXiv cs.AI,https://arxiv.org/abs/2606.20636,"arXiv:2606.20636v1 Announce Type: new 
Abstract: Computer-Use Agents (CUAs) are increasingly deployed in dynamic interactive environments, creating a growing need for continual skill learning during interaction. Recent approaches address this challenge by learning reusable skills from successful ...",SkillHarness: Harnessing Safe Skills for Computer-Use Agents,
5fb05758-bb89-46de-8eb9-47ce4f5deb4a,"Tue, 23 Ju",FUNDING_EVENT,NeuroShield,,,arXiv cs.LG,https://arxiv.org/abs/2606.20673,"arXiv:2606.20673v1 Announce Type: new 
Abstract: A central challenge in EEG authentication is that models are typically tied to the acquisition settings in which they are trained. In particular, variations in headset hardware, channel layout, and signal duration create heterogeneous recordings th...",NeuroShield: A Device-Agnostic Foundation Model for EEG Authentication,
b993594b-e46d-48a8-96b9-ef53ef6a9398,"Tue, 19 Ma",FUNDING_EVENT,Google DeepMind,Gemini,,VentureBeat AI,https://venturebeat.com/technology/google-just-redesigned-the-search-box-for-the-first-time-in-25-years-heres-why-it-matters-more-than-you-think,"<p>For a quarter century, the Google search box has been one of the most recognizable interfaces in computing: a thin white rectangle, a blinking cursor, a few typed words, and a list of blue links. On Tuesday, Google will formally retire that paradigm.</p><p>At its annual <a href=""https://io.goo...",Google just redesigned the search box for the first time in 25 years — here’s why it matters more than you think.,190000000000
9a92760a-9cd8-43a9-a1db-a7ea49684004,"Tue, 16 Ju",FUNDING_EVENT,LLM,,,arXiv cs.AI,https://arxiv.org/abs/2606.15029,"arXiv:2606.15029v1 Announce Type: new 
Abstract: LLM judges are used to reduce the need for costly human labor in evaluating open-ended text generation. However, the reliability of these judges depends critically on their alignment with human raters -- a property that itself depends on costly hum...",Metric Match: A Subset Selection Approach to Evaluating LLM Judge Reliability,
348d5ce1-26f2-45fc-a66f-a158ce9d91d4,"Tue, 14 Ju",FUNDING_EVENT,Verifier,Qwen,Qwen3,arXiv cs.AI,https://arxiv.org/abs/2607.09709,"arXiv:2607.09709v1 Announce Type: new 
Abstract: Post-training a code generator against a learned judge can optimize proxy features that raise the score without improving the artifact. We study the opposite signal: a deterministic, judge-free, ungameable filter -- whether a generated project laun...",The Verifier is the Curriculum: Execution-Gated Self-Distillation for Cross-Family Game Generation,
6af29886-d0ce-4c34-a1f9-31ad0a9c3eaa,"Tue, 14 Ju",FUNDING_EVENT,Reference-Based Distillation Detection,DeepSeek,,arXiv cs.LG,https://arxiv.org/abs/2607.09692,"arXiv:2607.09692v1 Announce Type: new 
Abstract: Model distillation -- training on outputs from stronger third-party models -- is widely used to boost performance, but raises concerns about unfair advantages and policy violations. This motivates a fundamental question: can we detect whether a mod...",Reference-Based Distillation Detection in LLMs,
49c06ade-cdc8-417c-8916-684cdc4f069d,"Tue, 13 Ja",FUNDING_EVENT,OpenAI,,,TechCrunch AI,https://techcrunch.com/2026/01/13/ai-drug-discovery-startup-converge-bio-pulls-in-25m-from-bessemer-and-execs-from-meta-openai-and-wiz/,"AI drug discovery startup Converge Bio raised $25 million in a Series A led by Bessemer Venture Partners, with additional backing from executives at Meta, OpenAI, and Wiz.","Converge Bio raises $25M, backed by Bessemer and execs from Meta, OpenAI, Wiz",25000000
506f86ea-367c-4f7d-8021-8850b663b8e2,"Tue, 07 Ju",FUNDING_EVENT,Intel,,,arXiv cs.AI,https://arxiv.org/abs/2607.02983,"arXiv:2607.02983v1 Announce Type: new 
Abstract: Recent reasoning-centric Large Language Models (LLMs) have made significant strides, yet they predominantly operate on a passive-inference pattern that assumes complete information. In contrast, real-world clinical intelligence is inherently an ite...",Reinforcement Learning for Evidence-Seeking Diagnostic Reasoning with Large Language Models,
6362003c-862c-4d38-b11a-cce505375462,"Tue, 07 Ju",FUNDING_EVENT,Large Language Models,,,arXiv cs.AI,https://arxiv.org/abs/2607.03303,"arXiv:2607.03303v1 Announce Type: new 
Abstract: While Large Language Models (LLMs) can provide personalized support in learning, several studies have raised concerns regarding their use in education. Importantly, learning depends on how students engage with LLMs.",Reflective Dialogue or Prompt Refinement? Effects of Tutor Scaffolding on Students' Independent LLM Use for Programming,
b789b1a8-a7fc-40fc-8d41-fac237638d73,"Tue, 07 Ju",FUNDING_EVENT,Federated Learning for Object Detection:,,,arXiv cs.LG,https://arxiv.org/abs/2607.02636,"arXiv:2607.02636v1 Announce Type: new 
Abstract: Object detection is a fundamental capability for AI-driven perception in safety-critical drone and edge-vision systems, including disaster response, operational security environments, infrastructure monitoring and defense applications. Robust model...",Federated Learning for Object Detection: Enabling Collaborative Drone Learning Without Centralizing Data,
a3703f40-f913-4e0d-95fd-0161881da2c8,"Thu, 25 Ju",FUNDING_EVENT,Intel,,,arXiv cs.LG,https://arxiv.org/abs/2606.24900,"arXiv:2606.24900v1 Announce Type: new 
Abstract: This paper proposes a new approach to near-sensor computing, in which a lightweight Neural Architecture Search (NAS) is performed directly on the deployment device to find the best tiny neural architecture for analyzing the real-time data acquired ...",On-Device Neural Architecture Search,
8d954372-a151-4c47-ad90-641ac163591f,"Thu, 25 Ju",FUNDING_EVENT,SEC,,U.S.,arXiv cs.LG,https://arxiv.org/abs/2606.24950,"arXiv:2606.24950v1 Announce Type: new 
Abstract: Financial decision-making is contextual: forecasting prices, valuing companies, and assessing event exposure weigh price history, accounting fundamentals, macroeconomic regime, and contemporaneous text. A benchmark over these four signals is hard t...",MacroLens: A Multi-Task Benchmark for Contextual Financial Reasoning under Macroeconomic Scenarios,
a134720f-0aa8-4ac2-8c58-b2d66e87950a,"Thu, 22 Ja",FUNDING_EVENT,Microsoft,Claude,,VentureBeat AI,https://venturebeat.com/infrastructure/railway-secures-usd100-million-to-challenge-aws-with-ai-native-cloud,"<p><a href=""https://railway.com/"">Railway</a>, a San Francisco-based cloud platform that has quietly amassed two million developers without spending a dollar on marketing, announced Thursday that it raised $100 million in a Series B funding round, as surging demand for artificial intelligence app...",Railway secures $100 million to challenge AWS with AI-native cloud infrastructure,100000000
a66a8157-be5d-4e6b-97b4-d73029fd5205,"Thu, 18 Ju",FUNDING_EVENT,SFT,,,arXiv cs.LG,https://arxiv.org/abs/2606.18307,"arXiv:2606.18307v1 Announce Type: new 
Abstract: Optimizing the training data distribution for Supervised Fine-Tuning (SFT) dictates the capability of Large Language Models (LLMs). While existing data curation methods excel at accelerating training under constrained budgets, they are less suited ...",DRIFT: Refining Instruction Data via On-Policy Data Attribution,
ac3744fe-4544-4a39-9fa5-7ae0091835f8,"Thu, 16 Ju",FUNDING_EVENT,Modal,,,arXiv cs.AI,https://arxiv.org/abs/2607.13558,"arXiv:2607.13558v1 Announce Type: new 
Abstract: Urban region profiling constitutes a core problem in urban computing, supporting applications such as population estimation, economic assessment, and environmental monitoring. Existing methods typically formulate this task as multimodal representat...",Multi-Agent Collaborative Reasoning with Tool-Augmented Evidence for Urban Region Profiling,
e87d2791-961c-4194-9ca8-31126e7ab4a5,"Thu, 16 Ju",FUNDING_EVENT,Perplexity,,,arXiv cs.LG,https://arxiv.org/abs/2607.13124,"arXiv:2607.13124v1 Announce Type: new 
Abstract: Structured pruning is a hardware-friendly way to compress LLMs, but it is mostly validated on multiple-choice recognition tasks, while the same compressed checkpoints can collapse on the free-form generation that deployment actually requires. Two o...",ShortOPD: Recovering Pruned LLMs with Short-to-Long On-Policy Distillation,
901d7cc8-22ae-4eb5-a046-213de4a1e0de,"Thu, 16 Ju",FUNDING_EVENT,Anthropic,Gemini,,VentureBeat AI,https://venturebeat.com/ai/the-ai-compute-gap-enterprises-are-buying-infrastructure-faster-than-they-can-measure-what-it-costs,"<p>Across 107 enterprises, AI infrastructure spending is accelerating well ahead of the ability to see or steer its economics. Most organizations run their AI on a familiar base of hyperscalers and model-provider APIs, yet the next dollar is aimed at specialized compute almost none of them use to...",The AI compute gap: Enterprises are buying infrastructure faster than they can measure what it costs,
6e0b6a8d-9663-4151-86d4-2faa755995f4,"Thu, 16 Ju",FUNDING_EVENT,OpenAI,,,VentureBeat AI,https://venturebeat.com/ai/the-ai-context-gap-enterprise-ai-organizations-have-a-trust-problem-not-a-retrieval-problem-and-most-are-still-building-the-fix,"<p>Across 101 enterprises, the infrastructure that feeds AI agents their business context is being built faster than it can be trusted. Retrieval-augmented generation is already the default context source, and provider-native retrieval has quietly overtaken the dedicated vector databases that def...","The AI context gap: Enterprise AI organizations have a trust problem, not a retrieval problem — and most are still building the fix",
532f694a-747b-4d81-bbed-b9cdf03888fe,"Thu, 09 Ju",FUNDING_EVENT,"Reason Less, Verify More: Deterministic Gates Recover a Silent Policy-Violation Failure Mode",GPT-4o,,arXiv cs.AI,https://arxiv.org/abs/2607.07405,"arXiv:2607.07405v1 Announce Type: new 
Abstract: Tool-using LLM agents can violate the very policies they are deployed to enforce while appearing to complete the task successfully. In policy-permissive environments, a tool may execute any well-formed call even when the corresponding state transit...","Reason Less, Verify More: Deterministic Gates Recover a Silent Policy-Violation Failure Mode in Tool-Using LLM Agents",
9bae2dd3-edfd-475e-b544-64c17da4fd71,"Thu, 09 Ju",FUNDING_EVENT,Deep Reinforcement Learning for Reliability,,,arXiv cs.LG,https://arxiv.org/abs/2607.06610,"arXiv:2607.06610v1 Announce Type: new 
Abstract: Portfolio optimization under uncertainty is inherently a multi-objective decision problem involving complex interactions among return, risk, market dynamics, and practical investment constraints. Existing reliability based portfolio optimization ap...",Deep Reinforcement Learning for Reliability Based Bi-Objective Portfolio Optimization,
da7bbb67-ab0a-43a8-aa01-571226a02482,"Thu, 09 Ju",FUNDING_EVENT,Causal Mechanisms Underlying Anhedonia arXiv:2607.06626v1,,anhedonia,arXiv cs.LG,https://arxiv.org/abs/2607.06626,"arXiv:2607.06626v1 Announce Type: new 
Abstract: Recent Vision-Language Models capture increasingly complex aspects of human cognition. Here we ask whether this alignment extends to reward valuation, which we assess in a mechanistic framework built on clinical tests that were developed to evaluat...",Reward Valuation in Vision Language Models: Causal Mechanisms Underlying Anhedonia,
7c5add8a-4d66-4eef-bec2-7f2fe6bd52f3,"Sat, 11 Ju",FUNDING_EVENT,,,,arXiv cs.AI,https://arxiv.org/abs/2607.07850,"arXiv:2607.07850v1 Announce Type: new 
Abstract: For seemless control of advanced hand prostheses and augmented reality, accurate and immediate hand gestures recognition is essential. Surface electromyography (sEMG) signals obtained from the forearm are commonly employed for this purpose.",A Graph Neural Network Model for Real-Time Gesture Recognition Based on sEMG Signals,
cc2ed8fe-53d7-4f5a-aa18-8f5b6220684f,"Sat, 11 Ju",FUNDING_EVENT,Domain-Grounded Reasoning Layer,,Nigeria,arXiv cs.AI,https://arxiv.org/abs/2607.07883,"arXiv:2607.07883v1 Announce Type: new 
Abstract: There is relatively little, public, and model-ready data on industrial machinery for African economies. This makes it hard to do quantitative analysis or to train language models on numeric tasks grounded in that setting.",Nigeria Machinery: A Low-Resource Industrial Dataset with a Domain-Grounded Reasoning Layer,
0450b4e0-084b-4aba-af50-ec959d6a6cad,"Mon, 29 Ju",FUNDING_EVENT,Intel,,,arXiv cs.AI,https://arxiv.org/abs/2606.27757,"arXiv:2606.27757v1 Announce Type: new 
Abstract: Large language models (LLMs) have attracted widespread attention from academia and industry, yet their deployment raises critical security concerns regarding robustness and reliability. Planning, a core component of intelligent behavior, remains ch...",Towards Reliable and Robust LLM Planning: Symbolic Feedback-Driven Iterative Self-Refinement Framework,
61321c76-99c4-49be-808c-11b9917e489d,"Mon, 29 Ju",FUNDING_EVENT,Grounded Iterative Language Planning: How Parameterized World Models Reduce Hallucination Propagation,GPT-4o,,arXiv cs.AI,https://arxiv.org/abs/2606.27806,"arXiv:2606.27806v1 Announce Type: new 
Abstract: World models for language agents come in two useful forms. An agent-based world model calls an LLM API and reasons flexibly in language, but its errors appear as hallucinated state changes that are hard to score with ordinary regression losses.",Grounded Iterative Language Planning: How Parameterized World Models Reduce Hallucination Propagation in LLM Agents,
96c1ecf1-b32e-475e-b175-86692c262f05,"Mon, 13 Ju",FUNDING_EVENT,Scoped Verification for Reliable Long-Horizon Agentic Context Evolution,Gemini 2,,arXiv cs.AI,https://arxiv.org/abs/2607.09175,"arXiv:2607.09175v1 Announce Type: new 
Abstract: Deployed LLM agents rely on agentic context, the model-external textual control content assembled by an operational harness. In this work, the mutable component of that context is a persistent system-level instruction that is updated from operation...",Scoped Verification for Reliable Long-Horizon Agentic Context Evolution under Distribution Shift,
997cdbd6-3032-4ec5-baa3-68845a6ba5d1,"Mon, 13 Ju",FUNDING_EVENT,the Geometry of Refusal,,,arXiv cs.LG,https://arxiv.org/abs/2607.08883,"arXiv:2607.08883v1 Announce Type: new 
Abstract: Behavioral alignment in large language models often masks fragile internal safety representations. Recent work suggests that refusal behavior is mediated by low-dimensional directions in activation space.",Optimizing Against Safety Representations: Activation-Guided Adversarial Suffixes and the Geometry of Refusal,
0a97e197-249f-4c09-adde-05acc43ad882,"Fri, 26 Ju",FUNDING_EVENT,Partially Observable Markov Decision Process,,,arXiv cs.LG,https://arxiv.org/abs/2606.26168,"arXiv:2606.26168v1 Announce Type: new 
Abstract: Living systems navigate environments using noisy and incomplete sensory signals. In unicellular algae, phototaxis is often modeled as a mechanistic run--tumble process driven by stimulus--response rules.",Implementation of reinforcement learning in chemical reaction networks: application to phototaxis as curiosity-driven exploration,
