event_id,date,category,company,product,location,source,url,summary,title,hardware_name
17b6b145-7e92-4804-87ee-7683c1f5c8f3,2026-06-28,GPU_RELEASE,Intel,,GB,Slickdeals.net,https://slickdeals.net/f/19640409-skytech-crystal-desktop-intel-ultra-5-225f-cpu-arc-b580-gpu-32gb-ram-1tb-ssd-900-free-s-h,"This collaborative space allows users to contribute additional information, tips, and insights to enhance the original deal post. Feel free to share your knowledge and help fellow shoppers make infor… [+26 chars]","Skytech Crystal Desktop: Intel Ultra 5 225F CPU, ARC B580 GPU, 32GB RAM, 1TB SSD $900 + Free S&H",Hopper
b64d059d-5265-4c60-b94e-e5422bc123a6,2026-06-28,GPU_RELEASE,NVIDIA,,,Softpedia.com,https://drivers.softpedia.com/get/GRAPHICS-BOARD/NVIDIA/Quanta-NVIDIA-GeForce-RTX-4070-Laptop-GPU-Graphics-Driver-32-0-15-9166-for-Windows-10-64-bit.shtml,"The package provides the installation files for Quanta NVIDIA GeForce RTX 4070 Laptop GPU Graphics Driver version 32.0.15.9166 .If the driver is already installed on your system, updating (overwrite-… [+2179 chars]",Quanta NVIDIA GeForce RTX 4070 Laptop GPU Graphics Driver 32.0.15.9166 for Windows 10 64-bit,
dcd37a45-d649-432f-b42d-1d8f39cff165,2026-06-28,GPU_RELEASE,NVIDIA,,,Softpedia.com,https://drivers.softpedia.com/get/GRAPHICS-BOARD/NVIDIA/Quanta-NVIDIA-GeForce-RTX-4070-Laptop-GPU-Graphics-Driver-32-0-15-9166-for-Windows-10-Vibranium-64-bit.shtml,"The package provides the installation files for Quanta NVIDIA GeForce RTX 4070 Laptop GPU Graphics Driver version 32.0.15.9166 .If the driver is already installed on your system, updating (overwrite-… [+2179 chars]",Quanta NVIDIA GeForce RTX 4070 Laptop GPU Graphics Driver 32.0.15.9166 for Windows 10 Vibranium 64-bit,
49036f04-443e-4168-a5ea-609d824b7b77,2026-06-28,GPU_RELEASE,Apple,,Mac,Cult of Mac,https://www.cultofmac.com/news/apple-silicon-mac-ram-price-hikes,"Every Mac's Apple Silicon processor includes RAM and storage outsourced from memory chip makers. Photo: iFixit
Can’t understand why the rising cost of memory chips forces a hike in Mac prices?",Why Apple silicon Macs aren’t immune to RAM price hikes,
03d62961-5f99-4239-80a1-4dc589f867c0,2026-06-28,GPU_RELEASE,NVIDIA,,,Softpedia.com,https://drivers.softpedia.com/get/GRAPHICS-BOARD/NVIDIA/Quanta-NVIDIA-RTX-3500-Ada-Generation-Laptop-GPU-Graphics-Driver-32-0-15-9166-for-Windows-11-version-25H2.shtml,"The package provides the installation files for Quanta NVIDIA RTX 3500 Ada Generation Laptop GPU Graphics Driver version 32.0.15.9166.If the driver is already installed on your system, updating (over… [+2185 chars]",Quanta NVIDIA RTX 3500 Ada Generation Laptop GPU Graphics Driver 32.0.15.9166 for Windows 11 version 25H2,
656468c2-e559-41f1-b2da-10ec3944bbbe,2026-06-28,GPU_RELEASE,NVIDIA,,,Softpedia.com,https://drivers.softpedia.com/get/GRAPHICS-BOARD/NVIDIA/Quanta-NVIDIA-RTX-3500-Ada-Generation-Laptop-GPU-Graphics-Driver-32-0-15-9166-for-Windows-11-version-24H2.shtml,"The package provides the installation files for Quanta NVIDIA RTX 3500 Ada Generation Laptop GPU Graphics Driver version 32.0.15.9166.If the driver is already installed on your system, updating (over… [+2185 chars]",Quanta NVIDIA RTX 3500 Ada Generation Laptop GPU Graphics Driver 32.0.15.9166 for Windows 11 version 24H2,
5e1f75ac-fe64-4ee6-b1f6-cbcddeb44f20,2026-06-28,GPU_RELEASE,NVIDIA,,US,Biztoc.com,https://biztoc.com/x/50cb3c52b7a1e989,"Micron, the Boise, Idaho-based memory chip maker, has captured Wall Streets heart. Whether the love affair endures will heavily depend on how long the AI-driven supply crunch for memory chips lasts.M… [+146 chars]",Why Wall Street thinks US memory maker Micron is the next Nvidia,
ecf1c1e3-6b92-41e3-92a9-adae3c62e531,2026-06-27,GPU_RELEASE,NVIDIA,,overwrit,Softpedia.com,https://drivers.softpedia.com/get/GRAPHICS-BOARD/NVIDIA/Quanta-NVIDIA-GeForce-RTX-3050-4GB-Laptop-GPU-Graphics-Driver-32-0-15-9166-for-Windows-10-version-1809-64-bit.shtml,"The package provides the installation files for Quanta NVIDIAGeForce RTX 3050 4GB Laptop GPU Graphics Driver version 32.0.15.9166.If the driver is already installed on your system, updating (overwrit… [+2181 chars]",Quanta NVIDIA GeForce RTX 3050 4GB Laptop GPU Graphics Driver 32.0.15.9166 for Windows 10 version 1809 64-bit,
455e9f29-e6b0-4d44-a12a-2f54524c901f,2026-06-27,GPU_RELEASE,NVIDIA,,overwrit,Softpedia.com,https://drivers.softpedia.com/get/GRAPHICS-BOARD/NVIDIA/Quanta-NVIDIA-GeForce-RTX-3050-4GB-Laptop-GPU-Graphics-Driver-32-0-15-9166-for-Windows-10-version-1903-64-bit.shtml,"The package provides the installation files for Quanta NVIDIAGeForce RTX 3050 4GB Laptop GPU Graphics Driver version 32.0.15.9166.If the driver is already installed on your system, updating (overwrit… [+2181 chars]",Quanta NVIDIA GeForce RTX 3050 4GB Laptop GPU Graphics Driver 32.0.15.9166 for Windows 10 version 1903 64-bit,
018bec5c-520d-4719-a433-fef5d4526354,2026-06-27,GPU_RELEASE,NVIDIA,,overwrit,Softpedia.com,https://drivers.softpedia.com/get/GRAPHICS-BOARD/NVIDIA/Quanta-NVIDIA-GeForce-RTX-3050-4GB-Laptop-GPU-Graphics-Driver-32-0-15-9166-for-Windows-10-64-bit.shtml,"The package provides the installation files for Quanta NVIDIAGeForce RTX 3050 4GB Laptop GPU Graphics Driver version 32.0.15.9166.If the driver is already installed on your system, updating (overwrit… [+2181 chars]",Quanta NVIDIA GeForce RTX 3050 4GB Laptop GPU Graphics Driver 32.0.15.9166 for Windows 10 64-bit,
991fcb8b-6f75-4330-a13a-43479d3afea1,2026-06-27,GPU_RELEASE,Intel,,,Biztoc.com,https://biztoc.com/x/648f3d49773da9ec,Chip stocks have taken a beating this week. A rotation out of high-flying technology names -- driven by mounting doubt about whether the industry's enormous spending on artificial intelligence (AI) w… [+147 chars],3 Beaten-Down AI Chip Stocks to Consider Buying in the Sell-Off,
9f88c20c-0b8e-4977-bb24-de1deb6ae101,2026-06-27,GPU_RELEASE,Snapdragon,,,Intomobile.com,https://www.intomobile.com/2026/06/26/qualcomms-leaked-snapdragon-roadmap-suggests-flagship-chip-shopping-is-about-to-get-complicated/,"Picking an Android flagship has always required a bit of homework, but a newly leaked Qualcomm roadmap suggests that homework is about to get a lot harder. The leak doesn’t just confirm the chips eve… [+3244 chars]",Qualcomm’s leaked Snapdragon roadmap suggests flagship chip shopping is about to get complicated,
14c9167c-f492-4dbd-b5cd-3fff8771213f,2026-06-27,GPU_RELEASE,AMD,,GB,Ozbargain.com.au,https://www.ozbargain.com.au/node/965350,"Found this while looking at other options after last nights deal was out of stock. Pretty decent deal for anyone who has a higher budget and wants a better GPU, processor, and more RAM (but a tad slo… [+206 chars]","HP HyperX Omen Gaming Laptop 15.3"" 2.5k AMD 7 8745hx 24GB 1TB SSD RTX 5060 $1839.20 Delivered @ HP eBay",
49e924d7-de52-44d8-8219-5a673af66b77,2026-06-27,GPU_RELEASE,NVIDIA,,overwrit,Softpedia.com,https://drivers.softpedia.com/get/GRAPHICS-BOARD/NVIDIA/Quanta-NVIDIA-GeForce-RTX-3050-4GB-Laptop-GPU-Graphics-Driver-32-0-15-9166-for-Windows-10-Vibranium-64-bit.shtml,"The package provides the installation files for Quanta NVIDIAGeForce RTX 3050 4GB Laptop GPU Graphics Driver version 32.0.15.9166.If the driver is already installed on your system, updating (overwrit… [+2181 chars]",Quanta NVIDIA GeForce RTX 3050 4GB Laptop GPU Graphics Driver 32.0.15.9166 for Windows 10 Vibranium 64-bit,
1187a445-38f3-4508-b375-04d11ee328fa,2026-06-27,GPU_RELEASE,NVIDIA,,,Softpedia.com,https://drivers.softpedia.com/get/GRAPHICS-BOARD/NVIDIA/Quanta-NVIDIA-GeForce-RTX-4090-Laptop-GPU-Graphics-Driver-32-0-15-9166-for-Windows-10-Vibranium-64-bit.shtml,"The package provides the installation files for Quanta NVIDIA GeForce RTX 4090 Laptop GPU Graphics Driver version 32.0.15.9166.If the driver is already installed on your system, updating (overwrite-i… [+2178 chars]",Quanta NVIDIA GeForce RTX 4090 Laptop GPU Graphics Driver 32.0.15.9166 for Windows 10 Vibranium 64-bit,
5a2fd8cc-faaf-4d04-a3a7-95fa37981743,2026-06-27,GPU_RELEASE,Microsoft,,,Crypto Briefing,https://cryptobriefing.com/apple-microsoft-price-hikes-ai-chip-crisis/,"An AI-driven semiconductor shortage is forcing consumer tech giants to pass costs directly to buyers, with Apple raising prices up to $300 and Microsoft preparing its third Xbox hike in under a year … [+3058 chars]","Apple and Microsoft hike prices on iPads, Macs, and Xbox consoles as AI chip crisis bites",
4b4e4ae3-8be2-4aca-bed1-cd3e3c9fdc2c,2026-06-27,GPU_RELEASE,OpenAI,,OpenAI,Biztoc.com,https://biztoc.com/x/04aa57c5aa820bc6,"Semiconductor giant Broadcom (AVGO) grabbed the spotlight on June 24 after joining forces with OpenAI to unveil Jalapeño, OpenAI's first custom-built artificial intelligence (AI) chip, designed to po… [+137 chars]",Broadcom and OpenAI Just Unveiled the New Jalapeño AI Chip. What That Means for AVGO Stock,
f9ed2a2d-443e-4483-9e11-cc126f73e7c7,2026-06-27,GPU_RELEASE,OpenAI,,,Yahoo Entertainment,https://consent.yahoo.com/v2/collectConsent?sessionId=1_cc-session_facf0ef0-9450-43de-b0ff-451ce9e58df8,"If you click 'Accept all', we and our partners, including 247 who are part of the IAB Transparency &amp; Consent Framework, will also store and / or access information on a device (in other words, us… [+1046 chars]",Broadcom and OpenAI Just Unveiled the New Jalapeño AI Chip. What That Means for AVGO Stock.,
3f5a5f1a-0ff7-4723-b5f7-cf6d8f6331fe,2026-06-27,GPU_RELEASE,AI,,South Korea’s,BeInCrypto,https://beincrypto.com/ai-chip-panic-breaks-korea-stock-market/,"South Korea's stock market index, the KOSPI, triggered its second circuit breaker in a single week amid the AI chip trade, rattling global markets. Friday's 8.19% intraday plunge forced another 20-m… [+3955 chars]",South Korea’s Stock Market KOSPI Just Flashed a Global AI Warning,
5faea7a7-2181-4d52-bee7-407b5300c838,2026-06-27,GPU_RELEASE,NVIDIA,,,Softpedia.com,https://drivers.softpedia.com/get/GRAPHICS-BOARD/NVIDIA/Quanta-NVIDIA-RTX-A1000-6GB-Laptop-GPU-Graphics-Driver-32-0-15-9166-for-Windows-11.shtml,"The package provides the installation files for Quanta NVIDIA RTX A1000 6GB Laptop GPU Graphics Driver version 32.0.15.9166.If the driver is already installed on your system, updating (overwrite-inst… [+2175 chars]",Quanta NVIDIA RTX A1000 6GB Laptop GPU Graphics Driver 32.0.15.9166 for Windows 11,A100
0dd8421a-be47-4590-9d06-d4946e72e5e8,2026-06-27,GPU_RELEASE,NVIDIA,,,Softpedia.com,https://drivers.softpedia.com/get/GRAPHICS-BOARD/NVIDIA/Quanta-NVIDIA-RTX-A1000-6GB-Laptop-GPU-Graphics-Driver-32-0-15-9166-for-Windows-10-64-bit.shtml,"The package provides the installation files for Quanta NVIDIA RTX A1000 6GB Laptop GPU Graphics Driver version 32.0.15.9166.If the driver is already installed on your system, updating (overwrite-inst… [+2175 chars]",Quanta NVIDIA RTX A1000 6GB Laptop GPU Graphics Driver 32.0.15.9166 for Windows 10 64-bit,A100
75f65453-cd38-4ad7-b2dc-86a635c6dd4f,2026-06-26,GPU_RELEASE,AI,,,Help Net Security,https://www.helpnetsecurity.com/2026/06/26/modelplane-open-source-control-plane-ai-inference/,"Organizations that run open-weight models on hardware they own operate GPU fleets spread across clouds, neoclouds, and on-premise data centers. Each fleet handles model placement, replica scaling, in… [+3172 chars]",Modelplane: Open-source control plane for AI inference,
e70b704b-bd9e-46a5-921a-addfa967d22f,2026-06-26,GPU_RELEASE,Intel,,penta,CNX Software,https://www.cnx-software.com/2026/06/26/449-chuwi-unibook-14-inch-laptop-is-powered-by-an-intel-core-3-304-wildcat-lake-processor/,"CHUWI has just opened pre-orders for the $449 UniBook Laptop powered by an Intel Core 3 304 penta-core “Wildcat Lake” SoC, and equipped with 8GB LPDDR5 RAM, a 256GB NVMe SSD, and a 14-inch 1920×1200 … [+3590 chars]",$449 CHUWI UniBook 14-inch laptop is powered by an Intel Core 3 304 Wildcat Lake processor,
f1642e40-7eb3-4e45-bacd-63be821274b1,2026-06-26,GPU_RELEASE,SoftBank,,South Korea's,Business Insider,https://www.businessinsider.com/korea-kospi-stock-market-price-today-nikkei-softbank-tech-selloff-2026-6#article,"A tech rout swept through Asian markets on Friday, with South Korea's Kospi and Japan's Nikkei 225 leading losses, renewing concerns over the durability of the AI-driven chip rally. South Korea's Ko… [+1945 chars]",South Korea's Kospi slumps as SoftBank rout drags Asia down,
258abd30-3cca-4631-bb1f-d942c627ce5e,2026-06-26,GPU_RELEASE,TSMC,,,Crypto Briefing,https://cryptobriefing.com/tsmc-normal-operations-fabrication-plants/,"The world's most important chipmaker reassures markets that production lines are humming, while quietly spending tens of billions to stay that way. TSMC, the company that manufactures the silicon bra… [+2414 chars]",TSMC reports normal operations across all fabrication plants,
244bae3a-1e7a-4f7d-858b-f65d9865e28c,2026-06-26,GPU_RELEASE,Corning,,South Korea,Digitimes,https://www.digitimes.com/news/a20260625VL220/corning-packaging-manufacturing-business-meta.html,"Keep me signed in
Some subscribers prefer to save their log-in information so they do not have to enter their User ID and Password each time they visit the site. To activate this function, check the… [+288 chars]",Corning weighs South Korea site as chip packaging race turns to glass,
499923e1-309d-44aa-80ee-173c2c0bf71f,2026-06-26,GPU_RELEASE,PyPI Multi,,,Pypi.org,https://pypi.org/project/harness-im-bridge/,"Multi-platform IM channel bridge unified message abstraction for AI agents and bots. English · 
Highlights
<ul><li>9 Platforms, One Processor Write one async generator function, run your bot on Fe… [+11639 chars]",harness-im-bridge added to PyPI,
28ad8758-8219-4442-9717-ed99c9d09268,2026-06-26,GPU_RELEASE,Apple,,,Macdailynews.com,https://macdailynews.com/2026/06/26/apple-skips-high-end-m6-chips-jumps-straight-to-ai-focused-m7-pro-max-and-ultra-in-major-apple-silicon-strategy-shift/,"In a surprising departure from its usual playbook, Apple is overhauling its Apple Silicon roadmap. According to Bloomberg News‘ Mark Gurman, the company will release a base M6 chip for entry-level Ma… [+2540 chars]","Apple skips high-end M6 Chips, jumps straight to AI-focused M7 Pro, Max, and Ultra in major Apple Silicon strategy shift",
c14f664b-20a5-48ec-af39-8f628b8e9d28,2026-06-26,GPU_RELEASE,AI,,,SiliconANGLE News,https://siliconangle.com/2026/06/26/ai-prompts-memory-chip-boom-electronics-inflation-get-used/,"Even though investors are getting wary of chip stocks, prompting a two-day tech selloff this week, memory-chip maker Micron had a monster quarter and its shares jumped almost 16% Thursday. On top of … [+10781 chars]",AI prompts a memory-chip boom — and electronics inflation. Get used to it.,
055d91b0-318e-4315-999b-0d04c4514084,2026-06-26,GPU_RELEASE,Apple,,,Tom's Hardware UK,https://www.tomshardware.com/tech-industry/apple-will-skip-its-high-end-m6-mac-chips-and-fast-track-an-ai-focused-m7-generation-for-2027,"Apple will release a base M6 chip for entry-level Macs this year but skip the Pro and Max versions of that generation, jumping instead to an accelerated M7 family built around on-device AI, according… [+2885 chars]","Apple will skip its high-end M6 Mac chips and fast-track an AI-focused M7 generation for 2027, report claims — may release a base M6 chip for entry-level Macs this year",
67331407-b047-4836-931d-04895bd4ab6c,2026-06-25,GPU_RELEASE,Intel,,,Biztoc.com,https://biztoc.com/x/fceb57ddb69ab4f5,"It seems like everyone has an opinion on which artificial intelligence (AI) company will win the next decade. Most of those opinions center on the classic, sexy names: the chip designers, the cloud p… [+146 chars]","Got $5,000? 2 Stocks to Own for Physical AI",
ab3e1bf6-503e-459d-8f10-af8a3b07e610,2026-06-25,GPU_RELEASE,Intel,,U.S.,BusinessLine,https://www.thehindubusinessline.com/markets/nifty-reclaims-24000-as-crude-slide-and-chip-rally-lift-markets/article71144759.ece,"Markets opened higher on Thursday morning, riding a wave of positive global cues after strong earnings from U.S. chipmaker Micron Technology eased fears over artificial intelligence spending, while a… [+3818 chars]","Nifty reclaims 24,000 as crude slide and chip rally lift markets",
41890459-e3c4-4a54-b4e2-ad40dd053650,2026-06-25,GPU_RELEASE,Intel,,US,The Times of India,https://economictimes.indiatimes.com/markets/us-stocks/news/us-stock-market-ai-chip-rally-reignites-as-micron-qualcomm-forecasts-add-over-400-billion-in-market-value/articleshow/131981684.cms,A renewed wave of optimism swept through semiconductor stocks late on Wednesday after upbeat forecasts from Micron Technology and Qualcomm reignited confidence in the artificial intelligence (AI) tra… [+2344 chars],"US Stock Market: AI chip rally reignites as Micron, Qualcomm forecasts add over $400 billion in market value",
33858ebd-e372-4d11-9f20-4834a86919f5,2026-06-25,GPU_RELEASE,GPU,,,Github.com,https://github.com/navatala-systems/navatala_gpu,"Cross-platform GPU compute runtime and kernel corpus for scientific computing,
released under the Apache License 2.0. The goal is a portable, inspectable GPU library that can run across ROCm/HIP,
… [+5196 chars]",Show HN: Navatala GPU – multi-back end GPU kernels and Python bindings,
9c0731b7-276a-4981-8a03-583446a96bf2,2026-06-24,GPU_RELEASE,OpenAI,,OpenAI,The Verge AI,https://www.theverge.com/ai-artificial-intelligence/955939/openai-reveals-its-first-ai-processor-jalapeno,"OpenAI has just revealed a new ""intelligence processor"" chip for AI servers made in partnership with Broadcom. The chip, called Jalape&#241;o, is designed to power current and future large language models, according to an announcement on Wednesday.",OpenAI reveals its first AI processor: Jalapeño,
697d54d6-1302-4f0c-bb9d-a84a1b4bd81b,2026-06-24,GPU_RELEASE,NVIDIA,,China,Wccftech,https://wccftech.com/china-fails-to-stop-tech-firms-from-using-nvidia-chips-banned-blackwell-gpus-hit-2x-price-on-black-market/,China has failed tremendously in stopping its tech firms from using banned NVIDIA Blackwell GPUs that are being sold on the black market for double the price. The NVIDIA Blackwell GPU family has bee… [+3414 chars],"China Fails To Stop Tech Firms From Using NVIDIA Chips, As Banned DGX & RTX “Blackwell” GPUs Hit 2x Price on Black Market",Blackwell
d150e7cb-313c-4af1-aaf2-81c9822f4d92,2026-06-24,GPU_RELEASE,ByteDance Qualcomm,,China,The Times of India,https://economictimes.indiatimes.com/tech/technology/qualcomm-in-talks-to-provide-custom-chip-design-services-to-bytedance/articleshow/131955137.cms,"Qualcomm is in talks to provide chip-design services to China's ByteDance, four people familiar with the matter said, as the US company seeks to reduce dependence on the smartphone market, its bigges… [+2015 chars]",Qualcomm in talks to provide custom chip-design services to ByteDance,
b8a8fad5-76a1-4835-aee3-ec289cfc733e,2026-06-24,GPU_RELEASE,NVIDIA,,,Prtimes.jp,https://prtimes.jp/main/html/rd/p/000000631.000012662.html,":
<ul><li>NVIDIA Vera Rubin HPC 
</li><li>NVIDIA Vera Rubin Vera CPU AI 
</li><li> Vera Rubin 
</li><li> BullDell TechnologiesGIGABYTEHPESupermicro 1 144 GPU Vera Rubin 
</li></ul>2026 6 22 - IS… [+917 chars]",NVIDIA Vera Rubin 、科学分野向けに世界トップクラスのスーパーコンピューターを提供,
a1adef10-3c0d-4cb6-8ed3-f58df717fdbf,2026-06-24,GPU_RELEASE,Intel,,,CNET,https://japan.cnet.com/release/31181675/,"SEMABIZMordor IntelligenceGPU 2026-2031-Japan Data Center GPU - Market Share Analysis, Industry Trends &amp; Statistics, Growth Forecasts (2026 - 2031)2026624
SEMABIZMordor Intelligence
GPU2025268,… [+1294 chars]",株式会社SEMABIZ「日本のデータセンター向けGPU市場シェア分析、業界動向と統計、成長予測 2026-2031年」市場調査レポートの出版・販売開始のご案内,
476de675-1fce-4307-af89-9cd7dd2dec12,2026-06-24,GPU_RELEASE,NVIDIA,,,Softpedia.com,https://drivers.softpedia.com/get/GRAPHICS-BOARD/INTEL/Quanta-NVIDIA-GeForce-RTX-3050-Ti-Laptop-GPU-Graphics-Driver-32-0-15-9166-for-Windows-11-version-25H2.shtml,"The package provides the installation files for Quanta NVIDIAGeForce RTX 3050 Ti Laptop GPU Graphics Driver version 32.0.15.9166.If the driver is already installed on your system, updating (overwrite… [+2180 chars]",Quanta NVIDIA GeForce RTX 3050 Ti Laptop GPU Graphics Driver 32.0.15.9166 for Windows 11 version 25H2,
1b45a98c-81c9-4907-89bc-854dc02073bf,2026-06-24,GPU_RELEASE,NVIDIA,,,Softpedia.com,https://drivers.softpedia.com/get/GRAPHICS-BOARD/INTEL/Quanta-NVIDIA-GeForce-RTX-3050-Ti-Laptop-GPU-Graphics-Driver-32-0-15-9166-for-Windows-11.shtml,"The package provides the installation files for Quanta NVIDIAGeForce RTX 3050 Ti Laptop GPU Graphics Driver version 32.0.15.9166.If the driver is already installed on your system, updating (overwrite… [+2180 chars]",Quanta NVIDIA GeForce RTX 3050 Ti Laptop GPU Graphics Driver 32.0.15.9166 for Windows 11,
9aa92fb5-3114-450e-9602-c55bd982215c,2026-06-24,GPU_RELEASE,NVIDIA,,,Crypto Briefing,https://cryptobriefing.com/nvidia-cheaper-than-semiconductor-sector-tony-zhang/,"The OptionsPlay chief strategist sees Nvidia's forward multiples as attractive relative to industry peers, signaling a potential buying opportunity during the AI chip pullback Nvidia, the company tha… [+2068 chars]","Nvidia trades cheaper than semiconductor sector, says Tony Zhang",
4308a5f8-d4dc-490a-8666-d61c7e66c26c,2026-06-24,GPU_RELEASE,Amazon,,,Fortune,https://fortune.com/2026/06/24/amazon-web-services-ceo-matt-garman-bullish-on-entry-level-gen-z-talent-hiring-thousands-interns-graduates/,"As Silicon Valley debates whether AI will replace millions of office workers, one of the executives building the technologys underlying infrastructure says Gen Z shouldnt buy into the apocalyptic job… [+5262 chars]","Amazon exec says AI won’t wipe out white-collar jobs—and is hiring 11,000 grads and interns, and has more developers than 2 years ago to prove it",
3a16a1d3-dd77-4ea4-8ddd-7cd99560f3e2,2026-06-24,GPU_RELEASE,NVIDIA,,China,The Next Web,https://thenextweb.com/news/china-lineshine-supercomputer-top500-no-us-chips/,A supercomputer in Shenzhen just topped the world rankings for the first time since 2017. The headline is the speed.,China takes the supercomputer crown without US chips,
732b32e6-54da-409a-8580-a783250e4942,2026-06-24,GPU_RELEASE,NVIDIA,Llama,,Askubuntu.com,https://askubuntu.com/questions/1567946/rootless-podman-compose-ollama-container-cant-access-nvidia-gpu-on-ubuntu-24-04,"It would seem the issue is two-fold,
1. The CDI configuration was made by root, and it's also possible that I as the user, don't have access to it.","Rootless podman-compose Ollama container can't access NVIDIA GPU on Ubuntu 24.04, but native Ollama works",
02fafd52-31d8-42a9-a59c-261de8cffdec,2026-06-24,GPU_RELEASE,DDN Launches AI400X3M,,Dynamo,Storagereview.com,https://www.storagereview.com/news/ddn-launches-ai400x3m-and-dynamo-integrated-kv-cache-acceleration-at-isc-2026,"At ISC 2026, DDN announced a broad expansion of its AI and HPC data platform portfolio, introducing new hardware, software, and platform capabilities designed to improve GPU utilization, accelerate A… [+7002 chars]",DDN Launches AI400X3M and Dynamo-Integrated KV Cache Acceleration at ISC 2026,
012266cb-109b-4332-b050-719ba66f35db,2026-06-24,GPU_RELEASE,Anthropic,Claude,,Biztoc.com,https://biztoc.com/x/31341746fa9b8f92,"Memory chip giant Micron (MU) and the maker of the Claude generative AI platform, Anthropic, have inked a partnership wherein the latter will make use of the former's infrastructure to strengthen its… [+140 chars]",Micron Shares Pop on Partnership With Anthropic. How to Play MU Stock Here,
66e5bd26-f554-4dba-9621-3f2ae627624f,2026-06-23,GPU_RELEASE,US Stocks,,U.S.,The Times of India,https://economictimes.indiatimes.com/markets/us-stocks/news/us-stocks-today-chip-stocks-plunge-but-bargain-hunters-stem-losses-in-other-tech-names/articleshow/131941564.cms,"U.S. chip stocks stumbled on Tuesday, but the broader market's initial slump brought out bargain-hunting investors, stemming the falloff in other companies central to the AI infrastructure rally that… [+3510 chars]","US Stocks Today | Chip stocks plunge, but bargain-hunters stem losses in other tech names",
e45a9273-8c77-40c9-9a77-e92e67ecdd07,2026-06-23,GPU_RELEASE,Intel,,,The Times of India,https://economictimes.indiatimes.com/markets/us-stocks/news/us-stocks-ai-chip-slump-extends-on-wall-st-as-sandisk-sinks-12-micron-drops-9-and-amd-falls-5/articleshow/131941559.cms,"A sharp selloff swept through semiconductor stocks on Wall Street on Tuesday, wiping out gains across some of the biggest beneficiaries of the artificial intelligence boom as investors reassessed lof… [+2644 chars]","US Stocks | AI chip slump extends on Wall St as SanDisk sinks 12%, Micron drops 9% and AMD falls 5%",
469a87f3-b681-4195-a82f-ac8ede2aebd7,2026-06-22,GPU_RELEASE,Intel,,US,The Times of India,https://economictimes.indiatimes.com/markets/us-stocks/news/us-stock-market-micron-earnings-to-test-strength-of-ai-fuelled-wall-street-rally/articleshow/131900960.cms,"The remarkable rally in U.S. equities, powered largely by artificial intelligence-related investments, faces its next major test as investors await quarterly earnings from Micron Technology.",US Stock Market: Micron earnings to test strength of AI-fuelled Wall Street rally,
