event_id,date,category,company,product,location,source,url,summary,title,hardware_name
aa01b982-1f1d-498b-bad1-c0c064d4fa2a,"Wed, 24 Ju",GPU_RELEASE,NVIDIA,,,NVIDIA Blog,https://blogs.nvidia.com/blog/nvidia-aws-ai-production-scale/,"Building AI systems at scale is demanding, requiring low-latency inference, fast vector search, strong GPU price-performance and infrastructure that can grow without multiplying operational complexity. NVIDIA’s latest work with Amazon Web Services (AWS) addresses each of those constraints.",NVIDIA and AWS Collaborate to Bring AI to Production at Scale,
b6a94bd6-61da-43ae-9a00-780806441df7,"Wed, 24 Ju",GPU_RELEASE,Intel,,,arXiv cs.LG,https://arxiv.org/abs/2606.23851,"arXiv:2606.23851v1 Announce Type: new 
Abstract: This work investigates the implementation of artificial intelligence and machine learning (AI/ML) for real-time monitoring in laser powder bed fusion (LPBF) additive manufacturing. We developed a binary image classification framework for distinguis...",Machine Learning Modeling for Real-Time Melt Pool Monitoring in Laser Powder Bed Fusion Additive Manufacturing: A Hybrid Approach,
bf005733-75d3-4b0d-a9c0-9fe0c9861928,"Wed, 24 Ju",GPU_RELEASE,OpenAI,,OpenAI,OpenAI Blog,https://openai.com/index/openai-broadcom-jalapeno-inference-chip,"OpenAI and Broadcom introduce Jalapeño, a custom AI chip built for LLM inference to improve performance, efficiency, and scale across AI systems.",OpenAI and Broadcom unveil LLM-optimized inference chip,
c8f1206f-6a0a-4f10-a194-9b6d69577c7d,"Wed, 17 Ju",GPU_RELEASE,Modal,,,arXiv cs.LG,https://arxiv.org/abs/2606.17118,"arXiv:2606.17118v1 Announce Type: new 
Abstract: Mixture-of-Experts Multimodal Large Language Models (MoE-MLLMs) offer remarkable performance but incur prohibitive GPU memory costs, making compression essential. Among PTQ methods, expert-level mixed-precision quantization has proven effective for...",MODE: Modality-Decomposed Expert-Level Mixed-Precision Quantization for MoE Multimodal LLMs,
a782f5ed-e65d-4bfd-9df8-86abc47fdedb,"Wed, 17 Ju",GPU_RELEASE,Bounded Power Transformation,Qwen,,arXiv cs.LG,https://arxiv.org/abs/2606.17199,"arXiv:2606.17199v1 Announce Type: new 
Abstract: Standard on-policy distillation (OPD) for large language models estimates the reverse-KL objective using student-sampled tokens, yielding an unbiased single-sample Monte Carlo estimator that avoids vocabulary-wide computation. However, we show that...",PowerOPD: Stabilizing On-Policy Distillation with Bounded Power Transformation,
d3e20df7-a37e-47b0-a35b-9b93997b1f10,"Wed, 08 Ju",GPU_RELEASE,GPU,,,arXiv cs.LG,https://arxiv.org/abs/2607.05439,"arXiv:2607.05439v1 Announce Type: new 
Abstract: Many all-atom generative protein models can in principle design large multimeric complexes by jointly modelling all chains, but their quadratic token- and atom-pair representations quickly exceed single-GPU memory as the number of chains and residu...",Design-CP: Context Parallelism for Design of Protein Nanoparticles,
a49b623b-02ba-4ca8-92a5-42b260105a0a,"Wed, 01 Ju",GPU_RELEASE,LearnStop,DeepSeek,Qwen3,arXiv cs.AI,https://arxiv.org/abs/2606.30852,"arXiv:2606.30852v1 Announce Type: new 
Abstract: Reasoning models spend different amounts of useful computation across instances, but it remains unclear when a learned stopping rule improves over simple confidence or convergence thresholds. We study this question with LearnStop, a hidden-state-fr...",When Does Learning to Stop Help? A Cost-Aware Study of Early Exits in Reasoning Models,H100
f2e79189-dd1c-42d7-a0d4-9d83ae4aa4a7,"Wed, 01 Ju",GPU_RELEASE,LLM,,,arXiv cs.AI,https://arxiv.org/abs/2606.30949,"arXiv:2606.30949v1 Announce Type: new 
Abstract: High-Level Synthesis (HLS) provides a fast path from concepts to silicon, but converting real-world software into synthesizable HLS code remains challenging due to restrictive language support and the gap between software and hardware programming p...",AgRefactor: Self-Evolving Agentic Workflow for HLS Compatibility and Performance,
7475c4c2-df02-4df2-8d3c-a5901cf9b3cc,"Wed, 01 Ju",GPU_RELEASE,HGA,Qwen,Qwen3,arXiv cs.LG,https://arxiv.org/abs/2606.30709,"arXiv:2606.30709v1 Announce Type: new 
Abstract: Hierarchical Global Attention (HGA) is a drop-in replacement for dense causal attention in pretrained long-context transformers. HGA preserves the original checkpoint parameters: the pretrained $W_Q$, $W_K$, $W_V$, and $W_O$ projections remain unch...",Hierarchical Global Attention (HGA),
c84c2496-0f39-432e-8203-5e4ae3823d4f,"Tue, 30 Ju",GPU_RELEASE,Karhunen-Loeve Expansions for Large-Scale Applications,,,arXiv cs.LG,https://arxiv.org/abs/2606.28519,"arXiv:2606.28519v1 Announce Type: new 
Abstract: Training operator-learning models for large-scale problems governed by partial differential equations (PDEs) is challenging due to the curse of dimensionality, memory constraints, and limited training data. These challenges arise in many scientific...",A Trainable-by-Parts Operator Learning Framework: Bridging DeepONet and Karhunen-Loeve Expansions for Large-Scale Applications,
60667884-f63d-4526-9b70-11427030026d,"Tue, 30 Ju",GPU_RELEASE,NVIDIA,,,NVIDIA Blog,https://blogs.nvidia.com/blog/inference-software-lowest-token-cost/,"As organizations move from AI pilots to production AI factories, infrastructure decisions have shifted from peak chip specifications to cost per token: how many useful tokens they can deliver per dollar, per watt and within required latency targets. Codesigned with NVIDIA GPUs, CPUs, networking a...",How NVIDIA’s Inference Software Stack Powers the Lowest Token Cost,
a3ffe4eb-33d6-4f4c-bc04-549baf179d42,"Tue, 30 Ju",GPU_RELEASE,Anthropic,Claude,,NVIDIA Blog,https://blogs.nvidia.com/blog/claude-science-bionemo-agent-toolkit/,"Life sciences has entered an era of computational scale, and for more than a decade, NVIDIA has built the full GPU-accelerated computing stack — spanning hardware, frameworks, libraries, models, microservices and domain-specific tools — to help researchers run more sophisticated workflows and ite...",NVIDIA BioNeMo Agent Toolkit Brings Accelerated AI to Life Sciences Researchers in Claude Science,
4ff01d77-f81e-4fa7-8586-c073db51c531,"Tue, 30 Ju",GPU_RELEASE,AWS,,,AWS ML Blog,https://aws.amazon.com/blogs/machine-learning/how-outpost-vfx-uses-aws-to-accelerate-ai-model-training-for-visual-effects/,"In this post, we explore how Outpost VFX achieved 8x faster training speeds using AWS infrastructure to transform their face replacement workflow, the technical architecture they implemented to overcome single-GPU limitations, and the measurable results achieved through AWS multi-GPU training.",How Outpost VFX Uses AWS to Accelerate AI Model Training for Visual Effects,
a4214870-40c5-4dae-91e3-a24bd5684361,"Tue, 23 Ju",GPU_RELEASE,CRN,,,arXiv cs.LG,https://arxiv.org/abs/2606.20889,"arXiv:2606.20889v1 Announce Type: new 
Abstract: Estimating causal effects in industrial time series requires handling temporal dynamics, time-varying treatments, and unobserved confounders. Existing causal foundation models (CausalPFN, CausalFM) operate only on static cross-sectional data; neura...",Temporal Causal Prior-Data Fitted Networks for Panel Data with Learned Reliability Signals,
9b8fbd09-335f-40ab-925c-1e06159fe98a,"Tue, 16 Ju",GPU_RELEASE,NVIDIA,,,arXiv cs.LG,https://arxiv.org/abs/2606.14934,"arXiv:2606.14934v1 Announce Type: new 
Abstract: This work introduces the Separable Neural Architecture (SNA), a function representational class combining neural approximation with tensor decomposition. The SNA decouples localized coordinate functions (atoms) from global interactions governed by ...",Separable Neural Architectures as Physical World Models: from Mathematical Theory to Applications,A100
664627e9-ac52-46ed-9719-966f472ba703,"Tue, 16 Ju",GPU_RELEASE,the Rational Sparse Autoencoder,,,arXiv cs.LG,https://arxiv.org/abs/2606.14990,"arXiv:2606.14990v1 Announce Type: new 
Abstract: Sparse autoencoders (SAEs) are standard tools for mechanistic interpretability, but current SAE families are constrained by fixed encoder nonlinearities such as ReLU, JumpReLU, and TopK. This hard-codes a particular sparsity mechanism into the mode...",Rational Sparse Autoencoder,
ca75fc59-3cc1-4dab-a0cc-64ed1234d039,"Tue, 16 Ju",GPU_RELEASE,NVIDIA,,,NVIDIA Blog,https://blogs.nvidia.com/blog/blackwell-mlperf-training-6-0/,"Every breakthrough AI model starts the same way: with a training run. The infrastructure running those training jobs shapes everything: how fast teams can iterate, what scale of model they can build and whether those jobs complete reliably.","Fastest, Largest, Strongest: NVIDIA Blackwell Sweeps MLPerf Training 6.0",Blackwell
bb2714e8-7db9-433c-bf2d-4195a4a7abda,"Tue, 07 Ju",GPU_RELEASE,Cohere,,,arXiv cs.AI,https://arxiv.org/abs/2607.03091,"arXiv:2607.03091v1 Announce Type: new 
Abstract: Silicon sampling-using large language models (LLMs) to simulate human survey respondents-has emerged as a promising approach for augmenting traditional survey research. However, most evaluations rely on distributional comparisons rather than indivi...",Silicon Sampling via Cross-Survey Transfer,
991b45bb-dcdc-48da-b3b6-b4ff35502958,"Tue, 07 Ju",GPU_RELEASE,NVIDIA,,,NVIDIA Blog,https://blogs.nvidia.com/blog/nvidia-vera-max-single-threaded-cpu-at-scale/,"Max single-threaded CPUs at scale are a new category of CPUs built for the agentic AI era. Across the creation and deployment of an agentic system, the CPU is on the critical path for reasoning, response time and learning.",AI Innovators Adopt NVIDIA Vera — Why Max Single-Threaded CPU at Scale Matters,
1c5cd391-faa2-41ea-9b1d-1a0e8e47f602,"Tue, 02 Ju",GPU_RELEASE,NVIDIA,,,NVIDIA Blog,https://blogs.nvidia.com/blog/jetson-agentic-ai-physical-world/,"Agentic AI is getting physical. At COMPUTEX on Tuesday, NVIDIA announced NVIDIA JetPack 7.2 and NVIDIA NemoClaw support on NVIDIA Jetson.",NVIDIA Jetson Brings Agentic AI to the Physical World,
890b90ec-bf17-439e-bcce-6792a1879232,"Thu, 25 Ju",GPU_RELEASE,Hitchhiker's Guide,,,arXiv cs.AI,https://arxiv.org/abs/2606.24937,"arXiv:2606.24937v1 Announce Type: new 
Abstract: The Hitchhiker's Guide to Agentic AI is a comprehensive practitioner's reference for building autonomous AI systems. The book covers the full stack from first principles to production deployment, organized around a central thesis: building great ag...",The Hitchhiker's Guide to Agentic AI: From Foundations to Systems,
205290d2-670a-4f68-a66e-8356d70aa42b,"Thu, 25 Ju",GPU_RELEASE,Intel,,,arXiv cs.AI,https://arxiv.org/abs/2606.25532,"arXiv:2606.25532v1 Announce Type: new 
Abstract: Artificial intelligence increasingly drives automated scientific discovery, yet contemporary generalist agents lack physical grounding, frequently hallucinating hardware-incompatible designs. Here, we present a physically grounded, multi-agent disc...",Agentic evolution of physically constrained foundation models,A100
e6f5ba74-3ed8-4999-b4e5-ccb5fbfb268d,"Thu, 25 Ju",GPU_RELEASE,NVIDIA,,,AWS ML Blog,https://aws.amazon.com/blogs/machine-learning/optimize-model-training-on-amazon-sagemaker-ai-with-nvidia-blackwell/,"This post shows you how to configure training jobs on Amazon SageMaker AI to get the most out of Blackwell’s architecture on AWS. You learn how to select batch sizes and sequence lengths that take advantage of Blackwell’s expanded memory, choose the right precision format for your model size (1B ...",Optimize model training on Amazon SageMaker AI with NVIDIA Blackwell,Blackwell
292d99bb-4066-45d8-8c5a-8ad541184adc,"Thu, 21 Ma",GPU_RELEASE,Google DeepMind,,,Google DeepMind,https://deepmind.google/blog/were-launching-the-google-deepmind-accelerator-program-in-asia-pacific-to-tackle-environmental-risks/,We’re launching the Google DeepMind Accelerator program in Asia Pacific to tackle environmental risks,We’re launching the Google DeepMind Accelerator program in Asia Pacific to tackle environmental risks,
ee8b44dc-6667-44d6-8e8f-bbb334258043,"Thu, 09 Ju",GPU_RELEASE,IBM,,,arXiv cs.AI,https://arxiv.org/abs/2607.06760,"arXiv:2607.06760v1 Announce Type: new 
Abstract: Autonomous systems under partial observability act on beliefs, not raw sensor events. QANTIS treats the quantum processor as a calibrated belief-update service in that loop: it receives a prior and an observation model, estimates the rare-event evi...",QANTIS: Hardware-Calibrated Sequential POMDP Belief Updates on IBM Heron,
1fe02e9f-b94b-4639-b8c9-d4ce254028ac,"Thu, 02 Ju",GPU_RELEASE,AWS,,,arXiv cs.LG,https://arxiv.org/abs/2607.00095,"arXiv:2607.00095v1 Announce Type: new 
Abstract: Generative models have emerged as scalable surrogates for physical simulation, yet they offer no guarantee that their outputs respect the conservation laws, boundary conditions, and nonlinear invariants that govern the underlying physics. Constrain...",SNAP-FM: Sparse Nonlinear Accelerated Projection for Physics-Constrained Generative Modeling,
73829afc-039a-437f-920e-6c22b664e933,"Mon, 29 Ju",GPU_RELEASE,Amazon,,,arXiv cs.LG,https://arxiv.org/abs/2606.27561,"arXiv:2606.27561v1 Announce Type: new 
Abstract: Generative models have achieved remarkable success in data synthesis, though recent advances driven by increasing model scale have introduced challenges in computational cost and efficiency. Quantum machine learning offers a promising alternative, ...",Quantum Generative Diffusion Model for Real-World Time Series,
27aff7b1-d353-4eb1-8d3a-83894c7450ec,"Mon, 29 Ju",GPU_RELEASE,Anthropic,Claude,,NVIDIA Blog,https://blogs.nvidia.com/blog/anthropic-nvidia-gb300-blackwell-ultra-microsoft-azure/,"Anthropic’s Claude models in Microsoft Foundry — hosted on Microsoft Azure and running on NVIDIA GB300 Blackwell Ultra GPUs — are now generally available, giving Azure-native enterprises a powerful new way to build autonomous and domain-specific AI agents. As agentic AI continues to drive enterpr...",Claude Meets Blackwell Ultra: Anthropic’s Models Now Run on NVIDIA GB300 in Azure,Blackwell Ultra
aca1149d-dd45-4d5d-af5a-6fb2aa12a0f8,"Mon, 29 Ju",GPU_RELEASE,Microsoft,Claude,,Azure AI Blog,https://azure.microsoft.com/en-us/blog/claude-in-microsoft-foundry-is-now-generally-available/,"<p>Claude in Microsoft Foundry is now generally available, hosted on Azure, and running on NVIDIA GB300 Blackwell Ultra, giving teams a faster path from agent experimentation to production.</p>
<p>The post <a href=""https://azure.microsoft.com/en-us/blog/claude-in-microsoft-foundry-is-now-generall...",Claude in Microsoft Foundry is now generally available,Blackwell Ultra
a786838b-6f97-4f8f-acc3-39df85c35864,"Mon, 22 Ju",GPU_RELEASE,Amazon,,,AWS ML Blog,https://aws.amazon.com/blogs/machine-learning/running-comfyui-workflows-on-amazon-sagemaker-ai-processing-jobs/,"In this post, we walk you through how to deploy ComfyUI workflows on Amazon SageMaker AI processing jobs to generate hundreds of high-quality images in a single batch. You learn how to set up the infrastructure using AWS Cloud Development Kit (AWS CDK), configure GPU-accelerated processing, and a...",Running ComfyUI workflows on Amazon SageMaker AI processing jobs,
18a3dca6-3bfd-4b01-a59c-448ee4ef88ac,"Mon, 15 Ju",GPU_RELEASE,,,,arXiv cs.LG,https://arxiv.org/abs/2606.13740,"arXiv:2606.13740v1 Announce Type: new 
Abstract: Diffusion large language models (dLLMs) accelerate generation by denoising multiple tokens in parallel, making them attractive for latency-sensitive mobile inference. However, repeated denoising introduces substantial computation on smartphones.",Efficient On-Device Diffusion LLM Inference with Mobile NPU,
3ed44fe9-667d-4678-9403-c49639c1f48d,"Mon, 15 Ju",GPU_RELEASE,,,,arXiv cs.LG,https://arxiv.org/abs/2606.13742,"arXiv:2606.13742v1 Announce Type: new 
Abstract: The ability to resolve complex physical phenomena with high fidelity and at low computational cost is central to addressing key challenges in modern engineering. A prime example lies in hypersonic flows, where the precise prediction of the full flo...",A fully GPU-based workflow for building physics emulators of hypersonic flows,
cda27498-2720-4fdc-aa51-5687dda1a861,"Mon, 15 Ju",GPU_RELEASE,,,,arXiv cs.LG,https://arxiv.org/abs/2606.13767,"arXiv:2606.13767v1 Announce Type: new 
Abstract: Low-rank adaptation (LoRA) and its variants provide a memory- and compute-efficient alternative to full fine-tuning of pre-trained models. However, questions remain about the comparative generalizability of these approaches and how the structural r...",Beyond LoRA: Is Sparsity-Induced Adaptation Better?,
a5764951-7c4b-40af-a348-bab66e5b47a3,"Mon, 08 Ju",GPU_RELEASE,NVIDIA,,,NVIDIA Blog,https://blogs.nvidia.com/blog/nvidia-and-lg-group-ai-factory/,"NVIDIA and LG Group are building an AI factory to accelerate LG Group’s next wave of AI-driven businesses, spanning robotics, autonomous driving, data center technologies and GPU cloud services. The AI factory will provide LG Group with accelerated computing infrastructure to train, simulate, val...","NVIDIA and LG Group Build an AI Factory to Advance Physical AI, Mobility and AI Infrastructure",
1778f5dc-dac2-4e47-95e5-74ae566c6a87,"Fri, 26 Ju",GPU_RELEASE,Modal,,,arXiv cs.LG,https://arxiv.org/abs/2606.26164,"arXiv:2606.26164v1 Announce Type: new 
Abstract: Finding all modes of a multimodal black-box function is a fundamental challenge in optimization, Bayesian inference, and scientific computing. Existing approaches -- basin-hopping, CMA-ES, multistart gradient descent -- operate sequentially and can...",\chisao{}: A GPU-Native Parallel Optimizer for Multimodal Black-Box Functions via Convergence-Anticonvergence Oscillation,
14518ac4-a2ba-493d-95a4-c8165a33626c,"Fri, 19 Ju",GPU_RELEASE,NVIDIA,,,arXiv cs.LG,https://arxiv.org/abs/2606.19365,"arXiv:2606.19365v1 Announce Type: new 
Abstract: Diffusion models have become essential for high-fidelity 3D MRI synthesis, yet their deployment remains constrained by substantial GPU resource demands arising from hundreds of U-Net evaluations per sample and a highly heterogeneous kernel behavior...",Performance Analysis and Optimization of 3D Generative Diffusion Models across GPU Architectures,A100
8c468cbb-ef09-4ee7-9848-0c4b7ba50a24,"Fri, 19 Ju",GPU_RELEASE,,,,arXiv cs.LG,https://arxiv.org/abs/2606.19370,"arXiv:2606.19370v1 Announce Type: new 
Abstract: Self-play reinforcement learning has recently emerged as a way to train driving policies without any human data. It uses cheap, large-scale simulations to substitute expensive, large-scale human driving demonstrations.",Human-like autonomy emerges from self-play and a pinch of human data,
a1e855bd-82cb-4168-b2d4-f32d8a7b25f2,"Fri, 19 Ju",GPU_RELEASE,Emyx,,,arXiv cs.LG,https://arxiv.org/abs/2606.19377,"arXiv:2606.19377v1 Announce Type: new 
Abstract: Computational enzyme design requires generating proteins that scaffold catalytic residues and ligands, a task that demands both geometric accuracy and structural diversity from the underlying generative model. Current all-atom generators inherit ex...",Emyx: Fast and efficient all-atom protein generation,
674ab0dc-776f-4041-8076-4952eaa91e92,"Fri, 12 Ju",GPU_RELEASE,NVIDIA,,,NVIDIA Blog,https://blogs.nvidia.com/blog/nvidia-blackwell-agentperf-artificial-analysis/,"AgentPerf from Artificial Analysis, the industry’s first agentic AI benchmark, gives developers, enterprises and infrastructure providers a clear way to compare systems for agentic AI. In the first round of published results, the NVIDIA Blackwell Ultra NVL72 platform delivers leading performance ...",NVIDIA Blackwell Leads on First Agentic AI Infrastructure Benchmark,Blackwell Ultra
48f21400-253b-4fa9-92cb-e28bda15ca6d,"Fri, 10 Ju",GPU_RELEASE,Perplexity,Qwen,,arXiv cs.LG,https://arxiv.org/abs/2607.07740,"arXiv:2607.07740v1 Announce Type: new 
Abstract: Modern LLMs are increasingly deployed in long-context applications such as retrieval-augmented generation, repository-level coding, and agentic workflows whose accumulated reasoning and tool traces routinely push the input an order of magnitude pas...",Jet-Long: Efficient Long-Context Extension with Dynamic Bifocal RoPE,Hopper
e879c330-7f37-4a0e-90c3-3ae5d26a0963,"Fri, 10 Ju",GPU_RELEASE,neu,,,arXiv cs.LG,https://arxiv.org/abs/2607.07754,"arXiv:2607.07754v1 Announce Type: new 
Abstract: Pattern recognition problems arise in a variety of physical image processing situations, and convolutional neural networks are a popular scheme for the required feature extraction and classification tasks. The classical networks use diffusion-based...",Image classification via a quantum-inspired strategy involving a mixture of experts,
ca6743d3-f0b4-4c75-a5ac-58bf274bb1be,"Fri, 10 Ju",GPU_RELEASE,Amazon,,,AWS ML Blog,https://aws.amazon.com/blogs/machine-learning/scaling-agentic-workflows-with-native-case-management-in-amazon-quick-automate/,"In this post, we show you how to combine case management with agentic automation capabilities in Quick Automate. We introduce case management and explore the lifecycle of cases in an agentic workflow from case creation through processing to resolution.",Scaling agentic workflows with native case management in Amazon Quick Automate,
44d17c35-903f-4adb-8354-5a88912c5d5f,"Fri, 03 Ju",GPU_RELEASE,Neural Processing Units,,,arXiv cs.AI,https://arxiv.org/abs/2607.01590,"arXiv:2607.01590v1 Announce Type: new 
Abstract: Developing high-performance kernels for Neural Processing Units (NPUs) is a critical industry bottleneck, requiring developers to manually navigate implicit hardware constraints and strict memory hierarchies. While large language models offer immen...",Hawk: Harnessing Hardware-Aware Knowledge for High-Performance NPU Kernel Generation,
34f93d64-70b5-4f7c-8cd2-123fab7e80c8,"Fri, 03 Ju",GPU_RELEASE,Faster Hyperparameter Exploration,,,arXiv cs.LG,https://arxiv.org/abs/2607.01474,"arXiv:2607.01474v1 Announce Type: new 
Abstract: Class imbalance poses a critical challenge in federated learning (FL), where underrepresented classes suffer from poor predictive performance yet cannot be addressed by standard centralized techniques due to privacy and heterogeneity constraints. W...",Class-Grouped Normalized Momentum and Faster Hyperparameter Exploration to Tackle Class Imbalance in Federated Learning,
109c06f1-3b99-4d2d-8400-3094e7bd2494,2026-07-10,GPU_RELEASE,Micron Technology,,,Crypto Briefing,https://cryptobriefing.com/micron-data-center-margin-87-percent/,The memory chipmaker's AI-driven profit margins are approaching levels that should make every crypto miner and GPU compute provider pay attention. Micron Technology just posted a data center gross ma… [+2231 chars],Micron Technology reports data center gross margin of 87% last quarter,
ec0c6198-9b00-4a54-83b6-0f3c1e502049,2026-07-09,GPU_RELEASE,AI,,,Crypto Briefing,https://cryptobriefing.com/power-transformers-choking-ai-infrastructure/,"Power transformers, not chips, have become the real bottleneck for AI infrastructure expansion While the tech world obsesses over GPU supply chains and chip export controls, a far more mundane piece … [+2515 chars]",The century-old device quietly choking the world’s AI ambitions,
944ad842-1afc-4527-a069-9c089e74f7f9,2026-07-09,GPU_RELEASE,,,,Pypi.org,https://pypi.org/project/sparrow-engine-gpu/0.1.22/,"A required part of this site couldnt load. This may be due to a browser
 extension, network issues, or browser settings.",sparrow-engine-gpu 0.1.22,
f430257d-10a6-470f-939b-5346e1e72ac8,2026-07-09,GPU_RELEASE,GPU,,,Pypi.org,https://pypi.org/project/sysplug/,"GPU-aware hyperparameter advisor for any deep learning training loop. SysPlug analyses your GPU hardware, estimates memory and throughput requirements, and recommends the optimal batch size, learnin… [+6930 chars]",sysplug added to PyPI,
2490ab6f-4a79-419d-9e1d-877c63ddd778,2026-07-09,GPU_RELEASE,GPU,,,Dealnews.com,https://www.dealnews.com/Zyneex-Ryzen-5-Gaming-Desktop-PC-w-Radeon-Vega-8-GPU-for-659-free-shipping/21889938.html,"more Save on a large selection of computers, processors, graphics cards, motherboards, external and internal hard drives, SSDs, memory cards, upgrades, and accessories. Some have extra discount coupo… [+44 chars]",Zyneex Ryzen 5 Gaming Desktop PC w/ Radeon Vega 8 GPU for $659 + free shipping,
4c699bf1-fd76-42f9-9e07-a4fa6d1d5b4e,2026-07-08,GPU_RELEASE,NVIDIA,,,Prtimes.jp,https://prtimes.jp/main/html/rd/p/000000012.000169166.html,"NEDOGENIAC-PRIZE 2026 2AI GENIAC-PRIZE 2026 AI202611
AIAI20263AI204060339
GENIAC-PRIZEAILLMAI
1. LLMLLMAI
 4GPU NVIDIA B300()RTX PRO 6000 Blackwell
5001720
2.",「LLMでロボットを動かす」学生向けAI基盤モデル開発コンテスト、参加メンバー募集開始,Blackwell
79614a8e-fe01-4365-a980-513c39c6f9e5,2026-07-08,GPU_RELEASE,,,,Crypto Briefing,https://cryptobriefing.com/silicon-valley-startups-adopt-cheaper-chinese-ai-models-amid-cost-pressure/,"Silicon Valley startups are increasingly turning to Chinese AI models, as reported by social media aggregator @business. This shift is attributed to the significantly lower cost of Chinese models com… [+1397 chars]",Silicon Valley startups adopt cheaper Chinese AI models amid cost pressure,
4cbe139f-eae4-443b-8a2f-b465290ea6da,2026-07-08,GPU_RELEASE,NVIDIA,,China,The Times of India,https://economictimes.indiatimes.com/tech/artificial-intelligence/china-plans-to-let-top-ai-firms-buy-limited-nvidia-h200-chips-the-information-reports/articleshow/132267191.cms,"China is planning to allow the country's top AI companies to buy a limited number of Nvidia's H200 chips, the Information reported on Wednesday, citing two people with direct knowledge of the matter.… [+812 chars]","China plans to let top AI firms buy limited Nvidia H200 chips, the Information reports",H200
