event_id,date,category,company,product,location,source,url,summary,title,hardware_name
bfbe194a-e460-432b-bc8a-82bbf9bbe6f5,2026-07-08,GPU_RELEASE,Qualcomm,,,Wccftech,https://wccftech.com/better-binned-snapdragon-8-elite-gen-5-versions-headed-for-galaxy-z-fold-8-lineup/,"A timed-exclusive deal between Qualcomm and Samsung allowed the latter to equip its Galaxy S26 lineup with a non-binned version of the Snapdragon 8 Elite Gen 5 with higher CPU and GPU clock speeds, b… [+1830 chars]",Qualcomm’s Preferential Treatment Of Samsung Means The Galaxy Z Fold 8 Lineup Will Feature An Upgraded Snapdragon 8 Elite Gen 5 With Better AI Performance,
af7474ba-3156-4c87-a639-ef30bb4e1e5d,2026-07-08,GPU_RELEASE,Retreat,,Hollywood,TheWrap,https://www.thewrap.com/industry-news/business/sun-valley-allen-co-conference-2026-attendees-list/,"The biggest moguls from Hollywood and Silicon Valley have once again touched down in Sun Valley, Idaho for the annual Allen &amp; Co. conference.",Sun Valley 2026: Which Hollywood and Tech Moguls Made the Retreat?,
2fbb1b9f-d8f7-4743-87e9-e8058314de79,2026-07-08,GPU_RELEASE,NVIDIA,,China,Crypto Briefing,https://cryptobriefing.com/china-nvidia-h200-chips-limited-purchases/,"Beijing approved purchases for ten major tech companies, but not a single chip has actually been delivered yet China is opening a narrow door for its biggest AI companies to acquire Nvidia’s H200 chi… [+2278 chars]",China plans to allow top AI firms to buy limited Nvidia H200 chips,H200
8ee3d3ec-efcf-4612-9178-25dc60ad25d1,2026-07-08,GPU_RELEASE,NVIDIA,DeepSeek,China,Biztoc.com,https://biztoc.com/x/e20be0e52ed81448,"China is planning to let top AI companies buy a limited amount of Nvidia's H200 chips, the Information reported on Wednesday.Chinese officials have told Alibaba, ByteDance and DeepSeek in recent week… [+150 chars]","China plans to let top AI firms buy limited amount of Nvidia H200 chips, the Information reports",H200
48f9c904-b4da-4fa7-9368-52190b587521,2026-07-07,GPU_RELEASE,NVIDIA,,,Pypi.org,https://pypi.org/project/vlcaption/,"Auto-generate subtitles for whatever is playing in VLC. Fully local no
cloud APIs.",vlcaption added to PyPI,
ded41078-b3eb-4257-bb02-1e069685ad04,2026-07-07,GPU_RELEASE,NVIDIA,,,TechRadar,https://www.techradar.com/computing/gpu/attention-nvidia-gpu-users-you-need-to-be-wary-of-riser-cable-setups-especially-when-using-an-rtx-5090,<ul><li>A Reddit user's RTX 5090 has partially melted a PCIe riser cable</li><li>Some of the riser cable's material is stuck on the RTX 5090's backplate</li><li>It's not as serious a concern as conne… [+2746 chars],"Attention, Nvidia GPU users — you need to be wary of riser cable setups, especially when using an RTX 5090",
63970ac8-1d00-4f0e-aa3c-6dabb8db99c4,2026-07-07,GPU_RELEASE,Intel,,,The Times of India,https://economictimes.indiatimes.com/markets/us-stocks/news/kospi-tumbles-6-as-ai-investors-fear-rally-may-be-overblown-a-bigger-crash-coming-closer/articleshow/132229528.cms,"South Korean benchmark index Kospi tumbled more than 5% on Tuesday, with heavyweight chip stocks leading the decline as investors questioned whether record earnings driven by artificial intelligence … [+3421 chars]",Kospi tumbles 6% as AI investors fear rally may be overblown. A bigger crash coming closer?,
62dbaac3-9f84-4831-b96e-369f8f672388,2026-07-07,GPU_RELEASE,NVIDIA,,GB,Notebookcheck.net,https://www.notebookcheck.net/Lenovo-launches-new-16-inch-gaming-laptop-globally-with-Nvidia-GeForce-RTX-5070-12GB-and-240-Hz-OLED-display.1336035.0.html,"Previously, Lenovo sold the Legion Pro 5 16AFR10 with up to Nvidia's GeForce RTX 5070 8GB laptop GPU. Quietly, the company has updated its AMD-based 16-inch laptop to include the newer 12GB variant t… [+732 chars]",Lenovo launches new 16-inch gaming laptop globally with Nvidia GeForce RTX 5070 12GB and 240 Hz OLED display,
05ba67c4-ec24-4708-8387-4dea8e1e2f9a,2026-07-07,GPU_RELEASE,Samsung,,,Biztoc.com,https://biztoc.com/x/322cac22bfee533c,SEOUL -- Samsung Electronics' operating profit soared more than 19 times to 89.4 trillion won ($58.4 billion) in the second quarter from a year ago as a memory chip shortage continues due to rising d… [+147 chars],Samsung profit soars 19 times but shares slump 8% on oversupply worries,
3cf7f29d-9f36-41bf-b683-1bf5aa870f30,2026-07-07,GPU_RELEASE,NVIDIA,,Nvidia,Crypto Briefing,https://cryptobriefing.com/china-domestic-chips-nvidia-market-share/,Nvidia's China market share could collapse from 66% to 8% in just two years as Beijing pushes homegrown AI chips into state procurement Nine domestically developed AI processors were certified for Ch… [+1833 chars],Chinese firms shift from Nvidia to domestic silicon amid US tensions,
114c0504-c330-4153-a39c-90952719aaed,2026-07-07,GPU_RELEASE,Intel,,GB,Tom's Hardware UK,https://www.tomshardware.com/pc-components/save-nearly-usd2-000-on-this-rtx-5090-oled-gaming-laptop-right-now-massive-discount-on-powerhouse-16-inch-lenovo-rig-with-240hz-refresh-rate-32gb-ddr5-ram-2tb-ssd-and-a-24-core-intel-cpu-all-for-usd3-199,"This Lenovo OLED gaming laptop, fitted with the fastest laptop GPU you can find, is back on sale. You can pick up the Lenovo Legion Pro 7i gaming laptop for $3,199 right now at B&amp;H Photo, saving … [+4831 chars]","Save nearly $2,000 on this RTX 5090 OLED gaming laptop right now — massive discount on powerhouse 16-inch Lenovo rig with 240Hz refresh rate, 32GB DDR5 RAM, 2TB SSD, and a 24-core Intel CPU, all for $3,199",
a914f115-5e2a-46cc-a6c1-fbd751570e87,2026-07-07,GPU_RELEASE,NVIDIA,DeepSeek,China,Ibtimes.com.au,https://www.ibtimes.com.au/nvidia-shares-dip-chinese-ai-firm-deepseek-develops-chip-1871977,"Shares of Nvidia fell Tuesday, trading at $191.70, down $3.85, or 1.97 percent, after a Reuters report said Chinese artificial intelligence company DeepSeek is developing its own semiconductor for AI… [+6747 chars]",Nvidia Shares Fall Nearly 2% After Report Says China's DeepSeek Is Developing Its Own AI Inference Chip,
0382b89f-0cf1-469e-bf00-225a2f8dbbe6,2026-07-07,GPU_RELEASE,GPU,,STOI,Pypi.org,https://pypi.org/project/asem/,"A high-performance PyTorch library for computing speech quality metrics with GPU acceleration. Includes optimized implementations of PESQ, STOI, SDR, LSD, DNSMOS, and SpeechBERTScore.",asem added to PyPI,
8ffcbfdc-e2e8-4c4b-8bf4-b36c4e141340,2026-07-07,GPU_RELEASE,Intel,,,BusinessLine,https://www.thehindubusinessline.com/news/up-data-center-policy-2026-sends-strong-signal-to-market-experts/article71194394.ece,"The Uttar Pradesh (UP) Data Center Policy-2026s focus on artificial intelligence (Al)-ready capacity, Graphics Processing Unit (GPU) infrastructure, sustainability and regional development sends a st… [+3712 chars]",UP Data Center Policy 2026 sends strong signal to market: Experts,
d92441fa-84b6-4d1c-b0d3-2621b77765cb,2026-07-06,GPU_RELEASE,NVIDIA,,,Pypi.org,https://pypi.org/project/usv/,"GPU micro-benchmarking for AMD and NVIDIA, in the spirit of
asv but geared for GPU kernels. usv follows the familiar triton.testing.do_bench / torch.utils.benchmark
style - time a plain callable -… [+5477 chars]",usv added to PyPI,
7c8e9d3e-bfb8-41dd-89f9-850fb7806659,2026-07-06,GPU_RELEASE,NVIDIA,,,Crypto Briefing,https://cryptobriefing.com/nvidia-ceo-ai-1000x-compute-power/,"Jensen Huang's Stanford lecture lays out a future where agentic AI devours a thousand times more computation, and the GPU market is just getting started Jensen Huang walked into a Stanford University… [+2572 chars]","Nvidia CEO explains AI’s need for 1,000x more compute power",
115663e2-f20b-4f3c-a635-cbe8c2bb9e48,2026-07-06,GPU_RELEASE,GLSL,,,Blot.im,https://thiagolira.blot.im/_projects/fractetris/index.html,"What am I seeing? What you're seeing: one Game Boy Tetris screen — except every
 single pixel of it is also a complete Tetris game.","Show HN: Tetris where every pixel is another Tetris (23,040 games in GLSL)",
b8329d5d-040c-4f60-a7f0-4c2ae77f8dcf,2026-07-06,GPU_RELEASE,NTT Docomo,,Italy,TelecomTV,https://www.telecomtv.com/content/ai/what-s-up-with-ntt-docomo-fibercop-nokia-vodafonethree-55821/,In today’s industry news roundup: NTT Docomo develops a distributed GPU testbed that is connected using an all-photonics network; Italy’s Fibercop and Nokia are exploring the use of fibre infrastruct… [+6735 chars],"What’s up with… NTT Docomo, Fibercop & Nokia, VodafoneThree",
38e191d4-009b-4f12-b882-18bddc325f2b,2026-07-06,GPU_RELEASE,Samsung,,South Korea’s,24/7 Wall St.,https://247wallst.com/investing/2026/07/06/south-koreas-590b-chip-bet-has-semiconductor-etfs-buzzing-but-memory-cycles-have-burned-believers-before/,"Quick Read
<ul><li>SK Hynix and Samsung control roughly 90% of global HBM supply, giving EWY and FLKR outsized exposure to AI's most critical memory bottleneck. </li><li>DRAM surged 166% since Apri… [+7883 chars]","South Korea’s $590B Chip Bet Has Semiconductor ETFs Buzzing, but Memory Cycles Have Burned Believers Before",
5fa8bea1-8cce-4b09-b9fe-789ca274a19d,2026-07-05,GPU_RELEASE,,,,Americanthinker.com,https://www.americanthinker.com/blog/2026/07/elon-musk-s-answer-to-mortality/,"Ask most Silicon Valley billionaires what they think about death, and you’ll get some version of a declaration of war. Peter Thiel has funded life-extension research for years and has spoken openly a… [+4730 chars]",Elon Musk’s answer to mortality,
620b77b2-5f32-4e18-86d4-1f39c8121575,2026-07-05,GPU_RELEASE,OpenLight,,,Digitimes,https://www.digitimes.com/news/a20260703PD236/advantest-siph-testing-demand-production.html,"Keep me signed in
Some subscribers prefer to save their log-in information so they do not have to enter their User ID and Password each time they visit the site. To activate this function, check the… [+288 chars]",Advantest and OpenLight join forces on silicon photonics test platform for mass production,
e0248a85-ae17-4e97-828f-7dc55f2c17ae,2026-07-05,GPU_RELEASE,Intel,,,Biztoc.com,https://biztoc.com/x/e0a1003d044bf7a6,"Michael Burry made his name betting against the housing market before the 2008 crash. Now, ""The Big Short"" investor is turning that same skepticism toward artificial intelligence, and Micron Technolo… [+151 chars]",Michael Burry doubles down on AI chip bubble with Micron short,
4835c195-0fec-43f5-bb09-913b688e490c,2026-07-05,GPU_RELEASE,GPU,,,Biztoc.com,https://biztoc.com/x/63dfe04c416203ab,"Scrolling your phone, walking through *** store, or just grabbing one extra thing at checkout. Impulse buying can happen almost anywhere.",From Dutch ovens to TVs: Fourth of July deals worth shopping,
d886923a-ff18-4fc1-b948-fdff60bed77d,2026-07-05,GPU_RELEASE,Apple,,,Github.com,https://github.com/christopherkarani/Espresso,"Direct Neural Engine inference for transformers on Apple Silicon 4.76x faster than CoreML. Espresso compiles MIL programs straight to ANE silicon through reverse-engineered private APIs (_ANEClient,… [+7421 chars]",Train and run transformers directly on Apple's Neural Engine,
fc2f1c78-7cb2-47bb-9f8f-456af443a017,2026-07-04,GPU_RELEASE,Intel,,,Softpedia.com,https://drivers.softpedia.com/get/GRAPHICS-BOARD/INTEL/Intel-Core-i7-1255UL-CPU-Graphics-Driver-32-0-101-7088.shtml,"Intel has moved 11th - 14th Gen Intel Processor Graphics and related Intel Atom, Pentium, and Celeron processor graphics to a legacy software support model.The generic Intel driver provides users wit… [+3250 chars]",Intel Core i7-1255UL CPU Graphics Driver 32.0.101.7088,
36efd748-7720-457f-90e4-01f1fb0d55d3,2026-07-04,GPU_RELEASE,Intel,,,Softpedia.com,https://drivers.softpedia.com/get/GRAPHICS-BOARD/INTEL/Intel-Core-i7-1185G7-CPU-Graphics-Driver-32-0-101-7088.shtml,"Intel has moved 11th - 14th Gen Intel Processor Graphics and related Intel Atom, Pentium, and Celeron processor graphics to a legacy software support model.The generic Intel driver provides users wit… [+3250 chars]",Intel Core i7-1185G7 CPU Graphics Driver 32.0.101.7088,
a4cf7422-4ddb-415e-84a6-a4555a55011a,2026-07-04,GPU_RELEASE,Y-Combinator,,San Francisco,The Irish Times,https://www.irishtimes.com/business/2026/07/04/im-trying-to-build-the-next-stripe-irish-start-ups-accepted-into-top-silicon-valley-programme/,Two Irish start-ups have been accepted into the high-profile Silicon Valley Y-Combinator accelerator programme. The three-month programme in San Francisco runs four times a year and provides persona… [+2322 chars],‘I’m trying to build the next Stripe’: Irish start-ups accepted into top Silicon Valley programme,
71b45bd6-d970-4a5b-ad97-0ed9d63e7671,2026-07-04,GPU_RELEASE,NVIDIA,,,Biztoc.com,https://biztoc.com/x/96eb7aabb59ef502,"Michael Burry, the Scion Asset Management founder popularized in The Big Short, disclosed a new short position against Micron Technology (NASDAQ:MU | MU Price Prediction) in a Substack post dated Jul… [+152 chars]","Michael Burry Shorts Micron, Adding to His NVIDIA and Applied Materials Short Bets Against Chip Stocks",
fc4fbf0b-88d9-45fa-81e0-92c15bc5cfc9,2026-07-04,GPU_RELEASE,,,,Pypi.org,https://pypi.org/project/sparrow-engine-gpu/0.1.18/,"A required part of this site couldnt load. This may be due to a browser
 extension, network issues, or browser settings.",sparrow-engine-gpu 0.1.18,
bc36bb4a-bfd6-402b-9588-b1fe73c8ab25,2026-07-03,GPU_RELEASE,Non-AI Nifty,,South Korea &,The Times of India,https://economictimes.indiatimes.com/markets/stocks/news/non-ai-nifty-suddenly-beating-nasdaq-south-korea-taiwan-bourses-is-the-global-tech-trade-finally-reversing/articleshow/132151932.cms,"For months, India's stock market was the laggard everyone loved to ignore, dismissed as the anti-AI trade while Wall Streets Nasdaq, South Korea's Kospi and Taiwan's chip-heavy bourses roared ahead o… [+6503 chars]","Non-AI Nifty suddenly beating Nasdaq, South Korea & Taiwan bourses: Is the global tech trade finally reversing?",
2479e26c-9e1f-44c1-88c0-6ef63b3ea2a4,2026-07-03,GPU_RELEASE,Dell (NYSE,,,Biztoc.com,https://biztoc.com/x/b9bd86e49526db03,What Happened?Shares of computer hardware and IT solutions company Dell (NYSE:DELL) fell 8.6% in the afternoon session after AI-linked stocks pulled back amid fears that AI-driven chip demand may be … [+147 chars],Shares Are Plunging Today,
c74fdb53-e1ed-4876-8e3e-7d51fb4d89ee,2026-07-03,GPU_RELEASE,Tsinghua,,China,Digitimes,https://www.digitimes.com/news/a20260703PD217/ai-chip-startup-3d-technology-shanghai.html,"Keep me signed in
Some subscribers prefer to save their log-in information so they do not have to enter their User ID and Password each time they visit the site. To activate this function, check the… [+288 chars]",Tsinghua chip veteran’s US$1.8bn 3D AI chip startup targets China’s GPU gap,
1ba4da13-3fbc-4640-8a5d-bb67b7945796,2026-07-03,GPU_RELEASE,Steam Machine,,,Tom's Hardware UK,https://www.tomshardware.com/video-games/console-gaming/brand-new-steam-machine-hit-with-red-line-of-death-gpu-failure-after-playing-no-mans-sky-for-just-five-minutes-console-bricked-itself-following-update-in-incident-eerily-reminiscent-of-xbox-360-launch,"An unlucky gamer has taken to Reddit after their brand-new Steam Machine was hit with a ""red line of death"" after just 20 minutes of use. u/me_hill posted on the r/steammachine subreddit, saying that… [+3217 chars]",Brand new Steam Machine hit with 'red line of death' GPU failure after playing No Man's Sky for just five minutes — console 'bricked itself' following update in failure that echoes the horror of the Xbox 360's infamous RROD,
3fa6efa4-c4ee-42d7-967a-da45a8532399,2026-07-03,GPU_RELEASE,,,NEW YORK,Ibtimes.com.au,https://www.ibtimes.com.au/russell-2000-index-record-first-half-2026-1871787,"NEW YORK — The Russell 2000 Index, which just completed the strongest first half of any year since 1991, closed Thursday with a modest decline of 0.55%, settling at 2,996.11 and finishing just below … [+6507 chars]",Russell 2000 Slips Thursday After Its Best First Half Since 1991 as Chip Selloff Weighs on Small-Cap AI Names,
9e73897c-0220-47b9-8b8f-c9247a3c0166,2026-07-03,GPU_RELEASE,Nasdaq Drops,,NEW YORK,Ibtimes.com.au,https://www.ibtimes.com.au/nasdaq-dips-semiconductor-stocks-selloff-ai-revaluation-1871786,"NEW YORK — The Nasdaq Composite fell for a second consecutive session Thursday, declining 0.8% to close at 25,832.67 as semiconductor stocks endured their steepest two-day selloff since early June, e… [+6144 chars]",Nasdaq Drops 0.8% for Second Straight Session as AI Chip Stocks Suffer Worst Two-Day July Selloff in Months,
42b12121-b7d9-47e2-9ab7-524d2a42e7aa,2026-07-03,GPU_RELEASE,NVIDIA,,GB,Ozbargain.com.au,https://www.ozbargain.com.au/node/966251,"Limited stock, perfect working condition (new), with minor exterior / cosmetic box damage. NVIDIA Blackwell architecture is elevated by enhanced cooling and power delivery, fortified with rugged rei… [+187 chars]",[Damaged Box] ASUS RTX 5070Ti 16GB GDDR7 - White Edition - $1399 Delivered @ Hub by Triforce,Blackwell
faa97b14-ddce-470c-9322-5c8d73a3bedf,2026-07-02,GPU_RELEASE,Shruti,,Emergent,Marginalrevolution.com,https://marginalrevolution.com/marginalrevolution/2026/07/emergent-ventures-india-17th-cohort.html,"This is all from Shruti:
Aryamman Bhatia is part of the team building HackerFab IITB, an open-source student-built chip microfabrication lab. He received his grant to build what he hopes will become… [+5009 chars]","Emergent Ventures India, 17th cohort",
91f55a32-482d-4405-9527-c23a14decc90,2026-07-02,GPU_RELEASE,NVIDIA,,,Crypto Briefing,https://cryptobriefing.com/nvidia-motion-tokenization-robotics/,"The GPU giant's new approach treats human movement like language, training GPT-style models on motion data instead of text to create robots that can improvise physical behaviors. Nvidia has figured o… [+3204 chars]",Nvidia develops motion tokenization method that lets humanoid robots learn to recover from falls,
487cf0a7-df10-4595-9445-e925d6b805be,2026-07-02,GPU_RELEASE,NVIDIA,,Australia,Crypto Briefing,https://cryptobriefing.com/nvidia-revenue-share-cloud-ai-compute/,"The GPU giant is moving beyond hardware sales by taking a cut of cloud service revenue, starting with a six-year deal in Australia. Nvidia isn’t just selling shovels anymore.",Nvidia to share revenue with cloud providers under new AI compute partnership model,
13e4fe5b-aff1-4bc5-aa47-1e4c9cc5ddb9,2026-07-02,GPU_RELEASE,Samsung,,US,Crypto Briefing,https://cryptobriefing.com/japan-south-korea-semiconductor-stocks-tumble/,"SK Hynix, Samsung, and SoftBank lead the carnage as Asia's chip sector absorbs the shockwave from a brutal US tech rout The AI trade just got a reality check, and it echoed across the Pacific. Japane… [+2619 chars]",Japanese and South Korean semiconductor stocks tumble after US selloff,
21155539-242d-4493-8ec7-e6f09d4d7366,2026-07-02,GPU_RELEASE,Anthropic,,OpenAI,Biztoc.com,https://biztoc.com/x/65addaa4c41e779e,"Anthropic is working on its own AI chip, already holding talks with Samsung Electronics as a potential manufacturing partner, the Information reported on Thursday.The move comes soon after OpenAI rev… [+69 chars]",Anthropic said to work on its own AI chip,
0634287b-e673-42de-b483-7f20f2801fc4,2026-07-02,GPU_RELEASE,,,,Crypto Briefing,https://cryptobriefing.com/memory-chip-stocks-volatility-ai-rally/,"After a historic run that minted trillion-dollar companies, memory chipmakers saw their worst week since April 2025 as margin fears crept in. The memory chip sector just had the kind of week that mak… [+3030 chars]",Memory chip stocks experience notable volatility as AI-fueled rally hits turbulence,
2201f434-90d2-4499-8628-7e30ac395d87,2026-07-02,GPU_RELEASE,The Michael Burry Bear Case for AI Chips Is Back,,,Biztoc.com,https://biztoc.com/x/e0724194bd9c8855,"The post The Michael Burry Bear Case for AI Chips Is Back, and This GPU Math Problem Wont Go Away appeared first on 24/7 Wall St.. A CNBC guest flagged a critical depreciation mismatch for AI hardw… [+138 chars]","The ‘Michael Burry Bear Case’ for AI Chips Is Back, and This GPU Math Problem Won’t Go Away",
a324b4f6-bd33-45cb-b93d-94ddf5ec5202,2026-07-01,GPU_RELEASE,NVIDIA,,Nvidia,Biztoc.com,https://biztoc.com/x/30a9957c5500bef6,"The post Nvidias China Chip Tailwind Might Be Discounted appeared first on 24/7 Wall St..For some reason or another, shares of Nvidia (NASDAQ:NVDA) just cant seem to get going. For a Mag Seven stock,… [+142 chars]",Nvidia’s China Chip Tailwind Might Be Discounted,
6961e5ff-9c19-4d78-acf7-3e3dfb6cca2e,2026-07-01,GPU_RELEASE,Data Center D2C Coolants Market,,Dublin,GlobeNewswire,https://www.globenewswire.com/news-release/2026/07/01/3320788/28124/en/Data-Center-D2C-Coolants-Market-to-Reach-USD-1-30-Billion-by-2032-with-38-6-CAGR.html,"Dublin, July 01, 2026 (GLOBE NEWSWIRE) -- The ""Data Center Direct-to-Chip Coolants Market by Coolant Type, Cooling Technology, Data Center Type, and Region - Global Forecast to 2032"" has been added t… [+7331 chars]",Data Center D2C Coolants Market to Reach USD 1.30 Billion by 2032 with 38.6% CAGR,
7d93454a-27e9-4c74-b2a6-b1f58f9d5a95,2026-07-01,GPU_RELEASE,HBM,,,4sysops.com,https://4sysops.com/archives/memory-manufacturers-blame-aggressive-pricing-for-ongoing-global-chip-shortages/,"The current crisis is exacerbated by the shift toward High-Bandwidth Memory (HBM), which is essential for AI accelerators but consumes significantly more wafer area than standard modules. This transi… [+924 chars]",Memory manufacturers blame aggressive pricing for ongoing global chip shortages,
4ae418f7-107a-4d00-b2c4-85018f7d859e,2026-06-30,GPU_RELEASE,GPU,,,Prtimes.jp,https://prtimes.jp/main/html/rd/p/000000453.000073846.html,"CEO9235AIWeb3BCDC.Ai.GPU Data Center202615
Web3AIBCDC.Ai.GPU Data CenterAIWeb349
GPUAI
202618ZYRQ
2021REGiNa
2025REGiNa
2025Crypto Diver
2026BCDC.Ai.GPU Data Center 
AILLMAI
AIGPU20301,500
… [+820 chars]",（開示事項の経過・変更）売れるネット広告社グループ（9235）『BCDC.Ai.GPU Data Center株式会社』を設立及びAI・GPUインフラ事業の内容変更に関するお知らせ,
da619cf2-c220-46c5-8c2c-1dfc0c0c5653,2026-06-30,GPU_RELEASE,Intel,,Taiwan,Biztoc.com,https://biztoc.com/x/b6ae2baf76825a61,"The raids mark an expansion of Taiwan's first public crackdown on artificial intelligence chip diversion after years of pressure from Washington. This story appeared on japantimes.co.jp, 2026-06-30 … [+8 chars]",Taiwan raids Super Micro in widening China chip smuggling probe,
fecec9ca-3301-43d0-953d-5bbac41cd66d,2026-06-30,GPU_RELEASE,Global Hyperscale Data Center GPU Market,,Dublin,GlobeNewswire,https://www.globenewswire.com/news-release/2026/06/30/3319936/28124/en/Global-Hyperscale-Data-Center-GPU-Market-to-Reach-USD-81-95-Billion-by-2031-Driven-by-AI-and-ML-Workloads.html,"Dublin, June 30, 2026 (GLOBE NEWSWIRE) -- The ""Hyperscale Data Center Graphics Processing Unit (GPU) - Market Share Analysis, Industry Trends &amp; Statistics, Growth Forecasts (2026-2031)"" has been … [+7522 chars]","Global Hyperscale Data Center GPU Market to Reach USD 81.95 Billion by 2031, Driven by AI and ML Workloads",
d22e7e7e-3538-4364-b50b-42c4061a6b35,2026-06-30,GPU_RELEASE,GUC,,Taiwan,Crypto Briefing,https://cryptobriefing.com/guc-all-time-high-ai-cpu-demand/,"Taiwan's ASIC design specialist has more than tripled in value over the past year as hyperscalers race to build custom silicon Global Unichip Corp., the TSMC-affiliated chip design house that most pe… [+3010 chars]",GUC hits all-time high as AI demand boosts CPU estimates,
2da9ced7-e766-43b7-953d-20b4bf77aca5,2026-06-29,GPU_RELEASE,NVIDIA,,,Softpedia.com,https://drivers.softpedia.com/get/GRAPHICS-BOARD/NVIDIA/Quanta-NVIDIA-RTX-500-Ada-Generation-Laptop-GPU-Graphics-Driver-32-0-15-9166-for-Windows-10-Vibranium-64-bit.shtml,"The package provides the installation files for Quanta NVIDIA RTX 500 Ada Generation Laptop GPU Graphics Driver version 32.0.15.9166.If the driver is already installed on your system, updating (overw… [+2184 chars]",Quanta NVIDIA RTX 500 Ada Generation Laptop GPU Graphics Driver 32.0.15.9166 for Windows 10 Vibranium 64-bit,
7e37abe9-953f-40a0-9033-4ed33f42c3d7,2026-06-29,GPU_RELEASE,GPU,,,Microlink.io,https://microlink.io/blog/webgl-without-a-gpu,"The following examples show how to use the Microlink API with CLI, cURL, JavaScript, Python, Ruby, PHP &amp; Golang, targeting 'https://threejs.org/examples/webgl_animation_skinning_blending' URL wit… [+2669 chars]",WebGL Without a GPU,
8e433f8e-cb46-40d6-9366-a852f1211e3a,2026-06-29,GPU_RELEASE,NVIDIA,,,Softpedia.com,https://drivers.softpedia.com/get/GRAPHICS-BOARD/NVIDIA/Quanta-NVIDIA-RTX-1000-Ada-Generation-Laptop-GPU-Graphics-Driver-32-0-15-9166-for-Windows-11-version-25H2.shtml,"The package provides the installation files for Quanta NVIDIA RTX 1000 Ada Generation Laptop GPU Graphics Driver version 32.0.15.9166.If the driver is already installed on your system, updating (over… [+2185 chars]",Quanta NVIDIA RTX 1000 Ada Generation Laptop GPU Graphics Driver 32.0.15.9166 for Windows 11 version 25H2,
b87abda3-bff3-46c7-af00-0d0619cfee6d,2026-06-28,GPU_RELEASE,Intel,,,Biztoc.com,https://biztoc.com/x/920a07e884e213df,"As the global artificial intelligence (AI) boom puts intense pressure on data centre energy grids, some Chinese chipmakers are betting on highly efficient silicon carbide (SiC) semiconductors to help… [+139 chars]","As AI pushes data centres to breaking point, some Chinese chipmakers bet on SiC",
4dc85062-4e74-43da-9468-cb85cf8e1f97,2026-06-28,GPU_RELEASE,OpenAI,,Jalapeño,Biztoc.com,https://biztoc.com/x/a5ca68ac8c562f9d,"Find winning stocks in any market cycle. Join 7 million investors using Simply Wall St's investing ideas for FREE.- OpenAI and Broadcom have launched Jalapeño, a custom AI inference chip tailored for… [+146 chars]",And OpenAI Launch Jalapeño AI Chip In Nine Months,
