event_id,date,category,company,product,location,source,url,summary,title,hardware_name
aa01b982-1f1d-498b-bad1-c0c064d4fa2a,"Wed, 24 Ju",GPU_RELEASE,NVIDIA,,,NVIDIA Blog,https://blogs.nvidia.com/blog/nvidia-aws-ai-production-scale/,"Building AI systems at scale is demanding, requiring low-latency inference, fast vector search, strong GPU price-performance and infrastructure that can grow without multiplying operational complexity. NVIDIA’s latest work with Amazon Web Services (AWS) addresses each of those constraints.",NVIDIA and AWS Collaborate to Bring AI to Production at Scale,
b6a94bd6-61da-43ae-9a00-780806441df7,"Wed, 24 Ju",GPU_RELEASE,Intel,,,arXiv cs.LG,https://arxiv.org/abs/2606.23851,"arXiv:2606.23851v1 Announce Type: new 
Abstract: This work investigates the implementation of artificial intelligence and machine learning (AI/ML) for real-time monitoring in laser powder bed fusion (LPBF) additive manufacturing. We developed a binary image classification framework for distinguis...",Machine Learning Modeling for Real-Time Melt Pool Monitoring in Laser Powder Bed Fusion Additive Manufacturing: A Hybrid Approach,
bf005733-75d3-4b0d-a9c0-9fe0c9861928,"Wed, 24 Ju",GPU_RELEASE,OpenAI,,OpenAI,OpenAI Blog,https://openai.com/index/openai-broadcom-jalapeno-inference-chip,"OpenAI and Broadcom introduce Jalapeño, a custom AI chip built for LLM inference to improve performance, efficiency, and scale across AI systems.",OpenAI and Broadcom unveil LLM-optimized inference chip,
c8f1206f-6a0a-4f10-a194-9b6d69577c7d,"Wed, 17 Ju",GPU_RELEASE,Modal,,,arXiv cs.LG,https://arxiv.org/abs/2606.17118,"arXiv:2606.17118v1 Announce Type: new 
Abstract: Mixture-of-Experts Multimodal Large Language Models (MoE-MLLMs) offer remarkable performance but incur prohibitive GPU memory costs, making compression essential. Among PTQ methods, expert-level mixed-precision quantization has proven effective for...",MODE: Modality-Decomposed Expert-Level Mixed-Precision Quantization for MoE Multimodal LLMs,
a782f5ed-e65d-4bfd-9df8-86abc47fdedb,"Wed, 17 Ju",GPU_RELEASE,Bounded Power Transformation,Qwen,,arXiv cs.LG,https://arxiv.org/abs/2606.17199,"arXiv:2606.17199v1 Announce Type: new 
Abstract: Standard on-policy distillation (OPD) for large language models estimates the reverse-KL objective using student-sampled tokens, yielding an unbiased single-sample Monte Carlo estimator that avoids vocabulary-wide computation. However, we show that...",PowerOPD: Stabilizing On-Policy Distillation with Bounded Power Transformation,
a4214870-40c5-4dae-91e3-a24bd5684361,"Tue, 23 Ju",GPU_RELEASE,CRN,,,arXiv cs.LG,https://arxiv.org/abs/2606.20889,"arXiv:2606.20889v1 Announce Type: new 
Abstract: Estimating causal effects in industrial time series requires handling temporal dynamics, time-varying treatments, and unobserved confounders. Existing causal foundation models (CausalPFN, CausalFM) operate only on static cross-sectional data; neura...",Temporal Causal Prior-Data Fitted Networks for Panel Data with Learned Reliability Signals,
9b8fbd09-335f-40ab-925c-1e06159fe98a,"Tue, 16 Ju",GPU_RELEASE,NVIDIA,,,arXiv cs.LG,https://arxiv.org/abs/2606.14934,"arXiv:2606.14934v1 Announce Type: new 
Abstract: This work introduces the Separable Neural Architecture (SNA), a function representational class combining neural approximation with tensor decomposition. The SNA decouples localized coordinate functions (atoms) from global interactions governed by ...",Separable Neural Architectures as Physical World Models: from Mathematical Theory to Applications,A100
664627e9-ac52-46ed-9719-966f472ba703,"Tue, 16 Ju",GPU_RELEASE,the Rational Sparse Autoencoder,,,arXiv cs.LG,https://arxiv.org/abs/2606.14990,"arXiv:2606.14990v1 Announce Type: new 
Abstract: Sparse autoencoders (SAEs) are standard tools for mechanistic interpretability, but current SAE families are constrained by fixed encoder nonlinearities such as ReLU, JumpReLU, and TopK. This hard-codes a particular sparsity mechanism into the mode...",Rational Sparse Autoencoder,
ca75fc59-3cc1-4dab-a0cc-64ed1234d039,"Tue, 16 Ju",GPU_RELEASE,NVIDIA,,,NVIDIA Blog,https://blogs.nvidia.com/blog/blackwell-mlperf-training-6-0/,"Every breakthrough AI model starts the same way: with a training run. The infrastructure running those training jobs shapes everything: how fast teams can iterate, what scale of model they can build and whether those jobs complete reliably.","Fastest, Largest, Strongest: NVIDIA Blackwell Sweeps MLPerf Training 6.0",Blackwell
1c5cd391-faa2-41ea-9b1d-1a0e8e47f602,"Tue, 02 Ju",GPU_RELEASE,NVIDIA,,,NVIDIA Blog,https://blogs.nvidia.com/blog/jetson-agentic-ai-physical-world/,"Agentic AI is getting physical. At COMPUTEX on Tuesday, NVIDIA announced NVIDIA JetPack 7.2 and NVIDIA NemoClaw support on NVIDIA Jetson.",NVIDIA Jetson Brings Agentic AI to the Physical World,
890b90ec-bf17-439e-bcce-6792a1879232,"Thu, 25 Ju",GPU_RELEASE,Hitchhiker's Guide,,,arXiv cs.AI,https://arxiv.org/abs/2606.24937,"arXiv:2606.24937v1 Announce Type: new 
Abstract: The Hitchhiker's Guide to Agentic AI is a comprehensive practitioner's reference for building autonomous AI systems. The book covers the full stack from first principles to production deployment, organized around a central thesis: building great ag...",The Hitchhiker's Guide to Agentic AI: From Foundations to Systems,
205290d2-670a-4f68-a66e-8356d70aa42b,"Thu, 25 Ju",GPU_RELEASE,Intel,,,arXiv cs.AI,https://arxiv.org/abs/2606.25532,"arXiv:2606.25532v1 Announce Type: new 
Abstract: Artificial intelligence increasingly drives automated scientific discovery, yet contemporary generalist agents lack physical grounding, frequently hallucinating hardware-incompatible designs. Here, we present a physically grounded, multi-agent disc...",Agentic evolution of physically constrained foundation models,A100
292d99bb-4066-45d8-8c5a-8ad541184adc,"Thu, 21 Ma",GPU_RELEASE,Google DeepMind,,,Google DeepMind,https://deepmind.google/blog/were-launching-the-google-deepmind-accelerator-program-in-asia-pacific-to-tackle-environmental-risks/,We’re launching the Google DeepMind Accelerator program in Asia Pacific to tackle environmental risks,We’re launching the Google DeepMind Accelerator program in Asia Pacific to tackle environmental risks,
a786838b-6f97-4f8f-acc3-39df85c35864,"Mon, 22 Ju",GPU_RELEASE,Amazon,,,AWS ML Blog,https://aws.amazon.com/blogs/machine-learning/running-comfyui-workflows-on-amazon-sagemaker-ai-processing-jobs/,"In this post, we walk you through how to deploy ComfyUI workflows on Amazon SageMaker AI processing jobs to generate hundreds of high-quality images in a single batch. You learn how to set up the infrastructure using AWS Cloud Development Kit (AWS CDK), configure GPU-accelerated processing, and a...",Running ComfyUI workflows on Amazon SageMaker AI processing jobs,
18a3dca6-3bfd-4b01-a59c-448ee4ef88ac,"Mon, 15 Ju",GPU_RELEASE,,,,arXiv cs.LG,https://arxiv.org/abs/2606.13740,"arXiv:2606.13740v1 Announce Type: new 
Abstract: Diffusion large language models (dLLMs) accelerate generation by denoising multiple tokens in parallel, making them attractive for latency-sensitive mobile inference. However, repeated denoising introduces substantial computation on smartphones.",Efficient On-Device Diffusion LLM Inference with Mobile NPU,
3ed44fe9-667d-4678-9403-c49639c1f48d,"Mon, 15 Ju",GPU_RELEASE,,,,arXiv cs.LG,https://arxiv.org/abs/2606.13742,"arXiv:2606.13742v1 Announce Type: new 
Abstract: The ability to resolve complex physical phenomena with high fidelity and at low computational cost is central to addressing key challenges in modern engineering. A prime example lies in hypersonic flows, where the precise prediction of the full flo...",A fully GPU-based workflow for building physics emulators of hypersonic flows,
cda27498-2720-4fdc-aa51-5687dda1a861,"Mon, 15 Ju",GPU_RELEASE,,,,arXiv cs.LG,https://arxiv.org/abs/2606.13767,"arXiv:2606.13767v1 Announce Type: new 
Abstract: Low-rank adaptation (LoRA) and its variants provide a memory- and compute-efficient alternative to full fine-tuning of pre-trained models. However, questions remain about the comparative generalizability of these approaches and how the structural r...",Beyond LoRA: Is Sparsity-Induced Adaptation Better?,
a5764951-7c4b-40af-a348-bab66e5b47a3,"Mon, 08 Ju",GPU_RELEASE,NVIDIA,,,NVIDIA Blog,https://blogs.nvidia.com/blog/nvidia-and-lg-group-ai-factory/,"NVIDIA and LG Group are building an AI factory to accelerate LG Group’s next wave of AI-driven businesses, spanning robotics, autonomous driving, data center technologies and GPU cloud services. The AI factory will provide LG Group with accelerated computing infrastructure to train, simulate, val...","NVIDIA and LG Group Build an AI Factory to Advance Physical AI, Mobility and AI Infrastructure",
14518ac4-a2ba-493d-95a4-c8165a33626c,"Fri, 19 Ju",GPU_RELEASE,NVIDIA,,,arXiv cs.LG,https://arxiv.org/abs/2606.19365,"arXiv:2606.19365v1 Announce Type: new 
Abstract: Diffusion models have become essential for high-fidelity 3D MRI synthesis, yet their deployment remains constrained by substantial GPU resource demands arising from hundreds of U-Net evaluations per sample and a highly heterogeneous kernel behavior...",Performance Analysis and Optimization of 3D Generative Diffusion Models across GPU Architectures,A100
8c468cbb-ef09-4ee7-9848-0c4b7ba50a24,"Fri, 19 Ju",GPU_RELEASE,,,,arXiv cs.LG,https://arxiv.org/abs/2606.19370,"arXiv:2606.19370v1 Announce Type: new 
Abstract: Self-play reinforcement learning has recently emerged as a way to train driving policies without any human data. It uses cheap, large-scale simulations to substitute expensive, large-scale human driving demonstrations.",Human-like autonomy emerges from self-play and a pinch of human data,
a1e855bd-82cb-4168-b2d4-f32d8a7b25f2,"Fri, 19 Ju",GPU_RELEASE,Emyx,,,arXiv cs.LG,https://arxiv.org/abs/2606.19377,"arXiv:2606.19377v1 Announce Type: new 
Abstract: Computational enzyme design requires generating proteins that scaffold catalytic residues and ligands, a task that demands both geometric accuracy and structural diversity from the underlying generative model. Current all-atom generators inherit ex...",Emyx: Fast and efficient all-atom protein generation,
674ab0dc-776f-4041-8076-4952eaa91e92,"Fri, 12 Ju",GPU_RELEASE,NVIDIA,,,NVIDIA Blog,https://blogs.nvidia.com/blog/nvidia-blackwell-agentperf-artificial-analysis/,"AgentPerf from Artificial Analysis, the industry’s first agentic AI benchmark, gives developers, enterprises and infrastructure providers a clear way to compare systems for agentic AI. In the first round of published results, the NVIDIA Blackwell Ultra NVL72 platform delivers leading performance ...",NVIDIA Blackwell Leads on First Agentic AI Infrastructure Benchmark,Blackwell Ultra
9c0731b7-276a-4981-8a03-583446a96bf2,2026-06-24,GPU_RELEASE,OpenAI,,OpenAI,The Verge AI,https://www.theverge.com/ai-artificial-intelligence/955939/openai-reveals-its-first-ai-processor-jalapeno,"OpenAI has just revealed a new ""intelligence processor"" chip for AI servers made in partnership with Broadcom. The chip, called Jalape&#241;o, is designed to power current and future large language models, according to an announcement on Wednesday.",OpenAI reveals its first AI processor: Jalapeño,
697d54d6-1302-4f0c-bb9d-a84a1b4bd81b,2026-06-24,GPU_RELEASE,NVIDIA,,China,Wccftech,https://wccftech.com/china-fails-to-stop-tech-firms-from-using-nvidia-chips-banned-blackwell-gpus-hit-2x-price-on-black-market/,China has failed tremendously in stopping its tech firms from using banned NVIDIA Blackwell GPUs that are being sold on the black market for double the price. The NVIDIA Blackwell GPU family has bee… [+3414 chars],"China Fails To Stop Tech Firms From Using NVIDIA Chips, As Banned DGX & RTX “Blackwell” GPUs Hit 2x Price on Black Market",Blackwell
d150e7cb-313c-4af1-aaf2-81c9822f4d92,2026-06-24,GPU_RELEASE,ByteDance Qualcomm,,China,The Times of India,https://economictimes.indiatimes.com/tech/technology/qualcomm-in-talks-to-provide-custom-chip-design-services-to-bytedance/articleshow/131955137.cms,"Qualcomm is in talks to provide chip-design services to China's ByteDance, four people familiar with the matter said, as the US company seeks to reduce dependence on the smartphone market, its bigges… [+2015 chars]",Qualcomm in talks to provide custom chip-design services to ByteDance,
b8a8fad5-76a1-4835-aee3-ec289cfc733e,2026-06-24,GPU_RELEASE,NVIDIA,,,Prtimes.jp,https://prtimes.jp/main/html/rd/p/000000631.000012662.html,":
<ul><li>NVIDIA Vera Rubin HPC 
</li><li>NVIDIA Vera Rubin Vera CPU AI 
</li><li> Vera Rubin 
</li><li> BullDell TechnologiesGIGABYTEHPESupermicro 1 144 GPU Vera Rubin 
</li></ul>2026 6 22 - IS… [+917 chars]",NVIDIA Vera Rubin 、科学分野向けに世界トップクラスのスーパーコンピューターを提供,
a1adef10-3c0d-4cb6-8ed3-f58df717fdbf,2026-06-24,GPU_RELEASE,Intel,,,CNET,https://japan.cnet.com/release/31181675/,"SEMABIZMordor IntelligenceGPU 2026-2031-Japan Data Center GPU - Market Share Analysis, Industry Trends &amp; Statistics, Growth Forecasts (2026 - 2031)2026624
SEMABIZMordor Intelligence
GPU2025268,… [+1294 chars]",株式会社SEMABIZ「日本のデータセンター向けGPU市場シェア分析、業界動向と統計、成長予測 2026-2031年」市場調査レポートの出版・販売開始のご案内,
476de675-1fce-4307-af89-9cd7dd2dec12,2026-06-24,GPU_RELEASE,NVIDIA,,,Softpedia.com,https://drivers.softpedia.com/get/GRAPHICS-BOARD/INTEL/Quanta-NVIDIA-GeForce-RTX-3050-Ti-Laptop-GPU-Graphics-Driver-32-0-15-9166-for-Windows-11-version-25H2.shtml,"The package provides the installation files for Quanta NVIDIAGeForce RTX 3050 Ti Laptop GPU Graphics Driver version 32.0.15.9166.If the driver is already installed on your system, updating (overwrite… [+2180 chars]",Quanta NVIDIA GeForce RTX 3050 Ti Laptop GPU Graphics Driver 32.0.15.9166 for Windows 11 version 25H2,
1b45a98c-81c9-4907-89bc-854dc02073bf,2026-06-24,GPU_RELEASE,NVIDIA,,,Softpedia.com,https://drivers.softpedia.com/get/GRAPHICS-BOARD/INTEL/Quanta-NVIDIA-GeForce-RTX-3050-Ti-Laptop-GPU-Graphics-Driver-32-0-15-9166-for-Windows-11.shtml,"The package provides the installation files for Quanta NVIDIAGeForce RTX 3050 Ti Laptop GPU Graphics Driver version 32.0.15.9166.If the driver is already installed on your system, updating (overwrite… [+2180 chars]",Quanta NVIDIA GeForce RTX 3050 Ti Laptop GPU Graphics Driver 32.0.15.9166 for Windows 11,
9aa92fb5-3114-450e-9602-c55bd982215c,2026-06-24,GPU_RELEASE,NVIDIA,,,Crypto Briefing,https://cryptobriefing.com/nvidia-cheaper-than-semiconductor-sector-tony-zhang/,"The OptionsPlay chief strategist sees Nvidia's forward multiples as attractive relative to industry peers, signaling a potential buying opportunity during the AI chip pullback Nvidia, the company tha… [+2068 chars]","Nvidia trades cheaper than semiconductor sector, says Tony Zhang",
4308a5f8-d4dc-490a-8666-d61c7e66c26c,2026-06-24,GPU_RELEASE,Amazon,,,Fortune,https://fortune.com/2026/06/24/amazon-web-services-ceo-matt-garman-bullish-on-entry-level-gen-z-talent-hiring-thousands-interns-graduates/,"As Silicon Valley debates whether AI will replace millions of office workers, one of the executives building the technologys underlying infrastructure says Gen Z shouldnt buy into the apocalyptic job… [+5262 chars]","Amazon exec says AI won’t wipe out white-collar jobs—and is hiring 11,000 grads and interns, and has more developers than 2 years ago to prove it",
3a16a1d3-dd77-4ea4-8ddd-7cd99560f3e2,2026-06-24,GPU_RELEASE,NVIDIA,,China,The Next Web,https://thenextweb.com/news/china-lineshine-supercomputer-top500-no-us-chips/,A supercomputer in Shenzhen just topped the world rankings for the first time since 2017. The headline is the speed.,China takes the supercomputer crown without US chips,
732b32e6-54da-409a-8580-a783250e4942,2026-06-24,GPU_RELEASE,NVIDIA,Llama,,Askubuntu.com,https://askubuntu.com/questions/1567946/rootless-podman-compose-ollama-container-cant-access-nvidia-gpu-on-ubuntu-24-04,"It would seem the issue is two-fold,
1. The CDI configuration was made by root, and it's also possible that I as the user, don't have access to it.","Rootless podman-compose Ollama container can't access NVIDIA GPU on Ubuntu 24.04, but native Ollama works",
02fafd52-31d8-42a9-a59c-261de8cffdec,2026-06-24,GPU_RELEASE,DDN Launches AI400X3M,,Dynamo,Storagereview.com,https://www.storagereview.com/news/ddn-launches-ai400x3m-and-dynamo-integrated-kv-cache-acceleration-at-isc-2026,"At ISC 2026, DDN announced a broad expansion of its AI and HPC data platform portfolio, introducing new hardware, software, and platform capabilities designed to improve GPU utilization, accelerate A… [+7002 chars]",DDN Launches AI400X3M and Dynamo-Integrated KV Cache Acceleration at ISC 2026,
012266cb-109b-4332-b050-719ba66f35db,2026-06-24,GPU_RELEASE,Anthropic,Claude,,Biztoc.com,https://biztoc.com/x/31341746fa9b8f92,"Memory chip giant Micron (MU) and the maker of the Claude generative AI platform, Anthropic, have inked a partnership wherein the latter will make use of the former's infrastructure to strengthen its… [+140 chars]",Micron Shares Pop on Partnership With Anthropic. How to Play MU Stock Here,
66e5bd26-f554-4dba-9621-3f2ae627624f,2026-06-23,GPU_RELEASE,US Stocks,,U.S.,The Times of India,https://economictimes.indiatimes.com/markets/us-stocks/news/us-stocks-today-chip-stocks-plunge-but-bargain-hunters-stem-losses-in-other-tech-names/articleshow/131941564.cms,"U.S. chip stocks stumbled on Tuesday, but the broader market's initial slump brought out bargain-hunting investors, stemming the falloff in other companies central to the AI infrastructure rally that… [+3510 chars]","US Stocks Today | Chip stocks plunge, but bargain-hunters stem losses in other tech names",
e45a9273-8c77-40c9-9a77-e92e67ecdd07,2026-06-23,GPU_RELEASE,Intel,,,The Times of India,https://economictimes.indiatimes.com/markets/us-stocks/news/us-stocks-ai-chip-slump-extends-on-wall-st-as-sandisk-sinks-12-micron-drops-9-and-amd-falls-5/articleshow/131941559.cms,"A sharp selloff swept through semiconductor stocks on Wall Street on Tuesday, wiping out gains across some of the biggest beneficiaries of the artificial intelligence boom as investors reassessed lof… [+2644 chars]","US Stocks | AI chip slump extends on Wall St as SanDisk sinks 12%, Micron drops 9% and AMD falls 5%",
469a87f3-b681-4195-a82f-ac8ede2aebd7,2026-06-22,GPU_RELEASE,Intel,,US,The Times of India,https://economictimes.indiatimes.com/markets/us-stocks/news/us-stock-market-micron-earnings-to-test-strength-of-ai-fuelled-wall-street-rally/articleshow/131900960.cms,"The remarkable rally in U.S. equities, powered largely by artificial intelligence-related investments, faces its next major test as investors await quarterly earnings from Micron Technology.",US Stock Market: Micron earnings to test strength of AI-fuelled Wall Street rally,
1dea2124-eef6-4c41-8ec7-e6d4555378b9,2026-06-22,GPU_RELEASE,RealSense,,,Linuxgizmos.com,https://linuxgizmos.com/realsense-d585-pro-targets-robotics-with-wide-fov-sensing-and-edge-processing/,"TwitterFacebook LinkedInRedditPinterestEmail
The RealSense D585 Pro is a stereo depth camera for robotics and industrial vision applications that uses the companys Gen 5 vision processor. The camera… [+2674 chars]",RealSense D585 Pro targets robotics with wide-field sensing and edge processing,
c685ff47-e631-4bcd-96ef-59f71ab2350b,2026-06-22,GPU_RELEASE,NVIDIA,,,Ibtimes.com.au,https://www.ibtimes.com.au/nvidia-stock-steady-ai-partnerships-products-1871114,"Nvidia shares traded roughly flat at $210.14, down a modest 0.26%, on Monday morning, holding near recent levels as the AI chip giant continued rolling out a steady stream of product and partnership … [+6775 chars]","Nvidia Stock Steady Near $210 as Robotics, Supercomputer Announcements Roll Out",
ac3cdc40-e49c-4184-93a0-1008f0f1dd76,2026-06-21,GPU_RELEASE,Digital Technologies,,,Biztoc.com,https://biztoc.com/x/113a0589d3bbb5df,Why HIVE Digital Technologies (TSX:HIVE) Is Up 26.8% After Major AI GPU Cloud Deal And Data Center Buy- HIVE Digital Technologies recently received approval to acquire the 32 MW Big Boden data center… [+150 chars],Why HIVE Digital Technologies (TSX:HIVE) Is Up 26.8% After Major AI GPU Cloud Deal And Data Center Buy,
ecb17ed6-e3d9-49cc-b286-1a68675fb81b,2026-06-20,GPU_RELEASE,Intel,,U.S.,The Times of India,https://economictimes.indiatimes.com/markets/us-stocks/news/wall-street-week-ahead-investors-see-micron-earnings-as-pulse-check-of-ai-rally-momentum/articleshow/131869790.cms,"Investors are seeking signs that the U.S. stock market rally fueled by artificial intelligence has more life left in it, and the upcoming Micron Technology earnings will check the pulse of chip deman… [+3284 chars]",Wall Street Week Ahead: Investors see Micron earnings as pulse check of AI rally momentum,
3056b956-29ea-4781-8e99-82579842ffbb,2026-06-20,GPU_RELEASE,NVIDIA,,,Softpedia.com,https://drivers.softpedia.com/get/GRAPHICS-BOARD/NVIDIA/Quanta-NVIDIA-RTX-A5500-Laptop-GPU-Graphics-Driver-32-0-15-9166-for-Windows-11.shtml,"The package provides the installation files for Quanta NVIDIA RTX A5500 Laptop GPU Graphics Driver version 32.0.15.9166.If the driver is already installed on your system, updating (overwrite-installi… [+2171 chars]",Quanta NVIDIA RTX A5500 Laptop GPU Graphics Driver 32.0.15.9166 for Windows 11,
d0414ebc-3d24-4da4-8cdd-59a44391e997,2026-06-20,GPU_RELEASE,PCB,,,TweakTown,https://www.tweaktown.com/news/112274/enthusiast-attempts-to-install-second-12v-2x6-connector-on-rtx-5090-is-rewarded-with-a-hole-punched-through-the-pcb/index.html,An enthusiastic RTX 5090 owner attempted to install a second 12V-2x6 power connector on their flagship Blackwell graphics card in a desperate attempt to reduce the chance of the connector melting. Un… [+2384 chars],"Enthusiast attempts to install second 12V-2x6 connector on RTX 5090, is rewarded with a hole punched through the PCB",Blackwell
e2dbffb8-924a-43a8-b118-2e585acda8c7,2026-06-20,GPU_RELEASE,NVIDIA,,,Softpedia.com,https://drivers.softpedia.com/get/GRAPHICS-BOARD/NVIDIA/Quanta-NVIDIA-RTX-A5500-Laptop-GPU-Graphics-Driver-32-0-15-9166-for-Windows-10-version-1803-64-bit.shtml,"The package provides the installation files for Quanta NVIDIA RTX A5500 Laptop GPU Graphics Driver version 32.0.15.9166.If the driver is already installed on your system, updating (overwrite-installi… [+2171 chars]",Quanta NVIDIA RTX A5500 Laptop GPU Graphics Driver 32.0.15.9166 for Windows 10 version 1803 64-bit,
0e078deb-f00d-4ad9-a8f2-5b431b9c06a5,2026-06-20,GPU_RELEASE,BI Tech Memo,,,Business Insider,https://www.businessinsider.com/spacex-anthropic-openai-engineers-filthy-rich-2026-6#article,"A SpaceX rocket firingSpaceX
<ul><li>A version of this story originally appeared in the BI Tech Memo newsletter.</li><li>Sign up for the weekly BI Tech Memo newsletter here.</li></ul>New Levels.fyi … [+1016 chars]",The math behind Silicon Valley's millionaire factory,
583b20f9-6ea1-47ce-b830-b692632cf70a,2026-06-20,GPU_RELEASE,NVIDIA,,,Softpedia.com,https://drivers.softpedia.com/get/GRAPHICS-BOARD/NVIDIA/Quanta-NVIDIA-RTX-A5500-Laptop-GPU-Graphics-Driver-32-0-15-9166-for-Windows-10-64-bit.shtml,"The package provides the installation files for Quanta NVIDIA RTX A5500 Laptop GPU Graphics Driver version 32.0.15.9166.If the driver is already installed on your system, updating (overwrite-installi… [+2171 chars]",Quanta NVIDIA RTX A5500 Laptop GPU Graphics Driver 32.0.15.9166 for Windows 10 64-bit,
d0760c2d-4f85-43f9-b9ae-cdfd375a61bb,2026-06-20,GPU_RELEASE,NVIDIA,,,Softpedia.com,https://drivers.softpedia.com/get/GRAPHICS-BOARD/NVIDIA/Quanta-NVIDIA-RTX-A5500-Laptop-GPU-Graphics-Driver-32-0-15-9166-for-Windows-10-Vibranium-64-bit.shtml,"The package provides the installation files for Quanta NVIDIA RTX A5500 Laptop GPU Graphics Driver version 32.0.15.9166.If the driver is already installed on your system, updating (overwrite-installi… [+2171 chars]",Quanta NVIDIA RTX A5500 Laptop GPU Graphics Driver 32.0.15.9166 for Windows 10 Vibranium 64-bit,
5d358f44-b2f9-4933-847c-fcf068eff2ae,2026-06-19,GPU_RELEASE,Digital Secures,,,newsBTC,http://www.newsbtc.com/news/hive-digital-bell-canada-nvidia-blackwell-gpu-deal/,"HIVE Digital Secures $220M Sovereign AI GPU Deal With Bell Canada
<ul><li>HIVEs BUZZ HPC has closed a three-year sovereign AI GPU cloud contract valued at about $220 million.</li><li>The deal brings… [+3505 chars]",HIVE Digital Secures $220M Sovereign AI GPU Deal With Bell Canada,
22074b05-6ce8-49c9-8d70-b2ea2a3c7165,2026-06-19,GPU_RELEASE,NVIDIA,,overwrit,Softpedia.com,https://drivers.softpedia.com/get/GRAPHICS-BOARD/NVIDIA/Quanta-NVIDIA-GeForce-RTX-3050-4GB-Laptop-GPU-Graphics-Driver-32-0-15-9166-for-Windows-11-version-22H2.shtml,"The package provides the installation files for Quanta NVIDIAGeForce RTX 3050 4GB Laptop GPU Graphics Driver version 32.0.15.9166.If the driver is already installed on your system, updating (overwrit… [+2181 chars]",Quanta NVIDIA GeForce RTX 3050 4GB Laptop GPU Graphics Driver 32.0.15.9166 for Windows 11 version 22H2,
c42f04e5-376d-40b5-832e-2d3785ef9d49,2026-06-19,GPU_RELEASE,NVIDIA,,overwrit,Softpedia.com,https://drivers.softpedia.com/get/GRAPHICS-BOARD/NVIDIA/Quanta-NVIDIA-GeForce-RTX-3050-4GB-Laptop-GPU-Graphics-Driver-32-0-15-9166-for-Windows-10-version-1803-64-bit.shtml,"The package provides the installation files for Quanta NVIDIAGeForce RTX 3050 4GB Laptop GPU Graphics Driver version 32.0.15.9166.If the driver is already installed on your system, updating (overwrit… [+2181 chars]",Quanta NVIDIA GeForce RTX 3050 4GB Laptop GPU Graphics Driver 32.0.15.9166 for Windows 10 version 1803 64-bit,
